,Yakima Gold,"Bittering, Aroma",8.8,10.5,4.3,5,21,23,US,,1.9,2.3,45,50,21,25,6,8,9,10,,,,,,,Yakima Goldings,,"Developed by Washington State University and released in 2013, Yakima Gold has excellent mild bittering and aroma properties and makes for a great dual-use hop. It descends from Early Cluster and a wild Slovenian male, so it may display some Saaz-like qualities."
,Yeoman,"Bittering, Aroma",12,16,4,5,25,,UK,Retains 80% alpha acid after 6 months storage at 20ºC (68ºF),1.7,2.4,48,,20,,10,,,,,,,,,,Wye Yeoman,,"Bred at Wye College in the 1970’s, Yeoman is no longer available on the commercial brewing market, but instead has made its mark in breeding other notable varieties. It is responsible for Pioneer and also the Australian hop Super Pride, which has since superseded Pride of Ringwood."
,Bullion 10A,Bittering,8,13.8,2.8,6.9,42,,,Poor,1.55,,63,,12,,7,,0.2,,,,,,"Columbus, Northern Brewer, Galena, Chinook, Brewer’s Gold","Stout, Doppelbock, Barley Wine, Imperial Stout",,Same as Bullion,"Though technically still Bullion, Bullion 10A is a heat-treated and meristem-tip cultured version of the original English variety. Developed by the USDA and released in 1972, it was retired from production in the US in 1985 along with the original Bullion following the introduction of super-alpha varieties."
,Dunav,Aroma,5.1,9.6,2.8,4.6,30,,Serbia,Retains 74% alpha acid after 6 months storage at 20ºC (68ºF),1.19,,19,,19,,6,,6.2,,,,,,,,,,"Originating in the former Yugoslavia, Dunav was bred in the 1960’s with the intent of replacing the low-yielding Backa. However, it has never truly been accepted commercially and remains in limited production in Serbia. It is a triploid cross from Northern Brewer, Styrian Golding and a wild male. Sibling to Neoplanta and Vojvodina, Dunav tends to exhibit a variable alpha acid rate but enjoys good storage stability."
,Greensburg,"Bittering, Aroma",5.2,,7.2,,,,US,,,,,,,,,,,,,,,,,,,"Fruity, woody aromas",Greensburg is an American aroma hop grown mainly in southern Idaho and is used primarily by microbreweries. It has both fruity and woody notes. Its beta acids actually supersede its alpha acid content. Best when added to the end of a boil for aroma.
,Opal,"Bittering, Aroma",13,14,3.5,5.5,28,34,Germany,Retains 60%-70% alpha acid after 6 months storage at 20ºC (68ºF),0.8,1.3,30,45,20,25,9,10,0,1,,,,,"East Kent Golding, Styrian Golding","Pilsner, Hefeweizen, Helles, Lager, Brown Ale, Saison, Tripel, Wheat, Kolsch, Blonde Ale",,"Flavors of spice and citrus, slight sweetness","Developed by the Hull Hops Research Institute in Germany, Opal hops feature a clean aroma and flavor profile of spice and citrus with a hint of sweetness. It was released to the brewing world in 2004 and is considered useful for both aroma and bittering."
,Smaragd,"Bittering, Aroma",4,6,3.5,5.5,13,18,Germany,Retains 60%-70% alpha acid after 6 months storage at 20ºC (68ºF),0.7,1.7,20,40,30,50,9,14,1,,,,,,,"Ale, Amber","Emerald, German Emerald","Predominantly fruity aroma with bold floral notes, flavors of earth and spice","Smaragd is another interesting hop to come out of the Hop Research Institute in Hüll, Germany. Bred with the purpose of creating a more disease resistant alternative to Hallertau Mittelfrüh, it was released for large-scale production in 2007."
,Galena,Fruity aroma,12,,7.5,,39,,US,Retains 75%-80% alpha acid after 6 months storage at 20ºC (68ºF),0.9,1.3,55,60,10,15,3,6,0,1,,,,,"Nugget, Columbus, Zeus, Chinook, Pride of Ringwood, Eroica, Newport, Cluster, Brewers Gold","Imperial Stout, Stout, India Pale Ale, Barley Wine",,Fruity aroma,Super alpha Galena is one of the most widely used bittering hop varieties in the US and is also an excellent dual-use hop.
,Satus®,Bittering,12.5,14,8.5,9,32,35,US,Retains 60%-70% alpha acid after 6 months storage at 20ºC (68ºF),1.5,2.8,40,45,15,20,7,10,0,1,,,,,"Nugget, Galena","India Pale Ale, Pale Ale, Stout, Barley Wine, Imperial Stout",,,"Satus® is a trademarked variety of Yakima Chief Ranches in Washington State. It is a high alpha dual-use hop considered great as a clean foundational hop when used at the beginning of a boil and when an extra punch of hops is desired. When used late, strong citrus notes come to the fore."
,Early Green,Aroma,,,,,,,UK,,,,,,,,,,,,,,,,,,,,"Developed in the UK, Early Green arrived in the US in the early 1930’s. To this day, little analytical data can be found on the variety. Despite gaining almost no traction as a brewing hop in its own right, it was chosen as a parent in the breeding of many classic varieties like Crystal, Horizon, Nugget and Mount Hood, among others."
,Celeia,Aroma,5,6,3,4,25,,Slovenia,Retains 56% alpha acid after 6 months storage at 20ºC (68ºF),1.3,,49.5,,17.6,,7.2,,5.6,,,,,,"Saaz, Bobek, Styrian Golding","English Ale, Lager, American Lager, Pilsner, English Ale, Extra Special Bitter",,Floral and citrus aroma,"Celeia is the triploid offspring of Styrian Golding, Aurora and a Slovenian wild hop. It features an excellently balanced profile all around and very good storage stability. A versatile hop, it has seen widespread use in Lagers, Pilsners, English-style ales and ESBs. It loves deep clay soil and requires a large planting distance."
,Riwaka,Aroma,4.5,6.5,4,5,29,36,New Zealand,,0.8,,68,,9,,4,,1,,,,,,Saaz,"India Pale Ale, Pilsner, American Pale Ale",D Saaz,Notes of grapefruit and kumquat,"Considered to be one of the darling hops of the New Zealand craft beer scene, Riwaka’s abundant oil content is nearly twice that of its parent variety Saaz. This unique oil balance alongside a near 1:1 ratio of alpha to beta acids gives it a strong sweet citrus note that, according to one brewer, makes it the “ultimate” for hoppy beers. Riwaka, formerly known as D Saaz, is a product of HortResearch’s New Zealand Hops “hops with a difference” program and was officially released to the brewing world in 1997."
,Viking,Aroma,8,10,4,5,21,24,UK,Retains 70% alpha acid after 6 months storage at 20ºC (68ºF),1.16,,47.3,,10.5,,5.3,,9.1,,,,,,Saxon,American Brown Ale,Wye Viking,Pleasantly hoppy,"Developed in 1968, Viking hops were first bred at Wye College in England as a cross between Svalof and an unnamed English male. They were released to the public in 1973. Sister to Saxon and grandchild of Bramling Cross and Northdown, this hybrid red-bine variety is considered part of a modern wave of British aroma hops with heightened alpha acids."
,Bobek,"Bittering, Aroma",3.5,9.3,4,6.6,26,31,Slovenia,Retains 66% alpha acid after 6 months storage at 20ºC (68ºF),0.7,4,30,63,12,19,4,6,3,7,,,,,"Fuggle, Willamette, Styrian Golding","English Ale, Extra Special Bitter, Lager, Pilsner","Styrian Golding B, Styrian Bobek","Pleasant aroma, pine","Diploid hybrid Bobek features a pleasant floral aroma. Bred in its native Zalec region of Slovenia alongside Blisk and Buket, Bobek was an attempt to create both high alpha and good aroma in one cultivar. Bobek is not being commercially produced at this time. Its parents are Northern Brewer and a Slovenian male."
,Caliente,"Bittering, Aroma",15.3,,4.3,,35,,US,,1.9,,,,,,,,,,,,,,,"India Pale Ale, Wheat, Pale Ale, Spice Beer",,"Falvors of citrus, peach and pine, aromas of stone fruit and mandarin","Caliente means “hot” in Spanish. That is, temperature hot and not spicy hot. It isn’t clear exactly why this particular variety was named that but it appears to be reasonably well received by the craft brew market featuring in quite a few commercial brews to date. There is some difference of opinion on it’s exact tasting notes but it has been said to impart flavors of citrus, peach, pine and even cherry along with distinct aromas of stone fruit and mandarin. Subtle aromas of peach have also been documented."
,Atlas,Aroma,9,11,4,,36,,Slovenia,Retains 50% alpha acid after 6 months storage at 20ºC (68ºF),1.3,1.6,59,,9,,4,,13.3,,,,,,,"American Pale Ale, Belgian Ale",Styrian Atlas,"Intense notes of lime, blossom, and pine","Released in the 1970’s, Atlas enjoys both good bittering and aroma qualities with intense notes of lime, blossom and pine. Like its siblings Aurora, Ahil and Apolon, Atlas has been cut back in commercial production over industry confusion stemming from its incorrect classification as a Super Styrian. It’s a Slovenian breed but is in actuality a seedling of Brewer’s Gold. Developed by Dr Tone Wagner at the Hop Research Institute in Zalec, Atlas has also accomplished USDA accession."
,Red Earth,Aroma,,,,,,,Australia,,,,,,,,,,,,,,,,,"California Common, American Pale Ale",,"Spicy, woody aroma and flavor with an undernote of citrus","Red Earth hops bring with them an altogether “Australian” depth of character. They’re a modern Australian breed which carry a decidedly spicy, woody aroma and flavor with a citrusy under note. The name stems from the reddish hue cones exhibit as they emerge from the early, burr stage of development."
,Magnum (US),Bittering,10,14,4.5,7,24,30,US,,1.9,3.,,,,,,,,,,,,,"Magnum, Horizon, Northdown, Northern Brewer","American Pale Ale, American India Pale Ale, Strong Ale, American Lager",Yakima Magnum,"Clean bittering, light citrus flavor","Magnum is grown on limited acreage in the US but what is produced has an excellent bittering profile and a nice, hoppy, floral aroma and subtle characters of citrus. Though genetically indistinguishable from the original German Magnum, some subtleties undoubtedly exist through varied growing conditions between the two countries. Both hops however are largely considered to be totally interchangeable."
,Zenith,Bittering,9,11,3,,25,,,Retains 82% alpha acid after 6 months storage at 20ºC (68ºF),1.76,,52,,18,,7,,,,,,,,,,,,"Zenith is a hop of unknown pedigree but was grown as a high alpha hop with good resistance to disease. It has high alpha and high myrcene, low cohumulone and a myrcene/humulene ratio of about 2:1. Its rhizomes are usually available from November to February, which is also the best time to plant them."
,East Kent Golding,Aroma,5,6,2,3,29,,,Retains 78% alpha acid after 6 months storage at 20ºC (68ºF),0.85,,42,,27,,9,,0,1,,,,,"Whitbread Golding, Progress, Fuggle, First Gold","Pale Ale, Extra Special English Ale, English Dark Ale, English Light Ale, Belgian Ale, Christmas Ale","Kent Golding, EKG, Canterbury Golding","Aromas of lavender, spice, honey, thyme, earthy flavors","East Kent Golding is often thought of as the ultimate English hop. Grown exclusively in Kent, England and descended from Canterbury Whitebine, it is a centuries old variety. Despite claims to the contrary, it is identical to Canterbury Golding. The two names have been used interchangeably for some time. Canterbury is a town in East Kent and the hop was first brought to market there in 1790. Some, however, charge to this day that East Kent Golding and Cantebury Golding are two distinct varieties though there is no clear evidence to support this. The variety began to be known primarily as East Kent Golding in 1838."
,Tettnanger B,Aroma,5.3,,5.2,,23,,Germany,Retains 50% alpha acid after 6 months storage at 20ºC (68ºF),0.9,,53.8,,14,,4.1,,11.5,,,,,,"Tettnanger, Saaz, Hallertau","Lager, Pilsner",,Pleasant continental-style aroma,"Sister to Tettnanger A, Tettnanger B was also thought to be superior to its parent through heightened levels of alpha. Through US testing however, this is now in question. Bred in the 1970’s through clonal selection from the original German Tettnanger hop, it features pleasant, continental-style aroma characteristics. It is also very likely descended from Czech variety, Saaz, a variety to which it is genetically similar."
,Cicero,"Bittering, Aroma",6,7,2.4,,29,,Slovenia,Retains 80% alpha acid after 6 months storage at 20ºC (68ºF),1.05,,51,,18,,7,,3,,,,,,,American Pale Ale,HBC 394,,"Sister to Cekin, Cicero is a dual use hop with a Styrian-type aroma bred from Aurora, a Yugoslav tetraploid male and a USDA tetraploid male. Developed in Slovenia in the 1980’s, Cicero possesses very high vigor and yield potential in home region but has not tested well in the US."
,Galaxy ®,"Bittering, Aroma",11,16,5,6.9,32,42,Australia,,3,5,33,67,1,2,7,9,2,4,,,,,"Citra®, Amarillo®, Centennial","Pale Ale, India Pale Ale, ESB",,"Citrus, peach and passionfruit aromas","Descended from German variety Perle, Galaxy® is a unique Australian breed of hops that has the distinction of sporting the highest percentage of essential oils in the industry."
,Agnus,"Bittering, Aroma",9,14,4,6.5,4,6.5,Czechia,Fair to poor,2.0,3.,40,55,15,20,8,10,1,,,,,,,"Czech Pilsner, German Lager, Pale Ale",,Strong spicy and herbal notes,"Agnus is the first high-alpha bittering hop to come out of the Czech Republic. It’s name is derived from Czech hop breeder Frantisek Beranek, who’s surname translated into Latin is Agnum – or Lamb in English. Registered in 2000 and released the following year, Agnus is a bittering hop with strong spicy and herbal notes and has been compared by some to Nugget and Magnum."
,Southern Star,Bittering,12,14,4.8,5.2,31,31,South Africa,Retains 60%-70% alpha acid after 6 months storage at 20ºC (68ºF),1.6,1.6,39,,22,,15,,12,12,,,,,Outeniqua,,,,"Released in 2001, Southern Star was developed in South Africa around 10 years after Outeniqua and Southern Promise. Like it’s two predecessors it is also considered a day neutral variety, meaning it can be grown in locations with reduced daylight. It is used primarily for bittering but also features a spicy, tangy flavor and some aroma."
,Merkur,"Bittering, Aroma",12,16.2,5,7.3,17.8,19,Germany,Retains 60%-70% alpha acid after 6 months storage at 20ºC (68ºF),2.6,3,48,49,29,32,8,9,0,1,,,,,Magnum,,Hallertau Merkur,"Earthy, spicy bitterness, citrus zing","Merkur or Hallertau Merkur as it is sometimes known, is a high alpha bittering hop developed at the Hull Hops Research Institute in Germany. It was released in 2000. It’s not all about bittering potential though; Merkur boasts high myrcene and humulene oil content giving it an earthy grounding and citrus zing. It works especially well in the early to mid-stages of brewing. Merkur is a descendant of Magnum."
,Early Promise,Aroma,6.1,,1.7,,30,,UK,,0.5,,42,,18.4,,,,,,,,,,,,,Continental-style aroma,"Early Promise was originally selected at Wye College, England, most likely from an old English variety through mass selection. Though originally slated for use as an aroma hop in the US, its poor yield in its USDA Corvallis plot eventually led to its discontinuation as a commercial prospect. Like Early Prolific, Early Promise may be useful for breeding aroma hops with a continental-style aroma."
,Keyworth’s Early,Aroma,8.6,,3.3,,33,,UK,Retains 72% alpha acid after 6 months storage at 20ºC (68ºF),1.39,,45,,22,,7,,,,,,,,Keyworth’s Midseason,American Ales,OJ47,Lemon and grapefruit notes,"Keyworth’s Early is a venerable old English hop which was, for a while, discontinued from production due to low yield. Raised at Wye College, England in the 1920’s, it was rushed into production on the back of Dr. W. G. Keyworth’s research in the 1940’s after Verticillium wilt became a major problem in parts of Kent. Due to its promising resistance, it gained in popularity for a while but fell out of favor with both brewers and growers."
,Record,Aroma,7,12,4,8,27,,Belgium,Retains 58% alpha acid after 6 months storage at 20ºC (68ºF),1.82,,50,,24,28,8.2,,0.16,,,,,,Northern Brewer,"Ale, Lager, Pilsner, Wheat, Belgian Ale",,"Pleasant European aroma, mildly fruity","Originating in Belgium sometime prior to 1970, Record hops feature a pleasant European aroma. Bred from an open pollination Saaz and Northern Brewer, their aroma characteristics are said to closely resemble that of the later parent, Northern Brewer. Flavor-wise, they have been described as mild and somewhat fruity. Record has been grown in a commercial capacity in both Germany and Belgium."
,Spalter Select,Aroma,3,6.5,2,5,20,28,Germany,Retains 60%-70% alpha acid after 6 months storage at 20ºC (68ºF),0.5,1.2,40,50,15,20,6,8,10,15,,,,,"Saaz, Tettnanger, Spalt, Hersbrucker, Perle, Hallertau Tradition","Kölsch, Belgian Ale, French Ale, Lager, Bock, Helles, Alt, Pilsner, Marzen","Select Spalt, Spalt Select",,"Released in 1993, Spalter Select was bred in Hüll, Germany in an effort to increase yield potential and disease resistant and serve as a commercial replacement for Spalt. These efforts were quite successful."
,Star,Aroma,3.2,,1.7,,24,,Belgium,Retains 82% alpha acid after 6 months storage at 20ºC (68ºF),0.47,,34,,33.9,,11.7,,3.7,,,,,,,,,Pleasing continental-style aroma,"Not to be confused with Southern Star, Star is an old Belgian land race variety, which is no longer grown commercially. It was largely discontinued due to poor vigor and yield but It is however still obtainable in small quantities for home brewing. It exhibits excellent storage stability and sports a lovely continental-type aroma."
,Glacier,"Bittering, Aroma",3.3,9.7,5.4,10,11,16,,Retains 70%-75% alpha acid after 6 months storage at 20ºC (68ºF),0.7,1.6,33,62,24,36,7,13,0,1,,,,,"Willamette, Fuggle (US), Tettnanger, Golding (US)","Extra Special Bitter, India Pale Ale, Wheat Beer, American Pale Ale",,"Herbs, wood and citrus","Developed by Washington State University and released in 2000, Glacier is a high yielding, dual-purpose hop characterized by low cohumulone levels, giving it a moderate and pleasant bitterness. Glacier’s aroma and flavor notes are herby, woody and citrusy."
,Early Prolific,Aroma,4.7,,2.2,,23,,UK,Retains 80% alpha acid after 6 months storage at 20ºC (68ºF),0.5,,50,,21.2,,7,,4.6,,,,,,,,,Pleasant continental-style aroma,"Originating from Wye College in England, Early Prolific has a pleasant continental-style aroma but is not currently produced commercially as a result of its poor growth rate and lackluster yield. It received USDA accession in 1980. Despite having little commercial impact as a brewing variety, Early Prolific may however exhibit some breeding potential on the basis of its aromatic characteristics and impressive storage stability."
,Ivanhoe,Aroma,7.3,8,4.60,,,,US,,,,,,,,,,,,,,,,"Galena, Cluster, Northern Brewer","American Ale, California Common, Stout, India Pale Ale",,Mellow aroma of citrus and pine. Heady floral and herbal notes.,"Ivanhoe is one of the first revivals of California Cluster in more than 50 years. Revived by organic hop farm Hops-Mesiter, LLC near Clearlake, California, it is a European aroma type and has been compared to a more moderate Cascade. It features a lovely, mellow aroma of citrus and pine, but with heady floral and herbal notes."
,Cerera,"Bittering, Aroma",5,6,4,4.5,25,,Slovenia,Retains 49% alpha acid after 6 months storage at 20ºC (68ºF),1.54,,58,,13.2,,6,,3,,,,,,,,,Saaz-like aroma,"Cerera, sister to Celeia, has a pleasing continental aroma similar to Saaz. Developed in Slovenia in the 1980’s, it hails from Styrian Golding and a Yugoslav male and is classified as a seedless Super Styrian triploid variety. Poor storage stability has made Cerera a poor candidate for widespread commercial production."
,Citra®,"Bittering, Aroma",10,15,3,4.5,20,35,US,Retains 75% alpha acid after 6 months storage at 20ºC (68ºF),1.5,3,60,70,7,12,5,8,1,,,,,,"Simcoe®, Cascade (US), Centennial, Mosaic®","India Pale Ale, American Ales, Amber",Citra® Brand HBC 394 cv,"Citrus, grapefruit, lime, tropical fruits, harsh bitterness","American aroma hop Citra was created by John I. Haas, Inc. and Select Botanicals Group joint venture, the Hop Breeding Company. It was released to the brewing world in 2008. Now one of the most coveted high-impact aroma hops in the US, particularly among craft brewers, it boasts a complex lineage that includes the likes of Hallertau Mittelfrüh (father), Tettnanger (US), Brewer’s Gold and East Kent Golding."
,Legacy®,"Bittering, Aroma",7.8,8.4,,,,,US,,,,,,,,,,,,,,,,"Cluster, Galena, Northern Brewer","Ale, Lager, Stout, India Pale Ale",,"Notes of blackberry, black currant, orange and grapefruit. Floral and spicy.","Legacy® has been grown in Washington State for over 50 years. Despite this, Hops Direct, LLC registered the variety in 2013 and named it Legacy."
,Hallertau (NZ),Aroma,7,9,5.8,8.5,28,35,New Zealand,Retains 80%-85% alpha acid after 6 months storage at 20ºC (68ºF),0.9,1.,35,48,10,16.8,6,8.2,5,6.7,,,,,"Hallertau, Perle","Pale Ale, Lager, Pilsner, Bitter, Bock, American Lager",NZ Hallertau,"Distinct lime ‘zing’, delicately floral, clean tasting","New Zealand Hallertau is a triploid hop bred from Hallertau Mittelfrüher and a New Zealand male cultivar. First introduced in 1988 by HortResearch (now the New Zealand Institute for Plant and Food Research), it is purported to impart a distinct lime ‘zing’ beneath a delicately floral top."
,Hallertauer Gold,Aroma,7,10,5,7,20,,Germany,Retains 47% alpha acid after 6 months storage at 20ºC (68ºF),1.78,,63,,17,,4.8,,0.2,,,,,,"Hallertau Mittelfrüh, Tettnanger, East Kent Golding, Crystal, Mount Hood",American Lager,Hallertau Gold,Pleasing continental aroma,"A varietal of the German Institute for Hop Research in Huell, Germany, Hallertauer Gold is a descendant of Hallertau Mittelfrüher and is often marketed under various, similar names. Developed in the mid-1970s, it was released to the public in the late 1980s. A lot of commercially sold Hallertau is usually Hallertauer Gold or Hallertauer Gold combined with Hallertau Mittelfrüher. Its aroma is continental but with higher alpha acids and low cohumulone. This hop was bred to be more wilt resistant than its parent after persistent wilt became an issue in Germany."
,Jester®,Aroma,7,9,4,6,23,28,UK,,0.6,1.2,45,50,2,,,,0.1,0.2,,,,,"Cascade, Challenger","Pale Ale, IPA",,"Tropical fruit, grapefruit, blackcurrant, hints of lychee","Developed by Charles Faram & Co Ltd in the UK, proprietary hop Jester® brings with it distinct flavors and aroma qualities quite different to that of tradition English hop varieties. These unique characteristics include forward and robust notes of tropical fruits, grapefruit and blackcurrant and even hints of Lychee. It is considered most useful as a mid to late addition but is also fantastic to dry hop with. Though not considered a particularly useful bittering hop, when used in this regard it imparts a mild, herbal resonance."
,Nordgaard,Aroma,7.5,,3.4,,29,,Uncertain (Belgium or Denmark),Retains 79% alpha acid after 6 months storage at 20ºC (68ºF),0.94,,47,,27,,11,,1.7,,,,,,,,,Pleasing continental aroma,"Nordgaard is an old Belgian or Danish landrace that has been used for breeding, particularly in Solvenia in the 1970’s. It’s exact origin is unclear. The result of Spalt crossed with an unknown variety, it is said to impart pleasant continental aroma characteristics and is high in humulene."
,Goldings (NZ),"Bittering, Aroma",4,4.2,4.6,4.8,20,25,New Zealand,,0.3,,13.8,,48.4,,13.3,,0.3,,,,,,East Kent Golding,"English Pale Ale, Pale Ale",,,"New Zealand Goldings are said to have a subtle flavor and an enjoyable perfume with a nicely rounded bittering. It differs from the English Kent Golding in its delicate touch. In fresh beers, its flavor will only hold for about a month. Good traditional aroma hop used late in the boil or for dry hopping."
,Amarillo™ VGXP01,Aroma,8,11,6,7,21,24,US,Retains 96% alpha acid after 6 months storage at 20ºC (68ºF),1.5,1.9,68,70,9,11,2,4,2,4,,,,,"Cascade (US), Centennial, Ahtanum™, Chinook, Summer","American Pale Ale, India Pale Ale, American Wheat, Bitter, Wheat Beer, Red Ale, ESB",,Orange citrus flavor,"Amarillo™ VGXP01 hops are used worldwide where its ultra-high myrcene content creates a delicious orange citrus flavor. A varietal of Virgil Gamache Farms, Inc. Amarillo™ VGXP01 is highly acidic, making it a perfect choice for for ESB’s and Pale Ales."
,Centennial,"Bittering, Aroma",9.5,11.5,3.5,4.5,28,30,US,Retains 60%-65% alpha acid after 6 months storage at 20ºC (68ºF),1.5,2.5,45,55,10,18,5,8,0,1,,,,,"Chinook, Galena, Nugget, Zeus, Columbus, Cascade (US)","Extra Special Bitter, Barley Wine, Imperial Stout, India Pale Ale, Pale Ale",Super Cascade,Earthy and floral with an element of citrus,"Centennial owes its existence to a mix of Brewer’s Gold, Fuggle, East Kent Golding and Bavarian hops. Developed in 1974 and released in 1990, Centennial was pioneered by Charles (Chuck) Zimmerman and S.T. Kenny at Washington State University. It is at times referred to as super Cascade because of its similar citric characteristic. Centennial is a much-celebrated hop in its versatility with its depth of bitterness and forward aroma — two characteristics that balance each other beautifully."
,Apollo,Bittering,15,20,5.5,8,23,28,US,Retains 80%-90% alpha acid after 6 months storage at 20ºC (68ºF),1.5,2.5,30,50,20,35,14,20,1,,,,,,"Nugget, Columbus, Zeus, Magnum, Millennium","India Pale Ale, Imperial India Pale Ale, Experimental Beers",,"Sharp, clean bittering, grapefruit notes","Super-alpha hop Apollo was first bred in 2000 by Hopsteiner and released to the public in 2006. it is descended from Zeus and two other unnamed USDA varieties. It tends to be quite expensive, though quantities used tend to be smaller due to its ultra-high concentration of alpha-acids."
,BOR,Aroma,2,3,3,4,14,20,US,Retains 67% alpha acid after 6 months storage at 20ºC (68ºF),0.65,,21,,46,,13,,,,,,,,,"German Pilsner, Pale Ale, Wheat Beer",BOR 704,,"Selected by Dr Bob Romanko, BOR 704 was so named for it’s planting position, row 7, plant 04, in the Prosser “Bone Yard” in the Yakima Valley. It features an aroma profile that is distinctly European. While BOR exhibits a relatively poor yield, it has been used to breed other seedlings in an effort to pass on its low cohumulone rate that is sometimes as low as 14%. However, its low alpha content has hindered it from gaining any successful foothold in commercial hops production."
