,Bouclier,"Bittering, Aroma",5.2,9,2.4,3.3,20,25,UK / France,,1.1,1.6,38,,34,,3.40,,,,,,,,,"English Ales, Pale Ale, Lager, Imperial Stout, Saison, Pils, Blonde",,"Aromas of herb, grass and spice alongside a citrus and floral character","Emerging in 2005, Bouclier is a cross between Alsace-grown Strisselspalt and a wild male from Wye, Kent. It is unclear however if this variety was first developed in the UK or across the Channel in France."
,Willow Creek,"Bittering, Aroma",,,,,,,,,,,,,,,,,,,,,,,,,,,"Native to Colorado, neomexicanus variety Willow Creek is very new to the brewing scene. There is very little information about them available but they are reportedly considered to be similar to other available neomexicanus varieties Amallia, Neo1, and MultiHead."
,Pacific Sunrise,Bittering,12.5,14.5,6,6.5,27,30,New Zealand,Retains 60%-70% alpha acid after 6 months storage at 20ºC (68ºF),1.7,2,45,55,19,25,6,9,0,1,,,,,Pacific Gem,Lager,,,"Released in 2000 by HortResearch in New Zealand, Pacific Sunrise’s take up by commercial breweries has been sluggish. Despite this, it features favorable bittering properties and a pleasant piney aroma. It is the result of a cross between the result of a European and New Zealand male on one side and a California Cluster and a Fuggle on the other."
,Summit™,Bittering,16,18,3.3,4.3,26,33,US,Retains 85%-85% alpha acid after 6 months storage at 20ºC (68ºF),1.5,3,30,50,15,25,10,16,0,1,,,,,"Columbus, Simcoe®, Apollo","India Pale Ale, Barley Wine, Imperial Stout",,Citrus aromas,"Developed in 1998 by The American Dwarf Hop Association, a joint hop breeding venture between the owners of Roy Farms, Wyckoff Farms and Green Acres Farms, Summit™ was released for brewing trials in 2000. It has the distinction of being the first semi-dwarf variety to be bred in the United States and is currently the only low trellis variety grown in the country. Its pedigree is decidedly complex, hailing from a combination of Nugget, Zeus and Lexus hops."
,Hersbrucker,Aroma,2,5,4,6,19,25,Germany,Retains 55%-65% alpha acid after 6 months storage at 20ºC (68ºF),0.5,1.3,10,25,15,35,7,15,0,1,,,,,"Hallertauer Tradition, Spalter Select, Mount Hood, Strisselspalter, Hallertau, Liberty","Dunkel, Strong Ale, Pilsner, Altbier, Weizenbock, Golden Ale, Marzen, Pale Ale, Wheat, Specialty Ale, Hefeweizen, Light Ale, Lager","Hersbrucker-G, Hersbrucker Late, Hersbrucker Spaet, Hersbrucker Spat","Floral, fruity and spicy aromas",German hop Hersbrucker was originally bred with the intention of producing a variety resistant to verticillium wilt that could act as a replacement for Hallertau Mittelfrüh.
,Tardif de Bourgogne,Aroma,3.1,5.5,3.1,5.5,20,,France,Retains 66% alpha acid after 6 months storage at 20ºC (68ºF),0.49,0.73,44,,13,,5.7,,0.2,,,,,,Precoce de Bourgogne,"Ale, Lager",,"Mild, European-style aroma","Translated into English, Tardif de Bourgogne means Late Burgundy. Similar to Precoce de Bourgogne (Early Burgundy), it is an aroma hop grown in small quantities in the Alsace region of France."
,Bravo,Bittering,14,17,3,5,29,34,US,Retains 70% alpha acid after 6 months storage at 20ºC (68ºF),1.6,2.4,25,50,18,20,10,12,0,1,,,,,"Columbus, Zeus, Apollo, Magnum, Nugget","India Pale Ale, American Pale Ale, Extra Special Bitter",,"Spicy, earthy, and lightly floral aroma","Bravo’s high alpha content is largely attributable to its parent variety, Zeus. It’s bittering quality is considered smooth and in addition features light floral aromas and subtle flavors of orange and stone fruit making it highly desirable for use in many different ale styles."
,Golding (BC),Aroma,4,7,,,,,Canada,,,,,,,,,,,,,,,,"East Kent Golding, Golding (American), Fuggle, Willamette","English Pale Ale, Stout, Porter","British Columbia Golding, BC Golding","Exhibits an earthy aroma profile with a flavor profile of smooth, rounded spice.","British Columbia Golding is produced, as one might expect, in Canada. Before the hops industry was fully established in the Pacific Northwest, BC Golding was the only North American-grown Golding. Its alphas are low so it’s bittering capacity is mild at best while it puts forward an earthy aroma profile and flavors of smooth, rounded spice. BC Golding makes a good, British-style pale and has also been noted for it’s successful use in Stouts and Porters."
,Hallertau,Aroma,3.5,3.5,3.5,4.5,20,26,Germany,Retains 52%-58% alpha acid after 6 months storage at 20ºC (68ºF),0.6,1.2,35,44,30,55,10,15,0,1,,,,,"Liberty, Hallertau (US), Hallertauer Tradition","German Pilsner, Pale Ale, Wheat, American Lager","Hallertauer, Mittelfrüh, Mittelfrüher, Hallertauer Mittelfrüher, Hallertau Mittelfruh",Lightly flowery and spicy aroma,"Hallertau, Hallertauer and Hallertauer Mittelfrüher are all names for the original German Hallertau variety. Dating back more than 100 years, it stems from an old German landrace and is one of the original four “noble” hops. It features a lightly flowery and spicy aroma."
,Blue Northern Brewer,"Bittering, Aroma",6,8,3,4,24,,Belgium,Retains 78% alpha acid after 6 months storage at 20ºC (68ºF),0.76,,27,40,29,,10,,,,,,,,Chinook,India Pale Ale,,,The Blue Northern Brewer was discovered as a mutant with deep reddish-blue leaves growing in a Belgian hop yard in the early 1970’s. It was released as an ornamental variety in 1992. Its use for brewing is plausible but tentative.
,Canadian Redvine,Aroma,5,,5,6,47,,Canada,Retains 80% alpha acid after 6 months storage at 20ºC (68ºF),11.2,,70,,2,,2,,4,7,,,,,"Newport, Magnum, Galena","Red Ale, Canadian Porter, French Porter",,"Mild cherry flavor, grapefruit peel aroma","Canadian Redvine, with its dense and profuse rhizomes, high vigor, excellent yield and disease resistance makes it seem like an interesting prospect but with such a high cohumulone content and low alphas, it is not widely used. It is said to impart mild flavors of cherry, berries, pine and even citrus."
,Columbia,Aroma,8.8,,4,,40,,,Retains 72% alpha acid after 6 months storage at 20ºC (68ºF),1.2,,55,,17,,7,,4.1,,,,,,,,,"Pungent hoppy kick, twist of lemon citrus","Columbia enjoyed limited production in the 1980’s but was later discontinued in favor of Willamette. However, as craft brewers have started to discover Columbia’s unique, pungent kick of hoppiness and notable twist of lemon citrus, it seems to have come back in to fashion. Columbia was returned to production in 2011. Now it’s used in Widmer Bros. Columbia Common Spring Ale among others."
,Fuggle,Aroma,2.4,6.1,2.1,2.8,25,29,UK,,0.44,0.83,43.4,,26.6,,9.1,,4.3,,,,,,"Fuggle (US), Willamette, Styrian Golding, Tettnanger, Newport","English Ale, Porter, Mild Ale, Bitter, Extra Special Bitter, Lambic, Amber Ale, Cask Ale, Stout, Oatmeal Stout, Strong Ale, Nut Brown Ale, Golden Ale, Christmas Ale","Fuggles, Fuggle UK",,"The Fuggle hop originates in England and was first discovered in 1861 in a hop yard owned by George Stace in Kent. Some 14 years later it was officially named and introduced by Richard Fuggle of Benchley in 1875. Similar to a Styrian Golding, is noted for its distinct European aroma and has enjoyed a long, versatile run. At its peak nearly 100 years ago Fuggle was known as a dual-use hop. Today however, as other higher alpha acid varieties have become more prevalent, it’s now more prominently used for its aroma."
,Omega,Aroma,9,10,3,4,29,,UK,Retains 78% alpha acid after 6 months storage at 20ºC (68ºF),1.72,,53,,17,,5,,,,,,,,,,,Pleasant European aroma,"Omega, despite its pleasant European aroma, decent alpha, storage stability and wilt resistance, exhibited a yield far too low to gain any major foothold commercially. Omega was Dr. R. A. Neve’s swansong before leaving his post in 1984 as head of the Hop Section at the esteemed English horticultural institution, Wye College."
,Tettnanger,"Bittering, Aroma",3,5.8,2.8,5.3,24,,Germany,Retains 61% alpha acid after 6 months storage at 20ºC (68ºF),0.36,1.07,40.6,,20.4,,6.2,,11.3,,,,,,"Saaz, Spalt, Santiam, Spalter Select, Tettnanger (US)","Bitter, California Blonde Ale, Red Ale, Pilsner, Lager, American Amber Ale, Winter Ale, Pale Ale, Wheat Beer, Bavarian Hefeweizen, Cream Ale, American Lager","Tettnang, Tettnang Tettnanger, German Tettnang, Tettnanger (GR), Schwetzinger, Deutscher Frühopfen",Balanced floral and herbal aromas with some spiciness,"Selected from an old German landrace, Tettnanger is grown the world over. Swiss, US and Australian varieties can be found on the market today though some foreign versions labeled “Tettnanger” are actually a hybridized mix with Fuggle and not considered a true Tettnanger hop. Tettnanger is grown around its native village of Tettnang in southwest Germany and in small quantities near lake Konstanz in Switzerland."
,Dr Rudi,"Bittering, Aroma",10,12,7,8.5,36,39,New Zealand,Retains 60%-70% alpha acid after 6 months storage at 20ºC (68ºF),1.3,1.6,29,48,22,33,6,10,0,1,,,,,Green Bullet,"Lager, India Pale Ale","SuperAlpha, Super Alpha, Dr Rudi","Grass, pine and citrus flavors","Originally known as SuperAlpha, the variety was renamed to Dr Rudi in 2012. It was bred from New Zealand Smooth Cone and is largely grown in New Zealand. It was originally released in 1976."
,Falconer’s Flight®,"Bittering, Aroma",9.5,12,4,5,20,25,US,,1.6,4.6,,,,,,,,,,,,,"Cascade, Columbus, Centennial","India Pale Ale, Pale Ale, Lager",,"Distinct tropical, floral, lemon and grapefruit attributes","Falconer’s Flight® is a proprietary blend of Pacific Northwest hops. These include 7 “C” hops, Cascade, Centennial, Chinook, Citra®, Cluster, Columbus and Crystal in addition to experimental varieties developed by Hopunion LLC."
,Pacific Gem,"Bittering, Aroma",13,16,7,9,37,40,New Zealand,Retains 70%-80% alpha acid after 6 months storage at 20ºC (68ºF),1.2,1.4,33,55,18,30,7,11,0,1,,,,,Fuggle,"Strong Ale, European Lagers",,Notes of oak and blackberry,"Pacific Gem is a New Zealand hops variety of interesting character. Bred at the New Zealand Horticultural Research Centre as a triploid cross between Smooth Cone, California Late Cluster and Fuggle, it is used around the world in various styles but most notably in European lagers. It was released in 1987."
,Yakima Cluster,Bittering,4.4,9.8,3,6.1,42,,US,Retains 85% alpha acid after 6 months storage at 20ºC (68ºF),0.24,0.9,45,55,18,,6,7,1,,,,,,Chinook,,Late Cluster L-8,,"First grown in the late 1950’s, Yakima Cluster is the daughter of Late Cluster and the granddaughter of Pacific Coast Cluster. It doesn’t appear to be suited to either Idaho or Oregon growing regions in the US but seems to thrive in the drier Yakima Valley."
,Saphir,Aroma,2,4.5,4,7,12,17,Germany,,0.8,1.4,25,40,20,30,9,14,1,,,,,,"Hallertau, Hallertau Tradition, Spalter Select","Pilsner, Lager",Sapphire,Sweet citrus aromas with hints of tangerine,"Released in 2002, Saphir features elements of spice and fruit amid refined citrus notes of tangerine. It is considered well suited to Belgian Whites as well as Pilsners and German Lagers."
,Tettnanger (Swiss),Aroma,4.1,6.3,3.6,5.7,22,,Switzerland,Retains 57% alpha acid after 6 months storage at 20ºC (68ºF),0.42,1.13,,,,,,,,,,,,,"Tettnanger, Fuggle, Saaz, Spalt, Ultra","Lager, Wheat Beer, Pilsner",,Noble aroma,"While it was initially thought to be the same variety as the original German Tettnanger, the Swiss-grown version is now considered to be genetically unique. While the original variety is also known to be cultivated in Switzerland, much of the branded Tettnanger (Swiss) product is actually Fuggle-derived. Despite this, it is higher yielding than its German Tettnanger counterpart and features a similar, noble aroma."
,MultiHead,"Bittering, Aroma",3.5,5.5,5.5,8,45,,US,,0.5,1.5,48,,,,,,,,,,,,,Pale Ale,,"Heady, floral aroma, some sweet fruit and citrus","MultiHead is a neomexicanus breed native to New Mexico and is so named because of its tendency to produce dual cones. It is a unique hop in the industry and in brewing features a heady, floral aroma and some citrus elements."
,Sticklebract,"Bittering, Aroma",13,14.2,7.5,8.5,40,45,New Zealand,Retains 60%-70% alpha acid after 6 months storage at 20ºC (68ºF),0.76,1.72,51,64,8,11,3,6,4,4.6,,,,,Northern Brewer (GR),Extra Special Bitter,,Aromas of pine and citrus,Sticklebract is a dual-use New Zealand variety and another variety bred to stem the issues from Black Root Rot that were present in the country during the mid 20th century. It was selected as a seedling in the 1970’s from open pollinated First Choice.
,Eroica,Bittering,12.3,,4.5,,40,,,Retains 77% alpha acid after 6 months storage at 20ºC (68ºF),0.8,1.3,55,65,0,1,7,13,0,1,,,,,"Bullion, Brewer’s Gold, Galena","Bitter, Pale Ale, Amber Ale, Porter, India Pale Ale",,Sharp fruity essence,"Despite Eroica hops enjoying a high alpha acid percentage, they are, on paper at least, overshadowed by their sister Galena. It appears this comparison is also moving them toward denouement of commercial production along with their cones being considered difficult to harvest and it’s susceptibility to Ringspot and Mosaic virus."
,First Choice,Aroma,4.8,6.7,3.5,6.7,39,,New Zealand,Retains 74% alpha acid after 6 months storage at 20ºC (68ºF),0.51,1.25,71,,1,,1.3,,,,,,,,,,,,"First Choice is a New Zealand variety that was grown commercially for 20 years between the 1960s and the 1980s. It is no longer in commercial production, likely a result of its low alpha content. It was selected by Dr R.H.J. Roborgh at the Riwaka Research Station, much like its parent, California Cluster. It possesses high yield and growth potential but little is known about its flavor and aroma profile."
,Eureka,"Bittering, Aroma",18,19,5,6,27,,,,3.,,43,,29.8,,0.2,,,,,,,,,"Imperial India Pale Ale, India Pale Ale, American Ales, American Red, Saison","EXP #: 05256, Exp Pine Fruit","Falvors of citrus, peach and pine, aromas of stone fruit and mandarin","With similarities to Simcoe® and Summit™ hops, Eureka is a fairly new variety with very strong bittering qualities and a complex and robust flavor and aroma profile. It is said to impart flavors of citrus, resin, tropical and dark fruit along with aromas of grapefruit rind, citrus and tangerine. It is the progeny of varietals Apollo and Merkur."
,Blisk,Aroma,9.7,14.1,3.3,4.8,33,,Slovenia,Retains 45% alpha acid after 6 months storage at 20ºC (68ºF),2.,,58,,12,,3.7,,15.6,,,,,,,"English Ale, Extra Special Bitter, Lager, Pilsner",,,"Dating back to the late 1970’s, Blisk was bred in its native Zalec region of Slovenia, along with Bobek and Buket in an attempt to instil both high alpha content and pleasant aroma in one cultivar. It is a cross between Atlas and a male varietal from the former Yugoslavia. Despite its decent yield, Blisk is not being commercially produced."
,Amallia,"Bittering, Aroma",5.5,9,4.2,8.3,,,US,,,,,,,,,,,,,,,,,"Brown Ale, Dark Ale",,Deep earthy aroma,"Native to New Mexico, Amallia is a neomexicana varietal with a deeply earthy aroma and pronounced flavors of orange citrus. Bold and unique, it is considered well suited to brown or dark ales for both bittering and aroma. This variety was being trialed in Michigan by Michigan State University researchers in 2014."
,Kirin II,"Bittering, Aroma",8,,6.4,,43,45,Japan,Retains 70% alpha acid after 6 months storage at 20ºC (68ºF),1.18,,50,,14,,9.4,,0.2,,,,,,,,,,Kirin II is one of a few Japanese hops to spring up since the Japanese governments decision to reduce the importation of beer hops. The variety is grown domestically and solely under government contract. The variety was developed by Kirin Brewery Co. as a clonal selection from Shinshuwase and as such is directly descended from Saaz and open pollinated White Vine.
,Topaz,"Bittering, Aroma",13.7,17.7,6.4,7.9,48,51,Australia,,1.7,2.2,34,56,8,13,7,13,1,,,,,,"Galaxy®, Citra®, Cascade, Riwaka, Rakau, Amarillo®","India Pale Ale, American Pale Ale, Bitter, Amber",,"Light, tropical fruit flavors of lychee, clove-like spice and resinous grassy tones when dry hopped","Australian-born multi-purpose variety Topaz features elements of clove-like spice and a light, lychee-esque fruitiness. Samuel Adams uses it in their Tasman Red IPA. When used alongside a citrus-heavy hop (Samuel Adams used Galaxy®), it gives a surprising depth of flavor."
,Northern Brewer (GR),Bittering,7,10,3.5,5,27,33,Germany,,1.6,2.,25,45,35,50,10,20,1,,,,,,"Perle, Northern Brewer (US)","Steam Beer, German Ale, German Lager","Hallertau Northern Brewer, Hallertauer Northern Brewer",,Northern Brewer was originally developed in England in 1934 but is now largely grown in Germany. German-grown Northern Brewer is considered identical to the original UK-bred variety though subtle differences attributable to the different growing region may be evident.
,Smooth Cone,"Bittering, Aroma",7,9.5,3.4,5.2,31,31,New Zealand,Retains 60%-70% alpha acid after 6 months storage at 20ºC (68ºF),0.38,1.14,55,,21,,6,,0,1,,,,,Cluster,Lager,SmoothCone,,"Smooth Cone is a New Zealand hop variety. It is no longer grown commercially but can still be found. Developed in the 1960’s, the variety was introduced alongside two other Black Root Rot resistant varieties, First Choice and Calicross after the disease savaged New Zealand’s hops industry during the mid 20th century."
,Admiral,Bittering,13,16.2,4.8,6.1,37,45,UK,Retains 85% alpha acid after 6 months storage at 20 degrees C,1,1.7,39,48,23,26,6,7,1.8,2.2,,,,,"Chinook, Northdown, Challenger, Centennial, Cascade (US), Amarillo, Target","Extra Special Bitter, American India Pale Ale, Belgian India Pale Ale, Imperial India Pale Ale, India Pale Ale, Pale Ale, Bitter",,Aggressive but smooth bittering with an orange-citrus and herbal resonance,"Admiral is an excellent mid-season hops variety derived from grandparent Challenger and likely parent, Northdown. Its exact lineage is unclear. Hailing from Wye College, England it was released to the brewing world in 1998 as a potential high-alpha replacement or complimentary addition to Target hops."
,Newport,Bittering,13.5,17,7.2,9.1,36,38,US,Retains 60% alpha acid after 6 months storage at 20ºC (68ºF),1.6,3.6,47,54,9,1,1,7,0,1,,,,,"Galena, Nugget","Pale Ale, Amecan Lager",New Port,"Clean bitterness, flavors of wine and balsamic",Newport is the offspring of Magnum and a USDA male variety. Oregon State University and the USDA successfully bred it in 2002 in an effort to address concerns over mildew resistance. It was said to have helped save Northwest US hops production around this time when mildew issues threatened multiple hops varieties.
,Crystal,Aroma,2.8,4.4,5.8,7,21,26,,Retains 65% alpha acid after 6 months storage at 20ºC (68ºF),0.82,,47,,26,,7,,,,,,,,"Liberty, Mount Hood, German Hallertau, Ultra, Strisselspalter, Hersbrucker","Bitter, Pilsner, Light Lager, Golden Ale, Nut Brown Ale, Pale Ale, India Pale Ale, Stout, Chocolate Stout, American Lager",,"Woody, floral and fruity with spice notes of cinnamon, nutmeg and black pepper","Despite a relatively low yield, Crystal’s has made it a fairly popular hop. It’s woodsy, green, floral and fruity with herb and spice notes of cinnamon, nutmeg and black pepper. Extremely versatile, it’s even used for its notable aromatic qualities in IPAs and Bitters despite its low alpha acid content."
,Challenger,"Bittering, Aroma",6.5,9,3.2,4.5,20,25,UK,Retains 70%-85% alpha acid after 6 months storage at 20ºC (68ºF),1,1.7,30,42,25,32,8,10,1,3,,,,,"Perle (US), Northern Brewer, Admiral","Golden Ale, Barley Wine, Imperial Stout",Wye Challenger,,"Released to the public in 1972, Challenger hops were developed at Wye College from varieties Northern Brewer and German Zattler. It accounted for a significant percentage of the hops grown in the UK during the 1980’s and 1990’s."
,Cluster (US),"Bittering, Aroma",5.5,9,4,6,36,42,US,Retains 80%-85% alpha acid after 6 months storage at 20ºC (68ºF),0.4,0.8,38,55,15,20,6,10,0,1,,,,,"Eroica, Galena","Barley Wine, Porter, English Pale Ale, Amber Ale, Honey Ale, Cream Ale, American Lager",,"Clean, neutral, slightly floral","Cluster (US) is thought to be one of the oldest and most robust hop crops in the US. With its balanced aroma and bittering profile and outstanding storage stability, it has long been a go to hop of large commercial breweries in the US."
,Herkules,"Bittering, Aroma",12,17,4,5.5,32,38,Germany,,1.4,2.4,30,50,28,45,7,12,1,,,,,,,German Ale,,"Notes of melon, black pepper and pine","Strong and robust in flavor and aroma, German Herkules lives up to it’s name. The Hüll-bred offspring of Hallertauer Taurus, Herkules is a high alpha acid bittering hop, known to be spicy and floral, tangy and hoppy, with notes of melon, black pepper, with hints of pine. It was released in 2005."
,Pride of Kent,"Bittering, Aroma",8,11,6,8,35,,,Retains 42% alpha acid after 6 months storage at 20ºC (68ºF),2.32,,70,,9,,3,,,,,,,,Galena,,,,"Developed in England at Wye College, Pride of Kent features a pleasant continental-type aroma. It was first developed sometime in the early to mid 20th century from open pollinated Brewer’s Gold. Pride of Kent is also the parent of the celebrated Australian variety, Pride of Ringwood."
,Sladek,Aroma,4.5,8,4,7,23,30,Czechia,,1.0,2.,35,50,20,40,9,14,1,,,,,,Saaz,"Lager, Pilsner","Czech Sladek, VUCH 71","Classic hoppy aroma, flavors of peach passionfruit and grapefruit","Sladek, meaning ‘brewer’, is a high yielding aroma variety and cross between Saaz and Northern Brewer. Originally registered as VUCH 71 In 1987, it was renamed to Sladek in 1994. Sladek features a classic hoppy aroma atop a fruity flavor profile with essences of peach, passionfruit and grapefruit."
,Azacca ®,"Bittering, Aroma",14,16,4,5.5,38,45,US,,1.6,2.5,46,55,14,18,8,12,1,,,,,,,India Pale Ale,Azaaca,"Aromas of tropical fruits and citrus. Tasting notes of spicy mango, pineapple, tangerine and pine.","Named after the Haitian god of agriculture, Azacca is one of a new brood of dwarf bittering hops. Descended directly from Toyomidori, its greater parentage also includes Summit™ and Northern Brewer. Bred by the American Dwarf Hop Association, a joint hop breeding venture between Roy Farms, Wyckoff Farms and Green Acres Farms, Azacca is considered by many brewers as being well suited to IPAs."
,Marynka,"Bittering, Aroma",9,12,10.2,13,26,33,Poland,Retains 60%-70%alpha acid after 6 months storage at 20ºC (68ºF),1.8,2.2,28,31,36,33,10,13,1.8,2.2,,,,,Tettnanger,"Bitter, India Pale Ale, Pale Ale, Pilsner",,Earthy and herbal flavors and aromas,"Marynka hops are another widely produced Polish hop from the region Lublin. It is moderate in most things: yield, growth, stability, but her flavor profile is way above average. Despite being used primarily for bittering, Marynka features a forward, earthy and herbal flavors and aromas. It is the offspring of Brewer’s Gold and was official registered in 1988."
,Mosaic ®,"Bittering, Aroma",11.5,13.5,3.2,3.9,24,26,,Retains 75% alpha acid after 6 months storage at 20ºC (68ºF),1,1.5,47,53,13,16,5,8,,,,,,,Citra®,"India Pale Ale, Pale Ale",HBC369,,"Released in 2012 by the Hop Breeding Company, LLC, Mosaic hops feature complex but clean flavor characteristics and are known for their triple-use profile encompassing bittering, flavor and aroma. They have high alpha acids but low cohumulone which makes them pleasantly hoppy, carrying flavors of mango, pine, citrus and herbs and aromas of tropical and stone fruit. Mosaic is the first daughter of Simcoe and Nugget as has been humorously referred to by some as “Citra on steroids”."
,Gargoyle,Aroma,7.50,,,,,,US,,,,,,,,,,,,,,,,"California Cluster, Ivanhoe",,,Citrusy-mango aroma,"Gargoyle, along with Ivanhoe, is a new generation of California Cluster and the first to be grown commercially in over half a century. Revived by organic hop farm Hops-Mesiter, LLC near Clearlake, California, it is similar to Ivanhoe but tends more toward a citrusy-mango bouquet."
,Eastern Gold,Bittering,11,14,5,6,27,,Japan,Retains 81% alpha acid after 6 months storage at 20ºC (68ºF),1.43,,42,,19,,7,8,3,,,,,,Brewer’s Gold,,,,"Eastern Gold is a Super Alpha variety developed in Japan by Kirin Brewing Co. Ltd Hops Research from Kirin No. 2 and OB79, an open-pollinated wild American hop. Despite its yield potential, high alpha acids and storage stability, it seems it is not currently being grown in any significant commercial capacity."
,Early Bird,Aroma,4.4,6.7,1.9,2.8,26,32,UK,,0.8,,,,,,,,,,,,,,"East Kent Golding, Cobb, Bramling Cross",India Pale Ale,Amos’s Early Bird,"Pleasing, delicate aroma","Early Bird, or Amos’s Early Bird as it was formerly known, is a Goldings variety and considered one of England’s premier aroma hops. While not terribly disease and wilt tolerant, it is bred for its immensely pleasing aroma and gentle hoppiness."
,Janus,Aroma,5.1,,2.3,,32,,UK,Retains 68% alpha acid after 6 months storage at 20ºC (68ºF),0.58,,40,,34,,10.9,,,,,,,,,,,Pleasing European aroma,"Selected at Wye College, England in the 1950’s, Janus was originally praised for its early harvest qualities. Its extremely low yield however led it to being discarded as a commercial prospect in 1992. To date, it has never been used for breeding either. It is a cross between a Eastwell Golding, a New Mexico Wild American hop and other unspecified English hops. Janus exhibits very high myrcene potential and is said to have a pleasant, European aroma."
,Fuggle Tetraploid,"Bittering, a Aroma",5,,2.4,,26,,,Retains 69% alpha acid after 6 months storage at 20 degrees C,0.93,,49,,24,,20.2,,3.9,,,,,,,,,,"Fuggle Tetraploid is both an aroma and a bittering hop, and the female parent of both Columbia and Willamette. It is one of the descendants of the original English Fuggle hops."
