9cb5c306-f544-4ebd-b61d-ae718c3f2825,Hersbrucker Pure,Aroma,4.7,6,2,3,20,28,,Retains 60%-70% alpha acid after 6 months storage at 20ºC (68ºF),0.6,1.2,24,50,10,27,4,11,0,1,,,,,"Hersbrucker, Hallertauer Mittelfrüh","Pilsner, Hefeweizen, Lager",,Pleasing noble aroma,"The offspring of Hallertauer Mittelfrüh, Saaz and a wild German hop, Hersbrucker Pure was originally tested by brewing giant Anheuser Busch as a replacement for Hersbrucker. After their interest waned in the variety, it failed to catch on as a viable commercial prospect. It has an noble aroma and flavor profile similar to that of its parents."
10f00838-ba77-40df-a49c-ca90e0043fff,Mount Rainier,"Bittering, Aroma",5,8.1,5,7,21,24,,,,,,,,,,,,,,,,,"Hallertau, Fuggle","Lager, American Ale, Porter",Mt. Rainier,"Hallertau-like aroma, notes of citrus and licorice","Like Mount Hood, Mount Rainier is named after one of the many active volcanoes in Washington State. Born out of the USDA-ARS hop breeding program in collaboration with Oregon State University, Mount Rainier is the progeny of Magnum and a USDA male. It has noble, Hallertau-like aroma characteristics alongside notes of citrus and a hint of licorice. It is excellent for both aroma and bittering."
0e2d05e0-4d34-4afb-ace1-3ffb31bb55b3,Golding (US),Aroma,4,6,2,3,20,20,US,Retains 66% alpha acid after 6 months storage at 20ºC (68ºF),0.4,1.,25,35,35,45,13,16,1,,,,,,"East Kent Golding, Fuggle, Willamette, Progress, Whitbread Golding","Bitter, Pale Ale, Belgian Ale, Belgian IPA, Barley Wine, Imperial Stout, Red Ale, Irish Stout, American Pale Ale","US Golding, US Goldings, Northwest Goldings","Delicate English-style aromas, fruit, herbs","Golding (US) hops are descended from the original East Kent Golding. In North America, they were first grown in British Columbia, and then appeared in the state of Washington in 1993 and Oregon after that. They are no longer grown commercially in Canada. They feature a subtle bitterness when used as a early addition but are predominantly used for their quintessentially ‘English’ flavor and aroma."
a1b9f793-e730-4d38-ae8a-109e99230ae6,Motueka,"Bittering, Aroma",6.5,8.5,5,5.5,29,,New Zealand,Retains 60%-70% alpha acid after 6 months storage at 20ºC (68ºF),0.8,,47.7,,3.6,,2,,12.2,,,,,,"Saaz, Saaz (US), Sterling","European Ale, English Ale, Dark Lager, Pilsner, Belgian Ales, Lager, Maibock, Ales","B Saaz, Belgian Saaz",Tropical fruit and citrus,"Formerly known as Belgian Saaz or B Saaz, Motueka is a premier New Zealand hop. Developed by HortResearch, this triploid was bred from Saaz and an unnamed New Zealand breeding strain and lends itself well to Lagers, Pilsners and Belgian Ales."
cf02d4e7-cf72-420f-ab96-d524cb0cf7ca,Pacific Jade,Aroma,12,14,7,8,24,,New Zealand,,1.4,,33.3,,32.9,,10.2,,0.3,,,,,,Magnum,"Pale Ale, India Pale Ale",,Flavors of lemon citrus and cracked pepper,"Released from HortResearch’s New Zealand Hop Research Program in 2004, Pacific Jade started its commercial existence predominately limited to the New Zealand domestic market. Now however, it is finding its way into inventories worldwide."
ba33d3f1-36c6-4b3c-ad99-103c6a27ef8c,Bouclier,"Bittering, Aroma",5.2,9,2.4,3.3,20,25,UK / France,,1.1,1.6,38,,34,,3.40,,,,,,,,,"English Ales, Pale Ale, Lager, Imperial Stout, Saison, Pils, Blonde",,"Aromas of herb, grass and spice alongside a citrus and floral character","Emerging in 2005, Bouclier is a cross between Alsace-grown Strisselspalt and a wild male from Wye, Kent. It is unclear however if this variety was first developed in the UK or across the Channel in France."
bdb63b97-d8d0-4dfa-9c63-0210918b728a,Willow Creek,"Bittering, Aroma",,,,,,,,,,,,,,,,,,,,,,,,,,,"Native to Colorado, neomexicanus variety Willow Creek is very new to the brewing scene. There is very little information about them available but they are reportedly considered to be similar to other available neomexicanus varieties Amallia, Neo1, and MultiHead."
244f9b78-756d-4400-886a-4692ef60ca48,Pacific Sunrise,Bittering,12.5,14.5,6,6.5,27,30,New Zealand,Retains 60%-70% alpha acid after 6 months storage at 20ºC (68ºF),1.7,2,45,55,19,25,6,9,0,1,,,,,Pacific Gem,Lager,,,"Released in 2000 by HortResearch in New Zealand, Pacific Sunrise’s take up by commercial breweries has been sluggish. Despite this, it features favorable bittering properties and a pleasant piney aroma. It is the result of a cross between the result of a European and New Zealand male on one side and a California Cluster and a Fuggle on the other."
9ac11b60-ad1f-4399-8eee-4bb0e37be2e2,Summit™,Bittering,16,18,3.3,4.3,26,33,US,Retains 85%-85% alpha acid after 6 months storage at 20ºC (68ºF),1.5,3,30,50,15,25,10,16,0,1,,,,,"Columbus, Simcoe®, Apollo","India Pale Ale, Barley Wine, Imperial Stout",,Citrus aromas,"Developed in 1998 by The American Dwarf Hop Association, a joint hop breeding venture between the owners of Roy Farms, Wyckoff Farms and Green Acres Farms, Summit™ was released for brewing trials in 2000. It has the distinction of being the first semi-dwarf variety to be bred in the United States and is currently the only low trellis variety grown in the country. Its pedigree is decidedly complex, hailing from a combination of Nugget, Zeus and Lexus hops."
b9356f8c-f4ec-4b55-a995-8140ad44ef1d,Hersbrucker,Aroma,2,5,4,6,19,25,Germany,Retains 55%-65% alpha acid after 6 months storage at 20ºC (68ºF),0.5,1.3,10,25,15,35,7,15,0,1,,,,,"Hallertauer Tradition, Spalter Select, Mount Hood, Strisselspalter, Hallertau, Liberty","Dunkel, Strong Ale, Pilsner, Altbier, Weizenbock, Golden Ale, Marzen, Pale Ale, Wheat, Specialty Ale, Hefeweizen, Light Ale, Lager","Hersbrucker-G, Hersbrucker Late, Hersbrucker Spaet, Hersbrucker Spat","Floral, fruity and spicy aromas",German hop Hersbrucker was originally bred with the intention of producing a variety resistant to verticillium wilt that could act as a replacement for Hallertau Mittelfrüh.
78c214af-3612-4d0b-9048-fcf0b9e98921,Tardif de Bourgogne,Aroma,3.1,5.5,3.1,5.5,20,,France,Retains 66% alpha acid after 6 months storage at 20ºC (68ºF),0.49,0.73,44,,13,,5.7,,0.2,,,,,,Precoce de Bourgogne,"Ale, Lager",,"Mild, European-style aroma","Translated into English, Tardif de Bourgogne means Late Burgundy. Similar to Precoce de Bourgogne (Early Burgundy), it is an aroma hop grown in small quantities in the Alsace region of France."
95906f4c-cacb-4261-a21d-e493b5b53b88,Bravo,Bittering,14,17,3,5,29,34,US,Retains 70% alpha acid after 6 months storage at 20ºC (68ºF),1.6,2.4,25,50,18,20,10,12,0,1,,,,,"Columbus, Zeus, Apollo, Magnum, Nugget","India Pale Ale, American Pale Ale, Extra Special Bitter",,"Spicy, earthy, and lightly floral aroma","Bravo’s high alpha content is largely attributable to its parent variety, Zeus. It’s bittering quality is considered smooth and in addition features light floral aromas and subtle flavors of orange and stone fruit making it highly desirable for use in many different ale styles."
4b730afc-2297-4c48-bd09-401d8c457cd2,Golding (BC),Aroma,4,7,,,,,Canada,,,,,,,,,,,,,,,,"East Kent Golding, Golding (American), Fuggle, Willamette","English Pale Ale, Stout, Porter","British Columbia Golding, BC Golding","Exhibits an earthy aroma profile with a flavor profile of smooth, rounded spice.","British Columbia Golding is produced, as one might expect, in Canada. Before the hops industry was fully established in the Pacific Northwest, BC Golding was the only North American-grown Golding. Its alphas are low so it’s bittering capacity is mild at best while it puts forward an earthy aroma profile and flavors of smooth, rounded spice. BC Golding makes a good, British-style pale and has also been noted for it’s successful use in Stouts and Porters."
5e175c7f-39d9-4db7-ad68-1254eed8a0df,Hallertau,Aroma,3.5,3.5,3.5,4.5,20,26,Germany,Retains 52%-58% alpha acid after 6 months storage at 20ºC (68ºF),0.6,1.2,35,44,30,55,10,15,0,1,,,,,"Liberty, Hallertau (US), Hallertauer Tradition","German Pilsner, Pale Ale, Wheat, American Lager","Hallertauer, Mittelfrüh, Mittelfrüher, Hallertauer Mittelfrüher, Hallertau Mittelfruh",Lightly flowery and spicy aroma,"Hallertau, Hallertauer and Hallertauer Mittelfrüher are all names for the original German Hallertau variety. Dating back more than 100 years, it stems from an old German landrace and is one of the original four “noble” hops. It features a lightly flowery and spicy aroma."
c4752218-f62d-41f3-a032-6d5ed8f7346c,Blue Northern Brewer,"Bittering, Aroma",6,8,3,4,24,,Belgium,Retains 78% alpha acid after 6 months storage at 20ºC (68ºF),0.76,,27,40,29,,10,,,,,,,,Chinook,India Pale Ale,,,The Blue Northern Brewer was discovered as a mutant with deep reddish-blue leaves growing in a Belgian hop yard in the early 1970’s. It was released as an ornamental variety in 1992. Its use for brewing is plausible but tentative.
1920682f-79ad-4bb7-8afe-216d48b998fa,Canadian Redvine,Aroma,5,,5,6,47,,Canada,Retains 80% alpha acid after 6 months storage at 20ºC (68ºF),11.2,,70,,2,,2,,4,7,,,,,"Newport, Magnum, Galena","Red Ale, Canadian Porter, French Porter",,"Mild cherry flavor, grapefruit peel aroma","Canadian Redvine, with its dense and profuse rhizomes, high vigor, excellent yield and disease resistance makes it seem like an interesting prospect but with such a high cohumulone content and low alphas, it is not widely used. It is said to impart mild flavors of cherry, berries, pine and even citrus."
bd90c14a-f1dc-4e85-ad39-778f7883cac6,Columbia,Aroma,8.8,,4,,40,,,Retains 72% alpha acid after 6 months storage at 20ºC (68ºF),1.2,,55,,17,,7,,4.1,,,,,,,,,"Pungent hoppy kick, twist of lemon citrus","Columbia enjoyed limited production in the 1980’s but was later discontinued in favor of Willamette. However, as craft brewers have started to discover Columbia’s unique, pungent kick of hoppiness and notable twist of lemon citrus, it seems to have come back in to fashion. Columbia was returned to production in 2011. Now it’s used in Widmer Bros. Columbia Common Spring Ale among others."
6944fb44-03b3-4e92-b830-22e24dbbf230,Fuggle,Aroma,2.4,6.1,2.1,2.8,25,29,UK,,0.44,0.83,43.4,,26.6,,9.1,,4.3,,,,,,"Fuggle (US), Willamette, Styrian Golding, Tettnanger, Newport","English Ale, Porter, Mild Ale, Bitter, Extra Special Bitter, Lambic, Amber Ale, Cask Ale, Stout, Oatmeal Stout, Strong Ale, Nut Brown Ale, Golden Ale, Christmas Ale","Fuggles, Fuggle UK",,"The Fuggle hop originates in England and was first discovered in 1861 in a hop yard owned by George Stace in Kent. Some 14 years later it was officially named and introduced by Richard Fuggle of Benchley in 1875. Similar to a Styrian Golding, is noted for its distinct European aroma and has enjoyed a long, versatile run. At its peak nearly 100 years ago Fuggle was known as a dual-use hop. Today however, as other higher alpha acid varieties have become more prevalent, it’s now more prominently used for its aroma."
705f690f-f895-4f59-922b-f0de52bddf78,Omega,Aroma,9,10,3,4,29,,UK,Retains 78% alpha acid after 6 months storage at 20ºC (68ºF),1.72,,53,,17,,5,,,,,,,,,,,Pleasant European aroma,"Omega, despite its pleasant European aroma, decent alpha, storage stability and wilt resistance, exhibited a yield far too low to gain any major foothold commercially. Omega was Dr. R. A. Neve’s swansong before leaving his post in 1984 as head of the Hop Section at the esteemed English horticultural institution, Wye College."
92b70edf-8c73-43ab-9541-d884683d9eb2,Tettnanger,"Bittering, Aroma",3,5.8,2.8,5.3,24,,Germany,Retains 61% alpha acid after 6 months storage at 20ºC (68ºF),0.36,1.07,40.6,,20.4,,6.2,,11.3,,,,,,"Saaz, Spalt, Santiam, Spalter Select, Tettnanger (US)","Bitter, California Blonde Ale, Red Ale, Pilsner, Lager, American Amber Ale, Winter Ale, Pale Ale, Wheat Beer, Bavarian Hefeweizen, Cream Ale, American Lager","Tettnang, Tettnang Tettnanger, German Tettnang, Tettnanger (GR), Schwetzinger, Deutscher Frühopfen",Balanced floral and herbal aromas with some spiciness,"Selected from an old German landrace, Tettnanger is grown the world over. Swiss, US and Australian varieties can be found on the market today though some foreign versions labeled “Tettnanger” are actually a hybridized mix with Fuggle and not considered a true Tettnanger hop. Tettnanger is grown around its native village of Tettnang in southwest Germany and in small quantities near lake Konstanz in Switzerland."
a4f8d9fb-0b9e-4667-9e61-3c95d0a407a3,Dr Rudi,"Bittering, Aroma",10,12,7,8.5,36,39,New Zealand,Retains 60%-70% alpha acid after 6 months storage at 20ºC (68ºF),1.3,1.6,29,48,22,33,6,10,0,1,,,,,Green Bullet,"Lager, India Pale Ale","SuperAlpha, Super Alpha, Dr Rudi","Grass, pine and citrus flavors","Originally known as SuperAlpha, the variety was renamed to Dr Rudi in 2012. It was bred from New Zealand Smooth Cone and is largely grown in New Zealand. It was originally released in 1976."
9507af51-eaf8-4d36-a63c-56b0f486ed97,Falconer’s Flight®,"Bittering, Aroma",9.5,12,4,5,20,25,US,,1.6,4.6,,,,,,,,,,,,,"Cascade, Columbus, Centennial","India Pale Ale, Pale Ale, Lager",,"Distinct tropical, floral, lemon and grapefruit attributes","Falconer’s Flight® is a proprietary blend of Pacific Northwest hops. These include 7 “C” hops, Cascade, Centennial, Chinook, Citra®, Cluster, Columbus and Crystal in addition to experimental varieties developed by Hopunion LLC."
0f979e18-7c13-492f-ab31-6bd29b3c3ab9,Pacific Gem,"Bittering, Aroma",13,16,7,9,37,40,New Zealand,Retains 70%-80% alpha acid after 6 months storage at 20ºC (68ºF),1.2,1.4,33,55,18,30,7,11,0,1,,,,,Fuggle,"Strong Ale, European Lagers",,Notes of oak and blackberry,"Pacific Gem is a New Zealand hops variety of interesting character. Bred at the New Zealand Horticultural Research Centre as a triploid cross between Smooth Cone, California Late Cluster and Fuggle, it is used around the world in various styles but most notably in European lagers. It was released in 1987."
0256f02c-a7b2-41bc-8bff-239128609b5c,Yakima Cluster,Bittering,4.4,9.8,3,6.1,42,,US,Retains 85% alpha acid after 6 months storage at 20ºC (68ºF),0.24,0.9,45,55,18,,6,7,1,,,,,,Chinook,,Late Cluster L-8,,"First grown in the late 1950’s, Yakima Cluster is the daughter of Late Cluster and the granddaughter of Pacific Coast Cluster. It doesn’t appear to be suited to either Idaho or Oregon growing regions in the US but seems to thrive in the drier Yakima Valley."
2fa2b02b-a8af-4442-bc6f-9616430cc7fc,Saphir,Aroma,2,4.5,4,7,12,17,Germany,,0.8,1.4,25,40,20,30,9,14,1,,0.8,1.3 ,4,5 ,"Hallertau, Hallertau Tradition, Spalter Select","Pilsner, Lager",Sapphire,"Lemon grass, Black tea, Strawberry, Juniper, Citrus","Released in 2002, Saphir features elements of spice and fruit amid refined citrus notes of tangerine. It is considered well suited to Belgian Whites as well as Pilsners and German Lagers."
29999548-c765-4191-9d23-065ccd4752b4,Tettnanger (Swiss),Aroma,4.1,6.3,3.6,5.7,22,,Switzerland,Retains 57% alpha acid after 6 months storage at 20ºC (68ºF),0.42,1.13,,,,,,,,,,,,,"Tettnanger, Fuggle, Saaz, Spalt, Ultra","Lager, Wheat Beer, Pilsner",,Noble aroma,"While it was initially thought to be the same variety as the original German Tettnanger, the Swiss-grown version is now considered to be genetically unique. While the original variety is also known to be cultivated in Switzerland, much of the branded Tettnanger (Swiss) product is actually Fuggle-derived. Despite this, it is higher yielding than its German Tettnanger counterpart and features a similar, noble aroma."
7c52dfca-712a-4ade-a71b-eb31bb438606,MultiHead,"Bittering, Aroma",3.5,5.5,5.5,8,45,,US,,0.5,1.5,48,,,,,,,,,,,,,Pale Ale,,"Heady, floral aroma, some sweet fruit and citrus","MultiHead is a neomexicanus breed native to New Mexico and is so named because of its tendency to produce dual cones. It is a unique hop in the industry and in brewing features a heady, floral aroma and some citrus elements."
bf79eb49-dff3-4daf-a3b3-7eee1c9b546b,Sticklebract,"Bittering, Aroma",13,14.2,7.5,8.5,40,45,New Zealand,Retains 60%-70% alpha acid after 6 months storage at 20ºC (68ºF),0.76,1.72,51,64,8,11,3,6,4,4.6,,,,,Northern Brewer (GR),Extra Special Bitter,,Aromas of pine and citrus,Sticklebract is a dual-use New Zealand variety and another variety bred to stem the issues from Black Root Rot that were present in the country during the mid 20th century. It was selected as a seedling in the 1970’s from open pollinated First Choice.
743e41b0-88f7-402c-ac4a-b229a206a10e,Eroica,Bittering,12.3,,4.5,,40,,,Retains 77% alpha acid after 6 months storage at 20ºC (68ºF),0.8,1.3,55,65,0,1,7,13,0,1,,,,,"Bullion, Brewer’s Gold, Galena","Bitter, Pale Ale, Amber Ale, Porter, India Pale Ale",,Sharp fruity essence,"Despite Eroica hops enjoying a high alpha acid percentage, they are, on paper at least, overshadowed by their sister Galena. It appears this comparison is also moving them toward denouement of commercial production along with their cones being considered difficult to harvest and it’s susceptibility to Ringspot and Mosaic virus."
5102a85b-7bd6-4917-a7e5-2a0ab9b69c67,First Choice,Aroma,4.8,6.7,3.5,6.7,39,,New Zealand,Retains 74% alpha acid after 6 months storage at 20ºC (68ºF),0.51,1.25,71,,1,,1.3,,,,,,,,,,,,"First Choice is a New Zealand variety that was grown commercially for 20 years between the 1960s and the 1980s. It is no longer in commercial production, likely a result of its low alpha content. It was selected by Dr R.H.J. Roborgh at the Riwaka Research Station, much like its parent, California Cluster. It possesses high yield and growth potential but little is known about its flavor and aroma profile."
60faf800-9dd8-4472-9a1a-de169e37c666,Eureka,"Bittering, Aroma",18,19,5,6,27,,,,3.,,43,,29.8,,0.2,,,,,,,,,"Imperial India Pale Ale, India Pale Ale, American Ales, American Red, Saison","EXP #: 05256, Exp Pine Fruit","Falvors of citrus, peach and pine, aromas of stone fruit and mandarin","With similarities to Simcoe® and Summit™ hops, Eureka is a fairly new variety with very strong bittering qualities and a complex and robust flavor and aroma profile. It is said to impart flavors of citrus, resin, tropical and dark fruit along with aromas of grapefruit rind, citrus and tangerine. It is the progeny of varietals Apollo and Merkur."
7e24a12f-6244-4a58-94ae-54102f0250b0,Blisk,Aroma,9.7,14.1,3.3,4.8,33,,Slovenia,Retains 45% alpha acid after 6 months storage at 20ºC (68ºF),2.,,58,,12,,3.7,,15.6,,,,,,,"English Ale, Extra Special Bitter, Lager, Pilsner",,,"Dating back to the late 1970’s, Blisk was bred in its native Zalec region of Slovenia, along with Bobek and Buket in an attempt to instil both high alpha content and pleasant aroma in one cultivar. It is a cross between Atlas and a male varietal from the former Yugoslavia. Despite its decent yield, Blisk is not being commercially produced."
51a09fca-82f5-4f79-affe-b6353c34ec1b,Amallia,"Bittering, Aroma",5.5,9,4.2,8.3,,,US,,,,,,,,,,,,,,,,,"Brown Ale, Dark Ale",,Deep earthy aroma,"Native to New Mexico, Amallia is a neomexicana varietal with a deeply earthy aroma and pronounced flavors of orange citrus. Bold and unique, it is considered well suited to brown or dark ales for both bittering and aroma. This variety was being trialed in Michigan by Michigan State University researchers in 2014."
1bc6b7ef-b5a8-42d2-b5bd-307d9ab1a214,Kirin II,"Bittering, Aroma",8,,6.4,,43,45,Japan,Retains 70% alpha acid after 6 months storage at 20ºC (68ºF),1.18,,50,,14,,9.4,,0.2,,,,,,,,,,Kirin II is one of a few Japanese hops to spring up since the Japanese governments decision to reduce the importation of beer hops. The variety is grown domestically and solely under government contract. The variety was developed by Kirin Brewery Co. as a clonal selection from Shinshuwase and as such is directly descended from Saaz and open pollinated White Vine.
773967f1-e701-4497-8e1a-653ed649f059,Topaz,"Bittering, Aroma",13.7,17.7,6.4,7.9,48,51,Australia,,1.7,2.2,34,56,8,13,7,13,1,,,,,,"Galaxy®, Citra®, Cascade, Riwaka, Rakau, Amarillo®","India Pale Ale, American Pale Ale, Bitter, Amber",,"Light, tropical fruit flavors of lychee, clove-like spice and resinous grassy tones when dry hopped","Australian-born multi-purpose variety Topaz features elements of clove-like spice and a light, lychee-esque fruitiness. Samuel Adams uses it in their Tasman Red IPA. When used alongside a citrus-heavy hop (Samuel Adams used Galaxy®), it gives a surprising depth of flavor."
3719c06f-3e6a-44d7-9e3e-3d32a0afd0eb,Northern Brewer (GR),Bittering,7,10,3.5,5,27,33,Germany,,1.6,2.,25,45,35,50,10,20,1,,,,,,"Perle, Northern Brewer (US)","Steam Beer, German Ale, German Lager","Hallertau Northern Brewer, Hallertauer Northern Brewer",,Northern Brewer was originally developed in England in 1934 but is now largely grown in Germany. German-grown Northern Brewer is considered identical to the original UK-bred variety though subtle differences attributable to the different growing region may be evident.
f028b51e-99e6-49c9-b001-da32df032d94,Smooth Cone,"Bittering, Aroma",7,9.5,3.4,5.2,31,31,New Zealand,Retains 60%-70% alpha acid after 6 months storage at 20ºC (68ºF),0.38,1.14,55,,21,,6,,0,1,,,,,Cluster,Lager,SmoothCone,,"Smooth Cone is a New Zealand hop variety. It is no longer grown commercially but can still be found. Developed in the 1960’s, the variety was introduced alongside two other Black Root Rot resistant varieties, First Choice and Calicross after the disease savaged New Zealand’s hops industry during the mid 20th century."
920127b1-e3d2-4223-b715-2d47bdb740b2,Admiral,Bittering,13,16.2,4.8,6.1,37,45,UK,Retains 85% alpha acid after 6 months storage at 20 degrees C,1,1.7,39,48,23,26,6,7,1.8,2.2,0.8,1 ,,,"Chinook, Northdown, Challenger, Centennial, Cascade (US), Amarillo, Target","Extra Special Bitter, American India Pale Ale, Belgian India Pale Ale, Imperial India Pale Ale, India Pale Ale, Pale Ale, Bitter",,"Tea, Ripe Kiwi, Lemony","Admiral is an excellent mid-season hops variety derived from grandparent Challenger and likely parent, Northdown. Its exact lineage is unclear. Hailing from Wye College, England it was released to the brewing world in 1998 as a potential high-alpha replacement or complimentary addition to Target hops."
f394c55e-b39b-4116-ad27-37ae11770d94,Newport,Bittering,13.5,17,7.2,9.1,36,38,US,Retains 60% alpha acid after 6 months storage at 20ºC (68ºF),1.6,3.6,47,54,9,1,1,7,0,1,,,,,"Galena, Nugget","Pale Ale, Amecan Lager",New Port,"Clean bitterness, flavors of wine and balsamic",Newport is the offspring of Magnum and a USDA male variety. Oregon State University and the USDA successfully bred it in 2002 in an effort to address concerns over mildew resistance. It was said to have helped save Northwest US hops production around this time when mildew issues threatened multiple hops varieties.
20924321-007d-4eef-928d-36c340494c36,Crystal,Aroma,2.8,4.4,5.8,7,21,26,,Retains 65% alpha acid after 6 months storage at 20ºC (68ºF),65 ,2.1,40,,26,,7,,,,,,,,"Liberty, Mount Hood, German Hallertau, Ultra, Strisselspalter, Hersbrucker","Bitter, Pilsner, Light Lager, Golden Ale, Nut Brown Ale, Pale Ale, India Pale Ale, Stout, Chocolate Stout, American Lager",,"Passion fruit, Lime, Camomile blossom, Apricot, Lemon grass","Despite a relatively low yield, Crystal’s has made it a fairly popular hop. It’s woodsy, green, floral and fruity with herb and spice notes of cinnamon, nutmeg and black pepper. Extremely versatile, it’s even used for its notable aromatic qualities in IPAs and Bitters despite its low alpha acid content."
d186398c-efdf-4cc4-a7d1-0b284e95db48,Challenger,"Bittering, Aroma",6.5,9,3.2,4.5,20,25,UK,Retains 70%-85% alpha acid after 6 months storage at 20ºC (68ºF),1,1.7,30,42,25,32,8,10,1,3,,,,,"Perle (US), Northern Brewer, Admiral","Golden Ale, Barley Wine, Imperial Stout",Wye Challenger,,"Released to the public in 1972, Challenger hops were developed at Wye College from varieties Northern Brewer and German Zattler. It accounted for a significant percentage of the hops grown in the UK during the 1980’s and 1990’s."
5411d401-1fd9-42ad-825d-8260b578558a,Cluster (US),"Bittering, Aroma",5.5,9,4,6,36,42,US,Retains 80%-85% alpha acid after 6 months storage at 20ºC (68ºF),0.4,0.8,38,55,15,20,6,10,0,1,,,,,"Eroica, Galena","Barley Wine, Porter, English Pale Ale, Amber Ale, Honey Ale, Cream Ale, American Lager",,"Clean, neutral, slightly floral","Cluster (US) is thought to be one of the oldest and most robust hop crops in the US. With its balanced aroma and bittering profile and outstanding storage stability, it has long been a go to hop of large commercial breweries in the US."
b2cbf2b2-c9c6-4f5c-be11-327917429b85,Herkules,"Bittering, Aroma",12,17,4,5.5,32,38,Germany,,1.4,2.4,30,50,28,45,7,12,1,,0.3,0.8 ,3,4 ,,German Ale,,"Melissa, Orange, Honeydew Melon, Lemon grass, Peppermint","Strong and robust in flavor and aroma, German Herkules lives up to it’s name. The Hüll-bred offspring of Hallertauer Taurus, Herkules is a high alpha acid bittering hop, known to be spicy and floral, tangy and hoppy, with notes of melon, black pepper, with hints of pine. It was released in 2005."
ed85b0d6-a929-4000-9878-e82c18962ef7,Pride of Kent,"Bittering, Aroma",8,11,6,8,35,,,Retains 42% alpha acid after 6 months storage at 20ºC (68ºF),2.32,,70,,9,,3,,,,,,,,Galena,,,,"Developed in England at Wye College, Pride of Kent features a pleasant continental-type aroma. It was first developed sometime in the early to mid 20th century from open pollinated Brewer’s Gold. Pride of Kent is also the parent of the celebrated Australian variety, Pride of Ringwood."
