7413e6ff-d591-4d5f-b71a-aee663b2ba6a,Sladek,Aroma,4.5,8,4,7,23,30,Czechia,,1.0,2.,35,50,20,40,9,14,1,,0.15,0.3 ,3.5,5 ,Saaz,"Lager, Pilsner","Czech Sladek, VUCH 71","Passion fruit, Strawberry, Cassis, Grapefruit, Peach","Sladek, meaning ‘brewer’, is a high yielding aroma variety and cross between Saaz and Northern Brewer. Originally registered as VUCH 71 In 1987, it was renamed to Sladek in 1994. Sladek features a classic hoppy aroma atop a fruity flavor profile with essences of peach, passionfruit and grapefruit."
383c3e4f-1f66-4587-be68-334d837b1e96,Azacca ®,"Bittering, Aroma",14,16,4,5.5,38,45,US,,1.6,2.5,46,55,14,18,8,12,1,,,,,,,India Pale Ale,Azaaca,"Aromas of tropical fruits and citrus. Tasting notes of spicy mango, pineapple, tangerine and pine.","Named after the Haitian god of agriculture, Azacca is one of a new brood of dwarf bittering hops. Descended directly from Toyomidori, its greater parentage also includes Summit™ and Northern Brewer. Bred by the American Dwarf Hop Association, a joint hop breeding venture between Roy Farms, Wyckoff Farms and Green Acres Farms, Azacca is considered by many brewers as being well suited to IPAs."
83455014-93ec-42f2-8d0a-9817ce2e21a6,Marynka,"Bittering, Aroma",9,12,10.2,13,26,33,Poland,Retains 60%-70%alpha acid after 6 months storage at 20ºC (68ºF),1.8,2.2,28,31,36,33,10,13,1.8,2.2,,,3.8,4.3 ,Tettnanger,"Bitter, India Pale Ale, Pale Ale, Pilsner",,"Hay, Liquorice, Lemon, Grapefruit, Aniseed","Marynka hops are another widely produced Polish hop from the region Lublin. It is moderate in most things: yield, growth, stability, but her flavor profile is way above average. Despite being used primarily for bittering, Marynka features a forward, earthy and herbal flavors and aromas. It is the offspring of Brewer’s Gold and was official registered in 1988."
ba7bf905-4690-446c-9251-6b0afab9397e,Mosaic ®,"Bittering, Aroma",11.5,13.5,3.2,3.9,24,26,,Retains 75% alpha acid after 6 months storage at 20ºC (68ºF),1,1.5,47,53,13,16,5,8,,,,,,,Citra®,"India Pale Ale, Pale Ale",HBC369,,"Released in 2012 by the Hop Breeding Company, LLC, Mosaic hops feature complex but clean flavor characteristics and are known for their triple-use profile encompassing bittering, flavor and aroma. They have high alpha acids but low cohumulone which makes them pleasantly hoppy, carrying flavors of mango, pine, citrus and herbs and aromas of tropical and stone fruit. Mosaic is the first daughter of Simcoe and Nugget as has been humorously referred to by some as “Citra on steroids”."
f54d1de6-50b6-4088-9e00-7a1913cf451d,Gargoyle,Aroma,7.50,,,,,,US,,,,,,,,,,,,,,,,"California Cluster, Ivanhoe",,,Citrusy-mango aroma,"Gargoyle, along with Ivanhoe, is a new generation of California Cluster and the first to be grown commercially in over half a century. Revived by organic hop farm Hops-Mesiter, LLC near Clearlake, California, it is similar to Ivanhoe but tends more toward a citrusy-mango bouquet."
674013f7-82fd-412e-9861-9fe8c707d69b,Eastern Gold,Bittering,11,14,5,6,27,,Japan,Retains 81% alpha acid after 6 months storage at 20ºC (68ºF),1.43,,42,,19,,7,8,3,,,,,,Brewer’s Gold,,,,"Eastern Gold is a Super Alpha variety developed in Japan by Kirin Brewing Co. Ltd Hops Research from Kirin No. 2 and OB79, an open-pollinated wild American hop. Despite its yield potential, high alpha acids and storage stability, it seems it is not currently being grown in any significant commercial capacity."
c026afc7-8986-44d2-8126-7db182829089,Early Bird,Aroma,4.4,6.7,1.9,2.8,26,32,UK,,0.8,,,,,,,,,,,,,,"East Kent Golding, Cobb, Bramling Cross",India Pale Ale,Amos’s Early Bird,"Pleasing, delicate aroma","Early Bird, or Amos’s Early Bird as it was formerly known, is a Goldings variety and considered one of England’s premier aroma hops. While not terribly disease and wilt tolerant, it is bred for its immensely pleasing aroma and gentle hoppiness."
d3fa8cc8-1987-4363-9832-fc0702f78cc7,Janus,Aroma,5.1,,2.3,,32,,UK,Retains 68% alpha acid after 6 months storage at 20ºC (68ºF),0.58,,40,,34,,10.9,,,,,,,,,,,Pleasing European aroma,"Selected at Wye College, England in the 1950’s, Janus was originally praised for its early harvest qualities. Its extremely low yield however led it to being discarded as a commercial prospect in 1992. To date, it has never been used for breeding either. It is a cross between a Eastwell Golding, a New Mexico Wild American hop and other unspecified English hops. Janus exhibits very high myrcene potential and is said to have a pleasant, European aroma."
7977ad4b-49c3-48e4-a816-778eb492b372,Fuggle Tetraploid,"Bittering, a Aroma",5,,2.4,,26,,,Retains 69% alpha acid after 6 months storage at 20 degrees C,0.93,,49,,24,,20.2,,3.9,,,,,,,,,,"Fuggle Tetraploid is both an aroma and a bittering hop, and the female parent of both Columbia and Willamette. It is one of the descendants of the original English Fuggle hops."
df266fd3-834e-40b8-a8c9-c0ea12f956f3,Universal,"Bittering, Aroma",5.2,,3.7,,23,,Czechia,,,,,,,,,,,,,,,,Hallertau,,,Noble aromas and mild bitterness,"Universal was bred in Czechia, but as of 1991 is no longer listed as a commercial variety. It is however still being produced in the US and has since become a darling of the craft brewing industry."
0e8af14f-60ec-454e-bc22-7e49a73403bc,Brewer’s Gold (US),Bittering,8.1,13.1,3.7,6.8,41,,US,Poor,1.8,,40,,35,,35,,,,,,,,"Bullion, Cascade, Galena, Northern Brewer, Northdown",India Pale Ale,,,"Sister to Bullion, US-grown Brewer’s Gold is a cultivar of the original English variety, Brewer’s Gold. Despite having been developed in England, its origin is undoubtedly North American having been initially derived from a wild hop sourced from Canada’s Pembina Valley in Manitoba. The American version is naturally similar to the original but contains higher alpha acids on average."
d884f9c2-8a01-4d4a-83f9-93b55d03964f,Bianca,Aroma,7,8,3.4,,20,28,US,,0.6,1.,30,,25,,8,,13,,,,,,Sunbeam,"Lager, Pilsner, Belgian Ale","Bianco, Bianca Gold",,"Bianca (a.k.a. Bianco and Bianca Gold), with its lemon yellow color and red-brown to pink contrasting stem, is bred strictly as an ornamental hop. It must be grown in semi-shaded areas as its light leaves are subject to leaf burn in the sun. While not bred for commercial use, it is said that the cones can be used for flavoring if a Saazer-style aroma and taste is desired. Sunbeam, Bianca’s half-sister has similar characteristics."
e12318c7-e805-4175-80d1-e7a19c4baf34,Hallertauer Tradition,Aroma,4.6,7,4,5,23,29,Germany,Retains 65%-70% alpha acid after 6 months storage at 20ºC (68ºF),0.9,1.9,20,25,40,55,10,15,0,1,0.7,1.2 ,4,5 ,Retains 65%-70% alpha acid after 6 months storage at 20ºC (68ºF),American Lager,"Tradition, German Tradition, H Tradition","Apricot, Peach, Cassis, Citrus, Orange","Hallertau Tradition is a Hüll-bred fine aroma hop originating from Hallertau Mittelfrüher, Hallertauer Gold and Saaz. Bred specifically for fungus and disease resistance, it succeeded in that effort and also features higher alpha acids than its parent varieties, low cohumulone and higher myrcene. It was released for commercial production in 1989."
fe049364-cc65-4ddb-982b-069f41f37d38,Saaz (US),Aroma,3,4.5,3,4.5,24,28,US,Retains 45%-55% alpha acid after 6 months storage at 20ºC (68ºF),0.5,,25,37,23,40,7,11,9,13,,,,,"Saaz, Hallertau, Tettnanger, Lubelska, Sterling","Lager, Pilsner","US Saaz, American Saaz","Mild, earthy, spicy, herbal","Despite exhibiting a low yield, Saaz (US) is a popular commercial aroma variety and is used in many US beers today. Bred from the original centuries-old Czech Saaz variety, it carries the same noble qualities but with some subtle differences. Its flavor and aroma profile is mild, earthen and spicy and its alpha is slightly higher than its Czech twin. Saaz (US) is primarily used in Lagers and Pilsners."
2f3944c4-689a-4c97-aeec-5aefcd20e5bc,Vital,"Bittering, Aroma",14,17,8,11,,,Czechia,,60 ,2.5,40,,,,,,,,0.5,0.9 ,3.5,4.5 ,,,,"Plum, Lavender, Liquorice, Melissa","Vital is a new hop variety out of the Zatec breeding program in Czechia. Both high alpha and beta acid content gives it a spicy hop aroma. To date, Vital has been used successfully in single-hopped pale ales though it was originally bred for pharmaceutical and biomedical purposes with its increased levels of xanthohumol – a potent antioxidant."
404f60e6-675f-44cf-8fdd-5e202f62fb06,Cashmere,"Bittering, Aroma",7.7,9.1,3.3,7.1,22,24,US,Retains 75% alpha acid after 6 months storage at 20ºC (68ºF),1.2,1.4,39,42,26,29,12,13,1,,,,,,,Saison,,,"Developed by Washington State University and released in 2013, Cashmere is the result of a marriage of Cascade and Northern Brewer. Fortuitously, it features alpha acids higher than that of Cascade."
0dd16c81-f947-4f14-a15c-8782650ea409,Feux-Coeur,Bittering,12,16,3.1,6,,,Australia,,,,,,,,,,,,,,,,,,Feux-Coeur Francais,,"Cheekily named Feux-Coeur (aka Feux-Coeur Francais) is an Australian bittering hop with genetic roots in Burgundian France. First harvested in 2010, the breed is considered rare and bred specifically to be grown in the cooler, southern state of Victoria. Unfortunately little has been written about its best utilization or flavor profile at this stage."
7e04cec5-6ebd-476e-92a3-85c66e47e3f2,Boadicea,Aroma,7,10,3,4,26,,UK,,1.4,2.,30,,20,,15,19,5,,0.2,0.4 ,,,,Pilsner,,"Peppermint, Barrique, Tobacco, Lime, Liquorice","Released in 2004, Boadicea is a finishing hop bred by Horticulture Research International. Known as the first aphid-resistant variety in the world, it also exhibits excellent resistance to wilt and downy mildew. As a dwarf/hedgerow variety, it grows to a shorter height than traditional varieties and yields just the same, making it an easier prospect to harvest."
e12f3adf-044c-49fd-bf8b-2ac7ec6e6db0,Whitbread Golding,"Bittering, Aroma",5,7.5,2.5,3.5,33,37,UK,Retains 66% alpha acid after 6 months storage at 20ºC (68ºF),0.8,1.22,24,27,38,42,9,13,2.1,,,,,,"Fuggle, East Kent Golding","Ale, Pale Ale, Bitter","WGV, Whitbread, Whitbread Golding Variety","Pleasant, fruity, European style aroma","Whitbread Golding enjoys a robust flavor and hoppiness particularly in comparison to other Golding varieties. With its pleasant, fruity, European-style aromatics, it has traditionally been very popular in England and is currently grown extensively for commercial, craft and home brewing use."
ca5bbed9-db53-47db-963d-e0d407469b0b,Orbit,"Bittering, Aroma",4,6,4,6,25,,New Zealand,,1.5,,33,,33,,14,,2,,,,,,,,,,"Orbit is a dynamic hop blend consisting of a constantly evolving selection of hops from New Zealand’s ‘Hops with a Difference’ breeding program. The selected hops in Orbit change year to year based on an available crops quality and uniqueness. As such, no specific tasting notes are possible but usage in the past has resulted in flavors and aromas of tropical fruit."
513c00e9-b2e1-4fdc-815b-a751a5e75d04,Comet,"Bittering, Aroma",9.4,12.4,3,6.1,41,,US,Retains 49% alpha acid after 6 months storage at 20ºC (68ºF),65 ,3.3,40,,1,,10,,0.1,,,,,,"Galena, Summit™","Lager, American Ale, India Pale Ale, Ale",,"Mandarin, elderberry sirup, Geranium, Lemon grass, Resin","Comet has an intriguing parentage of English Sunshine and a native American hop, bringing out a “wild American” flavor. Released in 1974 by the USDA, Comet was originally bred to address the needs for higher alpha hops. Today, it is no longer in commercial production and is somewhat difficult to find."
cc84fd06-a15c-421f-8818-e1cbeee827e8,Cekin,Aroma,6,8,2,3,24,,Slovenia,Retains 79% alpha acid after 6 months storage at 20ºC (68ºF),1.07,,47.9,,16.5,,6.2,,7.1,,,,,,,,,"European aroma, similar to Styrian hops","Like its sibling Cicero, Dr Dragica Kralj at the Hop Research Institute in Zalec, Slovenia originally selected Cekin in the 1980’s. It is a cross between Aurora and a Yugoslav male. It is not currently grown in large quantities commercially due to a lack of interest from breweries. Its vigor and yield are great in Slovenia but to date it has not proven itself in Corvallis test plots in the US. It is said to have a pleasing, distinctive and continental aroma comparable to Styrian Golding."
b730fabc-35d6-4a56-a803-4fd525e63697,Pocket Talisman,Aroma,6,,3.2,,55,,US,Retains 70% alpha acid after 6 months storage at 20ºC (68ºF),0.63,,65,70,5,,,,,,,,,,"Talisman, Cluster",,,,"Originating in Idaho, USA, Dwarf variety Pocket Talisman has proven difficult to establish with rhizomes often failing to produce bines. Originally selected from a field of regular Talisman hops in the 1970’s, the initial test plot took three years to establish due to failed rhizome growth. Once established it produces well on a low trellis but is not currently grown commercially. Little is known of its exact aroma and flavor profile but it is said to share some similarities with Cluster."
febf677f-0591-4c5d-bdd1-36bb35d0a4c5,Spalt,Aroma,2.5,5.7,3,5,22,29,Germany,Retains 50%-60% alpha acid after 6 months storage at 20ºC (68ºF),0.5,0.9,20,35,20,30,8,13,12,18,,,,,"Saaz, Tettnanger, Santiam, Liberty, Hallertau","German Ale, Lager, Pilsner, Bock, Kolsch","Spalter, Spalt Spalter, Spalter Spalt, German Spalt","Earth, spice","Surely one of the world oldest hop varieties, Splat hops date back as far as the 8th century and in the 16th century they were the first variety to be granted the German hop seal – a historically significant certification system predating the current, German Hop Provenance Law. Grown primarily in the Spalt region of Germany, it is one of the original landrace hops."
1da92247-ba65-4cbb-ad65-5985ee0ba030,Belma®,"Bittering, Aroma",9.4,12.1,,,,,US,,,,,,,,,,,,,,,,,"Pale Ale, Blonde, IPA",,"Notes of orange, melon, strawberry, pineapple with a hint of grapefruit","Belma® hops are a recent addition from Hops Direct and Puterbaugh Farms in the Yakima Valley. Belma has been tested as a dual-use hop and found to have an ambrosial mix of orange, melon, strawberry and pineapple with a slight hint of grapefruit. Backing that up, OSU created a Pale Malt with Belma which carried those same aroma and flavor characteristics."
4b568e56-3dfb-4c50-a436-b508b3031c7a,Styrian Gold,"Bittering, Aroma",3.5,6.5,3.5,5.9,28,35,Slovenia,,1.3,2.3,38,47,19,22,5,10,6,10,1.3,2.3 ,,,Styrian Golding,,,"Oregano, Honey, Hay, Basil, Nettle","Styrian Gold should not be confused with Styrian Golding (aka Savinjski Golding, technically a Fuggle-type hop). Styrian Gold is a Slovenian hop, bred from a Styrian Golding and a Slovenian wild male. It has a noble aroma and a balanced hoppiness, which in part stems from a relatively even alpha to beta acid ratio. Styrian Gold also benefits from good storage stability. It was released in 2009."
6fddd994-e2cd-4430-8f85-05b33aa21ec4,Brewer’s Gold,Bittering,7.1,11.3,3.3,6.1,3.3,6.1,UK,Retains 60%-70% alpha acid after 6 months storage at 20ºC (68ºF),1.96,,66.7,,11.6,,6.5,,,,,,,,"Bullion, Cascade, Galena, Northern Brewer (US), Northdown","Ale, American Pale Ale, Bitter, Barley Wine, Imperial Stout",,Notes of spice and blackcurrant,"Brewer’s Gold hops were selected by Ernest Stanley Salmon at Wye College in England in 1919 and were the result of the open pollination of a wild hop sourced from Morden, Manitoba. Despite its initial popularity, the advent of super-alpha hop varieties in the 1980’s rendered Brewer’s Gold largely redundant from a commercial perspective."
078c5eb1-5dc5-43c6-a890-cbbe99f475c5,First Gold,"Bittering, Aroma",5.6,9.3,2.3,4.1,31,36,UK,Retains 80%-85% alpha acid after 6 months storage at 20ºC (68ºF),0.7,1.5,24,28,20,24,6,7,2,4,0.4,0.6 ,,,"Willamette, East Kent Golding, Styrian Golding","Porter, English Bitter, Wheat Beer, Celtic Ale, Summer Ale, Amber Ale, Dark Amber Ale, India Pale Ale, Imperial India Pale Ale",,"Marjoram, Celeriac, Strawberry, Yoghurt","First Gold is a Golding variety, bred from Whitbread Golding and a dwarf variety at Wye College in England. It was released in 1996 and has the distinction of being England’s first hedgerow hop. For brewers, it is useful in just about any style."
d5870cba-f679-4bed-9f0d-0d4b0c7b8968,Rakau,"Bittering, Aroma",5.8,10.9,2.6,4.8,27,,New Zealand,Retains 72% alpha acid after 6 months storage at 20ºC (68ºF),1.2,,44,65,15,,3,8,5,,,,,,,"Pale Ale, Lager","AlphaAroma, AlphAroma",,"Rakau, or AlphAroma as it was previously known, was developed in New Zealand. Languishing in its disease free habitat, Rakau features a high concentration of myrcene is said to pair it beautifully to dry-hopped American Pale Ales."
ac4c3ff4-4272-4c5d-9ad7-bbc9be50ba2d,Cascade (Argentina),Aroma,3.2,,4.5,7,33,40,Argentina,,,,,,,,,,,,,,,,"Hallertau, Tettnanger, East Kent Golding","Barley Wine, American Pale Ale, Kolsch, Cream Ale, Wheat, Blonde",,"Lemongrass, pepper and spice","Unlike the American Cascade, the Argentine Cascade has a mellow character with notes of lemongrass, pepper and spice. It is not considered interchangeable with the American Cascade, which has a very different profile. It is a fine aroma and finishing hop, excellent for wheat beers, blondes and has been suggested as being especially suited to lightly bittering a cream ale. Argentinian Cascade is often compared to Hallertau or Tettnanger."
6034f1b4-300d-4512-abd9-c0f00bb4124a,Teamaker,Aroma,0.6,1.8,5.4,13.2,,,,,,,,,,,,,,,,,,,,Pale Ale,,No bitterness whatsoever,"Developed over several decades by the USDA, Teamaker hops were officially released by the ARS Forage, Seed and Cereal Research Unit in Corvallis, Oregon in the late 2000’s. They are a unique high beta, low alpha breed that have made their mark, not just in the brewing industry, but in the world of medicine and food as well."
d2b40302-bd4d-4a79-a20d-e945afc8d8cd,Sterling,"Bittering, Aroma",4.5,9,4,6,21,28,US,Retains 60%-75% alpha acid after 6 months storage at 20ºC (68ºF),0.6,1.9,44,48,19,23,5,8,11,17,,,,,Saaz,India Pale Ale,,"Spicy, citrus aroma, herbal notes","Sterling was successfully bred to overcome Saaz’s susceptibility to mildew. Developed over 8 years in Corvallis, Oregon it was released in 1998."
f159571e-949e-41ff-b444-d7fbbb6c8261,Hallertau (US),Aroma,3.5,5.5,3.5,5.5,18,24,US,Retains 52%-58% alpha acid after 6 months storage at 20ºC (68ºF),0.6,1.,35,44,30,38,10,12,1,,,,,,"Mount Hood, Liberty, Crystal, Hallertauer Mittelfrüh, Hallertauer Tradition, Ultra","Lager, Pilsner, Bock, Wheat Beer, Kölsch, Munich Helles, Belgian Ale, American Lager",US Hallertau,"Flowery, delicately spicy","Hallertau (US) is definitely a tenacious, Bavarian-style hop. It long dominated its heritage region and is still in demand by craft brewers for Bavarian-style ales. As an American hop, it is outperformed by Mt. Hood and Liberty but is still holding its own. Its low alpha acids and high humulene contribute to a mild, flowery and delicately spicy aroma and flavor profile. The original German-grown Hallertau has long been the staple of German and European lagers."
2cb566fb-52a6-44d6-bec7-7bb846c8ae9a,Landhopfen,Aroma,3.2,4.1,2.5,3.5,21,25,Germany,Retains 66% alpha acid after 6 months storage at 20ºC (68ºF),0.37,,37,,22,,6.3,,13.3,,,,,,,,,Pleasing European aroma,"A low growth rate and yield in addition to a susceptibility to viruses are all reasons why the old German Landhopfen variety is no longer grown commercially. While it’s exact date of creation remains illusive, it has been documented as a variety as far back as 1851. It is said to have good European aroma characteristics and is thought to be a cultivar of an old German land race created via clonal selection."
1995b4d6-b204-4407-8721-0963315b859b,Sunbeam,Aroma,4,5,2.5,,36,,US,,0.8,1.3,56,,14,,4,,6,,,,,,Saaz,"Pilsner, Ale",,Saaz-style characteristics,"Not originally envisioned for use in brewing, Sunbeam is an ornamental hop that was discovered to be inadvertently useful as an aroma hop. Selected in 1992 in Corvallis, Oregon, it features characteristics similar to that of its parent variety, Saaz."
b53b6dd4-56f5-40dc-beef-5db0bf821fdd,Apolon,"Bittering, Aroma",10,12,4,,2.25,,Slovenia,Retains 57% alpha acid after 6 months storage at 20ºC (68ºF),1.3,1.6,63,,26,,4,,11.3,,,,,,,"Bitter, India Pale Ale",,,"Apolon hops are hard to come by with cultivation dwindling since its Super Styrian status was brought into question. Originally introduced as a Super Styrian in the 1970’s, it has since been reclassified as a Slovenian hybrid and is a cross between Brewer’s Gold and a Yugoslavian wild male."
9c8f25b8-ba5c-49a4-bda0-498e3cd968af,Simcoe®,"Bittering, Aroma",12,14,4,5,15,20,US,Retains 70%-80% alpha acid after 6 months storage at 20ºC (68ºF),2,2.5,60,65,10,15,5,8,0,1,,,,,Summit,"Double India Pale Ale, India Pale Ale, Pale Ale",,"Blackberries, Berries, Grapefruit, Plum","Released to the world in 2000 by Yakima Chief Ranches, American variety Simcoe® has become wildly popular with craft brewers. With a high alpha percentage and low cohumulone, it makes a very nice foundational bittering hop. It is also noted though for its favorable aroma qualities. It has a pleasantly fruity, yet earthy herbal and piney aroma."
c0744b9f-7fe2-4e4f-a51c-2068640e254d,Southern Cross,"Bittering, Aroma",13,14,6,7,28,,New Zealand,Retains 71% alpha acid after 6 months storage at 20ºC (68ºF),1.59,,58,,14,,4,,5,,,,,,,"Pale Ale, India Pale Ale, Lager",,"Soft bitterness, lemon zest and pine needles",Southern Cross was created by New Zealand’s HortResearch breeding program as a cross between Smooth Cone and the result of a Californian and English Fuggle. It was released in 1994.
9e9c3c80-c7d4-41f8-a0dc-c4c98baf7f26,Symphony,Bittering,16,18,5,5.6,44,,,,2.6,,39,,,,9,,8.8,,,,,,,,,,Despite Symphony’s very high alpha content and excellent storage stability its extreme susceptibility to powdery mildew has largely deemed the variety untenable for commercial production.
62b0f480-0623-4800-a865-11f704e288ed,Groene Bel,Aroma,4.9,,3.5,,27,,Belgium,Retains 58% alpha acid after 6 months storage at 20ºC (68ºF),0.98,,39,,32,,18,,2.41,,,,,,,,"Green Belle, Green Bubble Belle",Pleasing continental aroma,"Groene Bel or Green Belle as it is otherwise known, is a long-lost Belgian hop that likely came about via clonal selection from native Aalst hops in the late 19th century or early 20th century. After World War II, Groene Bel all but vanished from hop production in Belgium after it was replaced by Czech and German favorites, Saaz and Hallertau. Although Groene Bel is no longer commercially produced, it has been used for breeding aroma hops in Zalec, Slovenia during the 1970’s. Its high humulene content is said to result in a pleasing, continental aroma."
1285d6fd-e066-4615-802d-4b8efd954e0a,Hallertau Blanc,Aroma,9,12,4.5,6,22,26,Germany,,0.8,1.5,50,75,0,3,0,2,0,3.5,,,3,5.9 ,Nelson Sauvin,,,"Lemon grass, Cassis, Elderflower, Grapefruit, Grapes","Hallertau Blanc, daughter of Cascade, was released to the world in 2012. Established on the Hüll farm in the German Hallertau region, it was grown primarily for use in American-style Ales. Hallertau Blanc’s flavor profile is said to be fruity, with wine-like qualities of gooseberry and grass, similar to that of Sauvignon Blanc. It also features a complex aroma profile with notes of cassis and elderflower in addition to grapes, grapefruit and lemongrass. Other notes detected in trials have been passionfruit, pineapple and gooseberry."
d51f82b8-b34a-417f-b7c9-956bdd8438a3,Bullion,Bittering,6.7,12.9,3.7,9.1,39,,UK,Retains 40%-50% alpha acid after 6 months storage at 20ºC (68ºF),1.14,2.7,45,55,23,30,9,11,,,,,,,"Columbus, Northern Brewer, Galena, Chinook, Brewer’s Gold","Stout, Doppelbock, Barley Wine, Imperial Stout",,Elements of spice and dark fruits,"Sister selection to Brewer’s Gold, Bullion was first bred in 1919 at Wye College, England and originates from a wild hop cutting sourced from Manitoba, Canada. It was officially released in 1938."
d722f17e-46df-4442-9d24-f282bae6e192,Sorachi Ace,"Bittering, Aroma",11.5,16,6,7.5,23,28,Japan,,1.5,3,44,55,20,26,7,11,2,5,0.5,0.8 ,,,,"Lager, Pilsner, Saison",,"Over-ripe orange, Lychee, Lemon grass","If you’ve ever enjoyed Sapporo, then you know what Sorachi Ace can do. Originally produced by the Sapporo Brewery in Hokkaido, Japan in the mid-1980s, it was resurrected in the US in 2006. It is a cross between Saaz, Brewer’s Gold and BeiKei No. 2."
abe8eccb-f0ab-4fc5-86cf-fe4a7b2cc291,Ella,Aroma,13.3,16.3,4.8,7.8,34,38,Australia,,2.4,3.4,40,50,16,22,12,18,0,1,,,,,,"Lager, Pilsner, Pale Ale, Stout",Stella,"Tropical flavors, grapefruit, star anise","Ella™ hops, formally known as Stella, is an Australian aroma variety. It is half-sister to Galaxy® and the progeny of Spalt and a tetraploid female and was developed in the state of Victoria in the early 2000’s. By 2007, Ella™ was ready for release in brewing trials. An immediate hit, the variety was fast-tracked into commercial production."
4122dfd2-9963-4993-abcf-4b141fefa425,Hybrid-2,Aroma,10.2,,6.3,,32,,South Africa,Retains 60% alpha acid after 6 months storage at 20ºC (68ºF),0.9,,52,,3,,9,,3.9,,,,,,"Yakima Cluster, California Cluster",,Hybrid,,"Hybrid-2 was developed in South Africa in the early 1940’s. Thought to be an open-pollinated seedling of California Cluster, it was discontinued in South Africa in 1964 due to low yields. It is however still produced commercially in Cashmere, India where it shows significantly better yields."
