ID,Name,Purpose,Alpha Acid Low (%),Alpha Acid High (%),Beta Acid Low (%),Beta Acid High (%),Co-Humulone Low (%),Co-Humulone High (%),Country,Storability,Total Oil Composition Low (mL/100g),Total Oil Composition High (mL/100g),Myrcene Oil Low (%),Myrcene Oil High (%),Humulene Oil Low (%),Humulene Oil High (%),Caryophyllene Oil Low (%),Caryophyllene Oil High (%),Farnesene Oil Low (%),Farnesene Oil High (%),Linalool Oil Low (%),Linalool Oil High (%),Polyphenols Oil Low (%),Polyphenols Oil High (%),Substitutes,Style Guide,Also Known As,Characteristics,Description
5c02ffbe-d9e4-46de-b4b5-d2c767663858,Outeniqua,Bittering,12,13.5,4.1,5.1,25,30,South Africa,Retains 60%-70% alpha acid after 6 months storage at 20ºC (68ºF),1.6,1.6,38,43,28,33,9,10,0,1,,,,,Southern Star,Pilsner,,,"Mild, pleasant and slightly spicy, Outeniqua is an excellent, high alpha bittering hop from the land of milk and honey—a moniker of the South African region where it is grown. Primarily used only locally, Outeniqua features a well-balanced oil profile and a strong, punchy, hoppy aroma. Outeniqua is also the mother of high-alpha variety, Southern Star."
7de02ea9-51a9-4766-b419-4f28bce00b56,Pilot,Bittering,8,11.5,3.3,5,28,37,UK,,0.8,1.4,30,40,,,,,1,,,,,,,,,,"Pilot is a high-yielding hedgerow variety, well resistant to wilt, but not to mildew. Bred at Wye College and released in 2001, it’s oil balance makes it distinct from most other English hops. It is said to have excellent, clean and refreshing bittering qualities with spicy aromatics of lemon and marmalade."
c50b5b39-a8db-4dd5-a750-9875c9a34f9e,Lubelska-Pulawy,Aroma,5,7,3,5,23,25,Poland,Retains 55% alpha acid after 6 months storage at 20ºC (68ºF),0.88,,52,,14,,4,6,12,,,,,,"Brewer’s Gold, Nugget, Glacier",,"Lubelski-Pulawy, Polish Lublin",Pleasant European characteristics,"First entering commercial production in 1964, Lubelska-Pulawy is a Polish-grown variety descended from the original Czech hop Lubelska, or Lublin as it is sometimes known. It was grown by the Hop Institute in Pulawy, Poland in an effort to better mold the variety to local conditions and increase alpha potential. It is said to have pleasant European characteristics, unsurprising given its Saaz roots."
766b19ed-ff51-4e2a-8a63-e66c8091c086,Pacifica,Aroma,5,6,6,,25,,New Zealand,Retains 60%-70% alpha acid after 6 months storage at 20ºC (68ºF),1.,,12.5,,50.9,,16.7,,0.2,,,,,,Liberty,Porter,Pacific Hallertau,"Citrusy, spicy, orange and floral aromas","Bred in New Zealand, triploid aroma hop Pacifica, or Pacific Hallertau as it is sometimes known, is the result of open pollination breeding of German hop Hallertauer Mittelfrüher. The hop was released by HortResearch, New Zealand following promising brewing trials in 1994."
76dfd813-bd25-48c3-986e-8843e85527ca,Sun,Bittering,12,16,4.5,7,30,40,US,,,,55,70,10,15,5,10,1,,,,,,"Magnum, Galena, Zeus","Barley Wine, Imperial Stout",,Pronounced herbaceous aroma and flavor,"Currently considered as in-development at the S. S. Steiner Hop Farms in Washington State, Sun has not yet been registered or acquired USDA accession. Not much is known about its lineage yet but it is thought to be derived from Brewer’s Gold and sister to Zeus. It has also been suggested that it possesses characteristic similarities to Galena."
01271628-9b95-4a35-b509-b3751e6ceea9,Zlatan,Aroma,5.2,,4.3,,21,,Czechia,,,,,,,,,,,,,,,,,,,"Mild bitterness, pleasant noble aroma","Released in 1976, Zlatan is native to Czechia and is one of a great many clonal selections of Saaz. Created by the Hop Research Institute in Zatec, it, like many other Saaz clones were selected in an attempt to improve yields while retaining its parent’s signature aroma profile."
ca044be9-4414-425e-9d1c-00ec39084a20,Bramling Cross,"Bittering, Aroma",5,7.8,2.3,3.2,33,35,UK,Retains 60%-70% alpha acid after 6 months storage at 20ºC (68ºF),0.7,1.2,35,40,28,33,14,18,0,1,,,,,"Whitbread Golding, Progress, East Kent Golding","Golden Ale, Strong Ale,Stout, Porter",,"Chrysanthemum, Bitter grapefruit, Caramel, Gooseberry, Vanilla",Bramling Cross is a rather rare breed and is mostly available in the UK. First harvested in 1927 at Wye College its lineage is a cross between Golding and a wild Manitoban (Canadian) hop. It is considered well suited to cask conditioned recipes as well as Christmas and fruit beers.
8a2a7b53-bfc7-427a-9a8c-6cb259a7a123,Neo1,"Bittering, Aroma",7,9,3,3.3,,,US,,,,,,,,,,,,,,,,,,,Significant lemon-citrus character,"Neo1 is another neomexicanus breed, this time with a potent lemon-citrus character. Native to New Mexico, it is a true sun-worshipping hop, with quite lively growth when exposed to maximum sunlight. It is also said that Neo1 is naturally pest resistant due to its abundance of limonene and linalool. Noe1 is a sister to Amallia."
0b4d6f10-b9f2-46f9-a260-65fed60c2bec,Amethyst,Aroma,2,6,7,8,20,28,Czech Republic,,0.4,,42,,19,,6,,,,,,,,,"Pale Ale, Lager",,"Notably earthy, citrusy and spicy","Amethyst is an aroma hop from the Czech Republic and is a derivative of Saaz. It features a notably low alpha acid percentage and notes of earthy, citrus and spice. Amethyst’s aroma profile is suited well to full-bodied lagers and pale ales."
0037328f-c332-43b7-b5bd-cfcf6dcb8dfb,Aquila,Aroma,6.7,8.9,4.1,4.9,46,,US,Retains 40% alpha acid after 6 months storage at 20ºC (68ºF),1.45,,62,,2,,5,,2.2,,,,,,"Cluster, Galena",Belgian Farmhouse Ale,,,"Aquila was developed in the U.S. and was established in three-acre commercial trials throughout the Northwest in 1988. It was officially released in 1994 but due to its overly high cohumulone content, its use was been considered limited and it is no longer available commercially. North American brewing giant Anheuser Busch lost interest in the variety in 1996, ultimately spelling a death knell for Aquila’s commercial record."
6d0c3d33-6d26-4a2a-a4ad-bf56dca2567e,Liberty,Aroma,3,6,3.5,,24,28,US,Retains 35%-55% alpha acid after 6 months storage at 20ºC (68ºF),1.3,,46,,31,,9,12,1,,,,,,"Hallertau, Mount Hood, Tradition","Bock, Lager, Pale Ale",,Noble hop characteristics,"Born in 1983, Liberty is half-sister to Crystal, Ultra and Mt. Hood. It originates from Hallertau Mittelfrüher and a disease resistant German aroma male. Liberty’s yield is low but it still enjoys popularity, especially in the US. It is a genetically sterile variety and not suitable for breeding."
cf70b570-78db-4b6c-9bfe-e175cf49ebe2,Petham Golding,Aroma,6.9,,2,,28,,UK,Retains 57% alpha acid after 6 months storage at 20ºC (68ºF),1.15,,57,,16,,9,,,,,,,,,,,,"Hailing from Wye College in England, Petham Golding was one of the prevailing hop varieties grown in East Kent in the late 1800’s. Descended from Canterbury Whitebine, much like other Golding varieties, the variety isn’t around much anymore due to its lackluster yield, poor storage stability and susceptibility to Hop Mosaic virus. In addition, it has an unusual upward-facing sidearm configuration that tends to break easily at the branching point. Little can be found about its flavor and aroma profile but the variety is parent to popular US varietal, Chinook. Naturally one would assume these two varieties are likely to share some characteristics as a result."
ef87c027-d5c4-450f-8ea9-0e04629dc7a6,Serebrianka,Aroma,3,4,3,,23,,Russia,Retains 53% alpha acid after 6 months storage at 20ºC (68ºF),0.4,,30,,27,,8,,12,,,,,,,,"Silver Hop, Silver","Continental aroma and taste with hints of black tea, herbs and tobacco","Serebrianka, or Silver as it is sometimes called, is a Russian aroma hop and parent to Cascade. Its commercial viability was tested for a staggering 20 years in the US before it was discarded in 1991 for a number of faults, most notably, its incredibly low yield. It is however still sometimes available for home brewing use."
61a6b626-604c-4b82-8c4c-dcb33e0aea62,Tolhurst,Aroma,2.2,,2.9,,31,,UK,Retains 49% alpha acid after 6 months storage at 20ºC (68ºF),0.65,,42.5,,19.4,,7.7,,8.3,,,,,,,,,Subdued but pleasant continental-style aroma,"Tolhurst hops were cultivated in the 1880’s by James Tolhurst in Horsmonden, England and are thought to have originated from an old land race. They feature a pleasant, but subdued continental-style aroma and are no longer grown commercially due to their low yield and dreadful storage stability."
48c27d14-dce4-4948-b04d-5fdc9162f9ca,Millennium,Bittering,14.5,16.5,4.3,5.3,28,32,,Retains 76% alpha acid after 6 months storage at 20ºC (68ºF),1.8,2.2,30,40,23,27,9,12,1,,,,,,"Columbus, Nugget, Summit™, CTZ","Stout, Ale, American Ale",,"Strawberry, Elderflower, Chocolate, Toffee, Pear","Millennium was, unsurprisingly, released in the year 2000. Emanating from the John I. Haas Breeding Program, Millennium hops are directly descended from Nugget and are considered similar in many ways to Columbus. They were born largely out of a desire for greater disease resistance and storage stability. They work well as a bittering agent in American-style ales, Stouts and are considered mild in character with an ability to impart herbaceous notes and elements of resin."
acafc1c8-988e-45c0-b8e1-6415d5d8676d,Super Pride,Bittering,13.5,15,6.4,6.9,26.8,28,Australia,,2.1,2.6,19,34,1,2,5,8,0,1,0.3,0.6 ,,,Pride of Ringwood,"Imperial Pale Ale, Lager",,"Spicy, Chocolate, Curry, Gingerbread, Marjoram","Super Pride is the offspring of Pride of Ringwood and a descendant of Yeoman. First bred at the Rostrevor Breeding Garden in Victoria in 1987 by Hop Products Australia, it was released in 1995 and since 2002 has become a mainstay bittering variety used in commercial beer production in Australia."
d8dbb337-1c9a-4907-8faf-008d0da83b1c,Precoce de Bourgogne,Aroma,3.4,,3.1,,23,,France,Retains 61% alpha acid after 6 months storage at 20ºC (68ºF),0.34,,45,,20,,5.9,,10.6,,,,,,,,"Precoce de Burgnogne, Precoce d’Bourgogne",,"French in origin, Precoce de Burgnogne is likely a clone but it is unknown exactly from which variety. Established in 1977, translated its name means “Early Burgundy” and it is very closely related to the Tardif de Bourgogne and Elsaesser varietals. While it is listed as an aroma hop, little tasting information exists on Precoce de Bourgogne. It was at one time grown commercially in small quantities in its native Alsace but it is not clear if this is still the case."
e0f0dff2-eaac-449d-b02f-d0df9236ce92,Styrian Golding,Aroma,2.8,6,2,3,25,30,Austria and Slovenia,Retains 65%-80% alpha acid after 6 months storage at 20ºC (68ºF),0.5,,27,33,34,38,9,11,2,5,,,,,"Fuggle, Willamette, Bobek","Extra Special Bitter, Ale, Lager, Belgian Ale","Styrian, Savinja Golding, Savinjski Golding, Styrian Savinjski Golding, Yugoslavia Golding",Resinous and earthy with hints of white pepper,"Styrian Golding or Savinjski Golding as it is commonly known, goes by a multitude of sometimes confusing aliases. Confusing still is the fact it actually doesn’t come from a Golding at all, but is rather the result of the clonal selection of Fuggle and as such exhibits many Fuggle-like characteristics."
2e2538a4-9ed7-4c05-8c0f-27066608aebd,Summer,Aroma,5.6,6.4,4.8,6.1,20,25,Australia,,1.4,2.,29,38,28,50,8,11,1,,0.3,0.5 ,,,Saaz,"Ale, Wheat, Belgian Ale, American Ale, India Pale Pale",Australian Summer,"Vegetable, Fennel, Tarragon, Aniseed, Melissa","It’s not difficult to see how the Australian hops variety, Summer, got its name after experiencing its sublime and delicate notes of apricot and melon. Others have even noted elements of grass, peach, passionfruit and citrus."
a161ae69-a926-40de-b763-4a983b0e0c5f,Tettnanger A,Aroma,4.4,,5,,23,,Germany,Retains 60% alpha acid after 6 months storage at 20ºC (68ºF),0.85,,47.2,,16.6,,5.1,,13.6,,,,,,"Tettnanger, Saaz, Hallertau","Lager, Pilsner",,Pleasant continental-style aroma,"Tettnanger A was created in the 1970’s at the University of Hohenheim in Germany via clonal selection from the original Tettnanger hop. Sibling to Tettnanger B, Tettnanger A was originally thought to contain higher alpha percentages though testing in the US has brought this into question. It is said to have a pleasant, continental-style aroma and like it’s parent, is thought to be a descendant of Czech variety, Saaz."
4925f296-c623-4142-be4b-3598e7d4bcc2,Zythos®,"Bittering, Aroma",10,12.5,4.7,6.2,28,31,US,Retains 70% alpha acid after 6 months storage at 20ºC (68ºF),0.7,1.2,,,,,,,,,,,,,"Simcoe®, Amarillo®",American Ale,,"Notes of tangerine, grapefruit, pine and pineapple","Created by Hopunion LLC, Zythos® is a proprietary hop blend created specifically with IPA’s in mind. It features notes and aromas of tangerine, grapefruit, pine and even pineapple. Its high alpha acid content means it can be useful for bittering but is largely intended to shine as an aroma hop."
7921880d-e416-47e8-acf1-66289dcefd05,California Cluster,Bittering,5.5,8.5,4.5,5.5,36,42,US,,,,,,,,,,,,,,,,"Eroica, Galena","American Barley Wine, Porter, English Pale Ale, Amber Ale, Honey Ale, Cream Ale",,Generic hop bitterness and flavor,"Generally considered to be indistinguishable from other Cluster varieties, California Cluster is a true dual use hop. Used prolifically by US brewers in the early-to-mid 1900’s, Clusters were widely available and cheap – providing a generic but pleasant bitterness and flavor."
6423b289-fb1b-443c-b2a6-2e1d0852ad23,Coigneau,,,,,,,,Belgium,,,,,,,,,,,,,,,,,"Lambic, Pilsner","Cagneau, Cagnau, Carnau",,"Originating from the 18th century, Belgian Coigneau hops have largely disappeared. Light on bitterness, Coigneau hops were often employed in Lambic beers and to a lesser extend, Pilsners."
18601818-aaa4-4d9a-8bf3-a2d07c36e00e,Perle,"Bittering, Aroma",8,9,2.5,4.5 ,28,,Germany,Retains 70% alpha acid after 6 months storage at 20ºC (68ºF),0.6,1.2,20,,29,,10.2,,0.2,,0.2,0.6 ,3,5 ,"Perle (US), Northern Brewer (GR)","Hefeweizen, Belgian Strong Ale, Lager, Pilsner, Kölsch",,"Leek, Celeriac, Chilli, Marjoram",The original Perle was created in Germany sometime during the 1960’s or early-mid 1970’s from Northern Brewer and a German male. It was released to the public in 1978.
53834d62-d1db-468c-af29-69b6e7f1243c,Wakatu,"Bittering, Aroma",6.5,8.5,8.5,,28,30,New Zealand,,1.,,36,,17,,8,,6.7,,,,,,,"Lager, Pale Ale, Belgian Ale","Hallertau Aroma, New Zealand Wakatu, Hal Aroma","Floral, lime aromas","Wakatu, or Hallertau Aroma as it is sometimes know, is a New Zealand triploid hop with a lot going for it. 2/3 Hallertauer Mittelfrüher and 1/3 New Zealand male, it was released in 1988 from the New Zealand Institute for Plant and Food Research’s hop breeding program."
9dc40a05-f79f-4a5f-b225-7648f20e36f4,Backa,Aroma,3.1,6.9,4,7.4,25,,Serbia,Retains 67% alpha acid after 6 months storage at 20ºC (68ºF),0.6,,,,,,,,,,,,,,,"Lager, Pilsner",,,"Dating back to 1956, Backa is an old, rare variety of aroma hop with an unknown land race pedigree. It has the potential for high yield in its native Backa region of Serbia (formerly Yugoslavia) but doesn’t seem to do all that well elsewhere. It’s highly aromatic and is said to have similar qualities to many European “Noble Hops”. The USDA lists two strains of Backa (56002) and (21080), but there seems to be some disagreement as to whether or not they are identical."
658562ef-a24b-4b7d-b938-1dd8adfa7b40,Olympic,"Bittering, Aroma",10.6,13.8,3.8,6.1,31,,US,Retains 60% alpha acid after 6 months storage at 20ºC (68ºF),0.86,2.55,40.8,,12.2,,12,,0.9,,,,,,"Galena, Nugget, Chinook","American Lager, American Ale, Pale Ale",,Notes of spice and citrus,"Olympic has a complex lineage. Though its predominantly genetically derived from Brewer’s Gold (3/4), it also owes its existence to Fuggle, East Kent Golding, a so-called “Bavarian” seedling and a fifth, unknown variety. As a result, Olympic is a spicy and citrus laden hop. It’s grown primarily in Washington State and was released in the mid 1980s. It enjoyed solid growth upon its release reaching around one percent of total US hops production in 1986. However by 1997 this figure had halved."
2141698b-a8d5-41fe-ab0c-5f16bb0bc41d,Bate’s Brewer,,,,,,,,UK,,,,,,,,,,,,,,,,,,,,"Bate’s Brewer is a very old hop variety that is no longer grown. Used to breed Whitbread Golding, it — much like it’s progeny — is not considered to be a true Golding variety. It was used extensively by Wye College in the early 1900’s to breed new varieties."
e69be968-56b5-4338-90cb-22d54e637fba,Dana,"Bittering, Aroma",11,16,4,6,28,31,Slovenia,,2.4,3.9,50,59,15,21.6,5.7,7.6,6.9,8.7,,,,,,India Pale Ale,"Styrian Dana, Ekstra Styrian Dana, Extra Styrian Dana",Subtle floral and citrus flavors,"Dana, or Extra Styrian Dana as it is often known, is a Slovenian hop bred from Hallertau Magnum and a wild Slovenian male. A product of the Institute of Hop Research in Zalec, Solvenia, it is said to feature quality and harmonious bittering properties alongside a slightly floral and citrus flavor profile."
378a931e-c26d-4b5c-942a-cd752090edc7,Density,Aroma,4.4,6.6,3.3,,36,,UK,Retains 72% alpha acid after 6 months storage at 20ºC (68ºF),0.44,,57,,17,,7,,0.3,,,,,,Defender,,,,"Density shares the same interesting heritage as its sibling, Defender. Selected by Dr R. A. Neve at Wye College in England, Density was born as a cross from a New Mexico Wild American female hop, Eastwell Golding and other English hops. However, its very low alpha content and low yield potential has caused it to be discontinued from commercial production in England. Like it’s sibling, it is said to also feature a pleasant, European-style aroma."
38a0bc71-2610-4c7a-a75f-852785d60773,Santiam,Aroma,5,8,5.3,8.5,18,24,US,Retains 40%-50% alpha acid after 6 months storage at 20ºC (68ºF),1.3,1.7,25,36,23,26,4.8,8.8,13,16,,,,,"Tettnanger, Spalt, Spalter Select, Hallertau, Liberty","American Blonde Ale, American Lager, India Pale Ale, American Pale Ale, Wheat, Bock",,"Soft, herbal, floral, fruity aromas with hints of pepper and spice","Developed at the Agriculture Research Service in Corvallis, Oregon, Santiam hails from parent varietals Swiss Tettnanger, German Hallertauer Mittelfrüher and a slightly more distant Cascade (US)-derived cultivar. It was released to the brewing public in 1997 and features a well-balanced oil profile."
f54806de-cdd9-4aec-878e-f5cbfdf86710,Tahoma,Aroma,7.2,8.2,8.5,9.5,15,17,US,Retains 75% alpha acid after 6 months storage at 20ºC (68ºF),1.0,2.,67,72,9,11,2.9,3.5,1,,,,,,,"Blonde Ale, Wheat, Lager",,,"Released in 2013 by the USDA and Washington State University, Tahoma is the daughter of Glacier. With alpha content higher than its parent, Tahoma features very low cohumulone giving it a subtle, yet lovely lemon citrus aroma and flavor with undertones of orange, woodiness and spice."
548d9a72-195d-4c8b-8421-62312c2672fd,Vanguard,Aroma,4.40,6,6,7,14,16,US,Retains 75%-80% alpha acid after 6 months storage at 20ºC (68ºF),0.9,1.2,20,25,45,50,12,14,0,1,,,,,"Liberty, Mount Hood, Hallertauer Mittelfrüh, Saaz","Porter, Cream Ale, Lager, Rye Ale, Amber Ale, Belgian Ale, French Ale",,,Vanguard hops possess a unique acid profile. They feature a somewhat rare balance of low alpha acid and high beta acid and an oil profile dominated by high levels of humulene and yet very low levels of cohumulone.
e87fc042-bd74-4be1-9246-11ca5eec10d6,Vojvodina,"Bittering, Aroma",6.1,10.5,2.3,4.7,30,,Former Yugoslavia,Retains 76% alpha acid after 6 months storage at 20ºC (68ºF),0.6,1.4,67,,13,,5,,0.6,,,,,,"Northern Brewer, Goldings",,,Noble aroma characteristics,"The result of a cross between Northern Brewer and a Golding-derived male variety, Vojvodina is a hop with mild bittering properties, a woody aroma and notes of cedar and tobacco. It has some of the noble aroma characteristics of Northern Brewer, but is more intense and perhaps a little more rounded."
bf0c4695-9060-4f55-abba-623c5c76f436,Melba,"Bittering, Aroma",7,10,2.5,5,25,35,Australia,,2.0,4.,,,,,,,,,,,,,Galaxy,,,"Clean spicy bitterness, aromas of passionfruit, grapefruit and citrus.","Bred by Ellerslie Hop Estate, Melba or “The Dame of Hops” as it is affectionately known, is a dual-use variety with high oil content and similarities to Galaxy. When used as an early addition, it is said to impart a clean and somewhat spicy bitterness. When used as an flavor or aroma addition though, properties of passionfruit, grapefruit and citrus come to the fore."
11a0c1b7-b464-4a96-a30f-28e5159ee3f6,Northdown,"Bittering, Aroma",7,10,4,5.5,24,32,UK,Retains 60%-70% alpha acid after 6 months storage at 20ºC (68ºF),1.2,2.5,23,29,37,45,13,17,0,1,,,,,"Challenger, Admiral",Blonde Ale,,"Fresh, flowery, piney, berry and spice",Northdown was developed at Wye College in England in the early 1970’s and was initially bred primarily for its resistance to downy mildew. It is the offspring of Northern Brewer and Challenger and an aunt to Target.
8b23e799-cae9-4f31-ac81-a7377577ccfe,Ahil,Aroma,10,12,4,5,25,,Slovenia,Retains 46% alpha acid after 6 months storage at 20ºC (68ºF),1.8,2.2,61.1,,7.6,,4.3,,10.4,,,,,,,Belgian Ale,,,"Ahil hops are somewhat hard to come by with its cultivation in Slovenia having been severely reduced. There has also been some confusion over its true classification. It was introduced as a Superstyrian hop in 1972 care of hop breeder, Dr Tone Wagner at the Hop Research Institute in Zalec. In actuality though, it is not a Superstyrian, it’s a hybrid, a cross between Brewer’s Gold and a wild male and was only intended to be Superstyrian-like in style."
168dfcf0-7044-44c0-b15f-d20c62dcc819,Fuggle H,Aroma,4.1,7.7,2.1,3.9,26,,,Retains 73% alpha acid after 6 months storage at 20ºC (68ºF),0.41,1.89,47,,24,,8.1,,4.1,,,,,,,"Stout, English Pale Ale, Belgian India Pale Ale, Extra Special Bitter, Brown Ale, Red Ale",,Robust woody and fruity aroma,"Fuggle H is one of several Fuggle hybrids. Selected in 1961 at Corvallis, Oregon, from the original Fuggle, it carries the same alpha acids content as Fuggle (US) and is known to bear a robust woody and fruity aroma. With the announcement in 1997 that Anheiser Beusch was phasing out Fuggle, production in the US has declined."
0bca85f6-4d23-47a1-9d40-f78331a35b9b,Phoenix,"Bittering, Aroma",8.5,13.5,3.3,5.5,24,33,UK,Retains 80%-85% alpha acid after 6 months storage at 20ºC (68ºF),1.2,3,24,32,25,32,8,11,1,1.4,,,,,"Northdown, Challenger, East Kent Golding","India Pale Ale, Bitter, Golden Ale, Triple India Pale Ale, English Ale, Extra Special Bitter, Stout, Brown Ale",,"Aromas of spice, pine, chocolate and molasses","Despite its low yield, Phoenix has a lovely aroma and flavor and seems destined to become a favorite among craft brewers. It was first grown at Wye College in England in an effort to find a more disease resistant replacement for Challenger hops. Phoenix was selected as a seedling of Yeoman."
3e4ac046-118c-4d29-b791-9520027dbcb9,Cluster (AUS),"Bittering, Aroma",5.5,8.5,4.5,5.5,36,42,Australia,Retains 80-85% alpha acid after 6 months storage at 20ºC (68ºF),0.4,,45,55,15,18,6,7,1,,,,,,"Northern Brewer, Galena","Lager, Stout, Ale",Australian Cluster,"Strongly resinous, herbal character","Though its official lineage is vague, Australian Cluster is a dual-use hop thought to be of Dutch, English and/or American ancestry. Australian Cluster, grown by HPA is strongly resinous but yields a balanced bitterness with a notable herbal character. Australian’s, particularly those in Queensland, might recognize Australian-grown Cluster as the aroma variety in XXXX Bitter."
81e29268-8dcd-4f7c-a233-f89b70f6b6e6,Palisade®,Aroma,5.5,9.5,6,8,24,29,US,Retains 60%-70% alpha acid after 6 months storage at 20ºC (68ºF),1.4,1.6,9,10,19,22,16,18,0,1,,,,,"Styrian Golding, Willamette, Glacier, Chinook","Golden Ale, Pale Ale, English Ales, American Pale Ale",,"Flavors of nectar fruits and citrus, aromas that are floral, herbaceous and grassy","For brewers, Palisade® hops, bred by Yakima Chief Ranch feature complex floral, herbal and grassy aromas in addition to flavors of nectar fruits and citrus. For growers, it exhibits nothing short of incredible yield potential – at least in its native Yakima Valley, Washington environment. Palisade is an open pollination cross from Swiss Tettnanger."
9c3a34d7-9b42-457d-b397-356fed777b18,Kitamidori,Bittering,9,12,5,6,22,,Japan,Retains 75% alpha acid after 6 months storage at 20ºC (68ºF),1.35,,34,,31,,8,10,6,7,,,,,"Kirin II, Saaz, Toyomidori, Eastern Gold",,,,"Developed by the Kirin Brewery Company in Tokyo, Japan, Kitamidori is no longer grown commercially there or anywhere else. It was bred alongside Toyomidori and Eastern Gold as a potential super alpha replacement for Kirin II, which was itself a replacement for Shinshuwase hops. It sports an oil composition with remarkable similarities to Saaz."
68cd9b67-c474-40a5-ae8a-d24e25640a68,Sovereign,Bittering,4.5,6.5,2.1,3.1,26,30,UK,,30 ,1,25,30,21,26,7.9,8.1,3.5,3.7,,,,,,"American Lager, American Pale Ale",,"Quince, Gingerbread, Green pepper, Cherry","The granddaughter of Pioneer, Sovereign is an English variety bred at Wye College in the mid-1990s. Released in 2006, Sovereign is gaining respect for its complex and delicate aroma profile."
8139baf7-cbb6-4a08-81a0-3253c7512dc9,Elsaesser,Aroma,4.65,,5.78,,20,30,France,Retains 63% alpha acid after 6 months storage at 20ºC (68ºF),0.28,1.13,38,,32,,11.6,11.7,1.7,,,,,,,,Elsasser,European noble aroma,"The Elsaesser’s commercial production is confined to very limited acreage in the Alsace region of France. It most likely originated from an old land race in the same area. Elsaesser has an aroma akin to that of noble European varieties. Charlemagne’s father, Peppin the Younger, was said to have had a hops garden in the 7th century. Even though the use of hops in beer isn’t recorded until the 9th century, perhaps todays Elsaesser hops are a descendant of the same variety that graced that very garden."
