5a33ca16-b3cb-4156-8a09-8512b5c99012,Golding (BC),,,,,,,,,,,,,,,,,,,,,,,,,,,"British Columbia Golding is produced, as one might expect, in Canada. Before the hops industry was fully established in the Pacific Northwest, BC Golding was the only North American-grown Golding. Its alphas are low so it’s bittering capacity is mild at best while it puts forward an earthy aroma profile and flavors of smooth, rounded spice. BC Golding makes a good, British-style pale and has also been noted for it’s successful use in Stouts and Porters.",
65cd2a6b-c764-4f3d-b152-6e34753bcec6,Golding (US),Aroma,6,,2,3,20,20,US,Retains 66% alpha acid after 6 months storage at 20ºC (68ºF),Moderate to difficult,0.4,1,25,35,35,45,13,16,,,,,1%,"East Kent Golding, Fuggle, Willamette, Progress, Whitbread Golding","US Golding, US Goldings, Northwest Goldings","Delicate English-style aromas, fruit, herbs","Golding (US) hops are descended from the original East Kent Golding. In North America, they were first grown in British Columbia, and then appeared in the state of Washington in 1993 and Oregon after that. They are no longer grown commercially in Canada. They feature a subtle bitterness when used as a early addition but are predominantly used for their quintessentially ‘English’ flavor and aroma.",
b996f469-78bc-499b-91f2-02292e73d567,Goldings (NZ),,,,,,,,,,,,,,,,,,,,,,,,,,,"New Zealand Goldings are said to have a subtle flavor and an enjoyable perfume with a nicely rounded bittering. It differs from the English Kent Golding in its delicate touch. In fresh beers, its flavor will only hold for about a month. Good traditional aroma hop used late in the boil or for dry hopping.",
44b51449-8da8-4126-b796-de94af1df061,Green Bullet,"Bittering, Aroma",15,,2.9,7,38,43,New Zealand,Retains 60%-70% alpha acid after 6 months storage at 20ºC (68ºF),Easy,0.46,1.13,38.3,53,19,28.2,19,20,,,,,9.2%-20%,"Liberty, Hallertau, Crystal, Mount Hood, Ultra",,Aromas of raisin and fruit,"Green Bullet is a New Zealand hops variety, one of the first generation of new crosses attempted when Black Root Rot descended on New Zealand hops in 1949.",
81f43bd0-b6ab-407f-984e-ae81a58d3dfc,Greensburg,,,,,,,,,,,,,,,,,,,,,,,,,,,Greensburg is an American aroma hop grown mainly in southern Idaho and is used primarily by microbreweries. It has both fruity and woody notes. Its beta acids actually supersede its alpha acid content. Best when added to the end of a boil for aroma.,
aebbede9-5cca-4406-9704-a31da5cc0537,Groene Bel,,,,,,,,,,,,,,,,,,,,,,,,,,,"Groene Bel or Green Belle as it is otherwise known, is a long-lost Belgian hop that likely came about via clonal selection from native Aalst hops in the late 19th century or early 20th century. After World War II, Groene Bel all but vanished from hop production in Belgium after it was replaced by Czech and German favorites, Saaz and Hallertau. Although Groene Bel is no longer commercially produced, it has been used for breeding aroma hops in Zalec, Slovenia during the 1970’s. Its high humulene content is said to result in a pleasing, continental aroma.",
21bb2dfa-e149-4a42-82d7-6cd309399778,Hallertau,Aroma,3.5,,3.5,4.5,20,26,Germany,Retains 52%-58% alpha acid after 6 months storage at 20ºC (68ºF),Easy,0.6,1.2,35,44,30,55,10,15,,,,,0%-1%,"Liberty, Hallertau (US), Hallertauer Tradition","Hallertauer, Mittelfrüh, Mittelfrüher, Hallertauer Mittelfrüher, Hallertau Mittelfruh",Lightly flowery and spicy aroma,"Hallertau, Hallertauer and Hallertauer Mittelfrüher are all names for the original German Hallertau variety. Dating back more than 100 years, it stems from an old German landrace and is one of the original four “noble” hops. It features a lightly flowery and spicy aroma.",
71b94bf9-7975-498a-aa3e-3d9a89cf124e,Hallertau (NZ),Aroma,9,,5.8,8.5,28,35,New Zealand,Retains 80%-85% alpha acid after 6 months storage at 20ºC (68ºF),Moderate,0.9,1.1,35,48,10,16.8,6,8.2,,,,,5%-6.7%,"Hallertau, Perle",NZ Hallertau,"Distinct lime ‘zing’, delicately floral, clean tasting","New Zealand Hallertau is a triploid hop bred from Hallertau Mittelfrüher and a New Zealand male cultivar. First introduced in 1988 by HortResearch (now the New Zealand Institute for Plant and Food Research), it is purported to impart a distinct lime ‘zing’ beneath a delicately floral top.",
d0bfce18-fcee-4ef5-bf9e-6ac96a958485,Hallertau (US),,,,,,,,,,,,,,,,,,,,,,,,,,,"Hallertau (US) is definitely a tenacious, Bavarian-style hop. It long dominated its heritage region and is still in demand by craft brewers for Bavarian-style ales. As an American hop, it is outperformed by Mt. Hood and Liberty but is still holding its own. Its low alpha acids and high humulene contribute to a mild, flowery and delicately spicy aroma and flavor profile. The original German-grown Hallertau has long been the staple of German and European lagers.",
2f27532a-1a9b-4a2a-bd29-79fecb3cdb32,Hallertau Blanc,,9,11,4,7,,,,,1.5 - 1.8,,,,,,,,,,,3,5.9,,,,,"Hallertau Blanc, daughter of Cascade, was released to the world in 2012. Established on the Hüll farm in the German Hallertau region, it was grown primarily for use in American-style Ales. Hallertau Blanc’s flavor profile is said to be fruity, with wine-like qualities of gooseberry and grass, similar to that of Sauvignon Blanc. It also features a complex aroma profile with notes of cassis and elderflower in addition to grapes, grapefruit and lemongrass. Other notes detected in trials have been passionfruit, pineapple and gooseberry.","Lemon grass, Cassis, Elderflower, Grapefruit, Grapes"
40b50ade-2c28-45cc-83bb-3e5efba3abd8,Hallertauer Magnum,,11,16,5,7,,,,,1.6 - 2.6,30,45,,,,,,,0.2,0.7,2,3,,,,,,"Apple, Lemon, Mint, Chocolate, Green peppers"
89326ae2-c5d0-4577-ad9c-2849be0e88fa,Hallertauer Mittelfrüher,,3,5.5,3,5,,,,,0.7 - 1.3,20,28,,,,,,,0.7,1.1,4,5,,,,,,"Aniseed, Blackberry, Liquorice, Citrus fruits, Bergamot"
82d24241-c400-4a8b-b417-2d6c0d8d5309,Hallertauer Gold,,,,,,,,,,,,,,,,,,,,,,,,,,,"A varietal of the German Institute for Hop Research in Huell, Germany, Hallertauer Gold is a descendant of Hallertau Mittelfrüher and is often marketed under various, similar names. Developed in the mid-1970s, it was released to the public in the late 1980s. A lot of commercially sold Hallertau is usually Hallertauer Gold or Hallertauer Gold combined with Hallertau Mittelfrüher. Its aroma is continental but with higher alpha acids and low cohumulone. This hop was bred to be more wilt resistant than its parent after persistent wilt became an issue in Germany.",
87f0ca30-e58c-476b-b702-ac3d29bd2d08,Hallertauer Taurus,"Bittering, Aroma",12,17,4,6,23,25,Germany,Retains 60%-70% alpha acid after 6 months storage at 20ºC (68ºF),Difficult,0.9,1.5,30,,30,31,8,,1,1.5,3,4,0%-1%,"Magnum, Merkur, Herkules","German Taurus, Taurus","Chocolate, banana, spice, pepper, curry","German born Hallertau Taurus features an earthy, strong aroma with hints of chocolate and banana, spice and pepper and finishes with a zesty curry undertone. It was released in 1995.","Chocolate, Pepper, Ripe banana"
93cd8374-7c6f-4124-b32e-d498b378491c,Hallertauer Tradition,Aroma,4,7,4,5,23,29,Germany,Retains 65%-70% alpha acid after 6 months storage at 20ºC (68ºF),Difficult,0.9,1.9,20,25,40,55,10,15,0.7,1.2,4,5,0%-1%,Retains 65%-70% alpha acid after 6 months storage at 20ºC (68ºF),"Tradition, German Tradition, H Tradition","Earthy, grassy, aromas of nectar fruits","Hallertau Tradition is a Hüll-bred fine aroma hop originating from Hallertau Mittelfrüher, Hallertauer Gold and Saaz. Bred specifically for fungus and disease resistance, it succeeded in that effort and also features higher alpha acids than its parent varieties, low cohumulone and higher myrcene. It was released for commercial production in 1989.","Apricot, Peach, Cassis, Citrus, Orange"
f8ba2192-d415-4eb9-b586-3bb49da1faf6,Harmonie,,5,8,5,8,,,,,0.9 - 1.4,30,40,,,,,,,0.9,1.4,2.7,3.5,,,,,,"Banana, Creamy, Green tea, Apricot, Caramel"
8ec3b4af-613b-45ca-accc-7150d686daa8,Helga,,,,,,,,,,,,,,,,,,,,,,,,,,,"Helga is an Australian cultivar, formerly known as Southern Hallertau. Helga was bred by Hop Products Australia from Hallertau Mittelfrüher in an effort to dissect and retain its Hallertau’s characteristic noble aroma. Helga is easy to work with—no matter at what point she is added into the brew, even when dry hopping, the results are said to be ever pleasant. It is mildly floral and spicy. Helga made a quiet debut, established in 1996 it took nearly 10 years to catch on commercially. Currently, production is being increased as craft brewers take interest.",
3be64a95-66d0-4722-9cb4-a64bb23c6096,Herald,,,,,,,,,,,,,,,,,,,,,,,,,,,"Herald hops were one of a first wave of dwarf hops introduced to the industry. It was released in 1996 alongside sisters Pilgrim and Pioneer. Some brewers were initially reluctant to use Herald despite its clean bitterness and a nice nose of orange and grapefruit. Today Herald is employed by a multitude of craft breweries, particularly in the UK.",
c7f2b6fe-fe47-470e-8aeb-bc9536bf624a,Herkules,,12,17,4,5.5,,,,,1.6 - 2.4,30,50,,,,,,,0.3,0.8,3,4,,,,,"Strong and robust in flavor and aroma, German Herkules lives up to it’s name. The Hüll-bred offspring of Hallertauer Taurus, Herkules is a high alpha acid bittering hop, known to be spicy and floral, tangy and hoppy, with notes of melon, black pepper, with hints of pine. It was released in 2005.","Melissa, Orange, Honeydew Melon, Lemon grass, Peppermint"
76ebf85a-c003-4c73-9f4f-2283027d8eed,Hersbrucker Spät,,1.5,4,2.5,6,,,,,0.5 - 1,15,30,,,,,,,0.5,1,5,6,,,,,German hop Hersbrucker was originally bred with the intention of producing a variety resistant to verticillium wilt that could act as a replacement for Hallertau Mittelfrüh.,"Citrus, Black tea, Melissa, Marjoram"
b053c13f-aa1a-4b4e-9a9a-b806718db560,Hersbrucker E,,,,,,,,,,,,,,,,,,,,,,,,,,,"Hersbrucker E (for England) was planted and grown at Wye College, England in the 1970’s. It is largely identical to the original Hersbrucker variety grown in the Hersbruck Mountains. The storage stability, especially of its soft resins, is low.",
da424221-9148-4f97-a1a2-be4a4982d534,Hersbrucker Pure,,,,,,,,,,,,,,,,,,,,,,,,,,,"The offspring of Hallertauer Mittelfrüh, Saaz and a wild German hop, Hersbrucker Pure was originally tested by brewing giant Anheuser Busch as a replacement for Hersbrucker. After their interest waned in the variety, it failed to catch on as a viable commercial prospect. It has an noble aroma and flavor profile similar to that of its parents.",
ea539755-5b87-4935-9135-5c94fc20504a,Hersbrucker Red-Stem,,,,,,,,,,,,,,,,,,,,,,,,,,,"Hersbrucker Red-Stem is, as I’m sure you guessed, so named due to its red stem. All Hersbruckers have red stems, but in this variety it is even more distinct. It is a clonal offshoot of Hersbrucker, supposedly with a higher alpha acid potential. Hersbrucker clones have declined in production over the years since their introduction in the 1980’s. This is mainly due to the rise of Hallertauer Tradition and Spalter Select, which exhibit much higher alpha percentages.",
a4de659e-416c-499f-9c64-79e7267717a6,Horizon,,,,,,,,,,,,,,,,,,,,,,,,,,,"Horizon is a versatile hop with some star qualities. Created in Oregon in 1970, Horizon is a diploid hop and half-sister to Nugget.",
d9b234aa-d3e7-430a-af76-f2077ceae52f,Hüll Melon,,7,8,6,8,,,,,0.8 - 2.1,26,42,,,,,,,0.2,0.3,3,4.6,,,,,"Relatively new on the market, Hüll Melon made its debut in 2012. A daughter of Cascade (US), it has some interesting flavor characteristics not commonly associated with hops. It is noted to be intensely fruity with flavors and aromas of honeydew melon and strawberry.","Wild strawberry, Geranium, Peach iced tea, Aniseed"
8b8c86d7-48f4-429b-af70-5836b1ed365f,Hüller Bitterer,,,,,,,,,,,,,,,,,,,,,,,,,,,"Developed in the late 1960’s and released in 1978, Hüller Bitterer has the distinction of being the first wilt resistant variety to come from the German Hüll hop breeding program. Descended from Northern Brewer, it is an excellent dual-use hop and is still known for its clean bittering character. In commercial use, it has now largely been replaced with other wilt resistant varieties, specifically Perle.",
21639803-2aa3-4797-9b8b-d9f82c2f8413,Hybrid-2,,,,,,,,,,,,,,,,,,,,,,,,,,,"Hybrid-2 was developed in South Africa in the early 1940’s. Thought to be an open-pollinated seedling of California Cluster, it was discontinued in South Africa in 1964 due to low yields. It is however still produced commercially in Cashmere, India where it shows significantly better yields.",
8fd54dd5-bf45-4a5b-8ad3-d6d703d136d7,Ivanhoe,,,,,,,,,,,,,,,,,,,,,,,,,,,"Ivanhoe is one of the first revivals of California Cluster in more than 50 years. Revived by organic hop farm Hops-Mesiter, LLC near Clearlake, California, it is a European aroma type and has been compared to a more moderate Cascade. It features a lovely, mellow aroma of citrus and pine, but with heady floral and herbal notes.",
5254c99c-fe61-4c3b-9617-38768ef541c0,Janus,,,,,,,,,,,,,,,,,,,,,,,,,,,"Selected at Wye College, England in the 1950’s, Janus was originally praised for its early harvest qualities. Its extremely low yield however led it to being discarded as a commercial prospect in 1992. To date, it has never been used for breeding either. It is a cross between a Eastwell Golding, a New Mexico Wild American hop and other unspecified English hops. Janus exhibits very high myrcene potential and is said to have a pleasant, European aroma.",
0ba4fa9a-7c65-4303-8e19-1eb2e8fca397,Jester®,Aroma,9,,4,6,23,28,UK,,,0.6,1.2,45,50,2,,,,,,,,0.1-0.2%,"Cascade, Challenger",,"Tropical fruit, grapefruit, blackcurrant, hints of lychee","Developed by Charles Faram & Co Ltd in the UK, proprietary hop Jester® brings with it distinct flavors and aroma qualities quite different to that of tradition English hop varieties. These unique characteristics include forward and robust notes of tropical fruits, grapefruit and blackcurrant and even hints of Lychee. It is considered most useful as a mid to late addition but is also fantastic to dry hop with. Though not considered a particularly useful bittering hop, when used in this regard it imparts a mild, herbal resonance.",
a82de641-c4fd-4ee1-881c-574b5e826f80,Keyworth’s Early,Aroma,,,3.3,,33,,UK,Retains 72% alpha acid after 6 months storage at 20ºC (68ºF),,1.39,,45,,22,,7,,,,,,Trace Amounts,Keyworth’s Midseason,OJ47,Lemon and grapefruit notes,"Keyworth’s Early is a venerable old English hop which was, for a while, discontinued from production due to low yield. Raised at Wye College, England in the 1920’s, it was rushed into production on the back of Dr. W. G. Keyworth’s research in the 1940’s after Verticillium wilt became a major problem in parts of Kent. Due to its promising resistance, it gained in popularity for a while but fell out of favor with both brewers and growers.",
54121ff3-cb28-4747-b5b0-58f88512ef4f,Keyworth’s Midseason,,,,,,,,,,,,,,,,,,,,,,,,,,,"Keyworth’s Midseason was produced alongside Keyworth’s Early in the 1940’s for the same desired wilt resistance. A cross between Fuggle and a wild American female, Keyworth’s Midseason proved more popular than Keyworth’s Early and reached a cultivation close to 600 acres in 1954. It is the parent of Density and Defender.",
fabcd6b1-d99e-4f13-b9e8-e05c415bd513,Kazbek,,5,8,4,6,,,,,0.9 - 1.8,40,55,,,,,,,0.3,0.5,3.5,4.5,,,,,,"Raspberry, Peach, Orange, Passion fruit, Chocolate"
b1301796-e759-480b-95d9-5acb7a6712be,Kirin II,,,,,,,,,,,,,,,,,,,,,,,,,,,Kirin II is one of a few Japanese hops to spring up since the Japanese governments decision to reduce the importation of beer hops. The variety is grown domestically and solely under government contract. The variety was developed by Kirin Brewery Co. as a clonal selection from Shinshuwase and as such is directly descended from Saaz and open pollinated White Vine.,
566e3427-2662-4e2f-9ec1-58e545063a7c,Kitamidori,,,,,,,,,,,,,,,,,,,,,,,,,,,"Developed by the Kirin Brewery Company in Tokyo, Japan, Kitamidori is no longer grown commercially there or anywhere else. It was bred alongside Toyomidori and Eastern Gold as a potential super alpha replacement for Kirin II, which was itself a replacement for Shinshuwase hops. It sports an oil composition with remarkable similarities to Saaz.",
f7983d07-5d06-4b29-b65d-6b6d53ea6eab,Kohatu®,,,,,,,,,,,,,,,,,,,,,,,,,,,"Kohatu®, meaning stone or rock in Maori, was released alongside Wai-iti in 2011. It was named after Kohatu, a small town nestled by the Motueka River, south west of Nelson, New Zealand. Kohatu is not as fruity as Wai-iti, but with its intense aroma of tropical fruit and freshly crushed pine needles, it adds a wonderfully fresh character to beer. Even with a low alpha, when used as an early addition it features a pleasant, rounded bitterness.",
f05b73ad-e4c2-44c7-be8b-026be382e792,Landhopfen,,,,,,,,,,,,,,,,,,,,,,,,,,,"A low growth rate and yield in addition to a susceptibility to viruses are all reasons why the old German Landhopfen variety is no longer grown commercially. While it’s exact date of creation remains illusive, it has been documented as a variety as far back as 1851. It is said to have good European aroma characteristics and is thought to be a cultivar of an old German land race created via clonal selection.",
8255613a-a50d-4bbd-b84e-7c3ecca2dd86,Legacy®,"Bittering, Aroma",8.4,,,,,,US,,,,,,,,,,,,,,,,"Cluster, Galena, Northern Brewer",,"Notes of blackberry, black currant, orange and grapefruit. Floral and spicy.","Legacy® has been grown in Washington State for over 50 years. Despite this, Hops Direct, LLC registered the variety in 2013 and named it Legacy.",
c057778b-b445-40e5-99c9-f67722e10e8a,Liberty,Aroma,6,,3.5,,24,28,US,Retains 35%-55% alpha acid after 6 months storage at 20ºC (68ºF),Moderate to easy,1.3,,46,,31,,9,12,,,,,1%,"Hallertau, Mount Hood, Tradition",,Noble hop characteristics,"Born in 1983, Liberty is half-sister to Crystal, Ultra and Mt. Hood. It originates from Hallertau Mittelfrüher and a disease resistant German aroma male. Liberty’s yield is low but it still enjoys popularity, especially in the US. It is a genetically sterile variety and not suitable for breeding.",
67799942-2751-4773-8d5c-f3aeb741cea0,Lubelska,,,,,,,,,,,,,,,,,,,,,,,,,,,"Often thought to be a Polish hop, Lubelska actually originates in Zatec, Czechia. Sometimes marketed as Lublin or Lubelski, Lubelska’s high humulene content is trumped only by its rare, high levels of farnesene. This oil profile results in interesting aromas of magnolia and lavender. It is considered to very noble-like in character. Thought to be a landrace cultivar of Saaz, it is now a mainstay of Polish breweries.",
f16a4f95-9ac7-4e70-8adb-abc899eea088,Lubelska-Pulawy,,,,,,,,,,,,,,,,,,,,,,,,,,,"First entering commercial production in 1964, Lubelska-Pulawy is a Polish-grown variety descended from the original Czech hop Lubelska, or Lublin as it is sometimes known. It was grown by the Hop Institute in Pulawy, Poland in an effort to better mold the variety to local conditions and increase alpha potential. It is said to have pleasant European characteristics, unsurprising given its Saaz roots.",
dabbfecf-9fe0-455c-9240-03811d8d30b5,Lublin,,3,4.5,3,4,,,,,0.5 - 1.1,22,29,,,,,,,,,3.7,5.9,,,,,,"Lemon tea, Curry, Dill, Juniper, Floral"
06604820-88e2-4f61-bae7-1b71441b9730,Lucan,,,,,,,,,,,,,,,,,,,,,,,,,,,"Developed at the Hop Research Institute in Zatec, Czechia, and officially registered in 1941, Lucan was created via clonal selection of the Czech Zatecky Krajovy variety. Known as being one of the Czech Rebublic’s oldest varieties, it is also thought likely to be a close relative of Saaz. Noted for its commercially desirable noble aroma qualities and mild bitterness, its yield is marginal in the US, but decent in its native Czechia.",
f74fac00-2cb1-41ae-a428-96f3cdec1b9f,Loral®,,10,12,4.5,5.5,,,,,1.5 - 2.5,37,39,,,,,,,1,1.4,,,,,,,,
481e8a67-8087-4f0f-bd14-aa5033be642e,Marco Polo,,12,13,4.5,5.5,,,,," - ",40,50,,,,,,,,,,,,,,,,"Lemon, Lemon blam, Gooseberry, Oregano, Elderflower"
9c5434e9-e20c-4421-996f-ec2c27f3c29c,Magnat,,11,16,3,7,,,,,1 - 2,30,59,,,,,,,,,,,,,,,,"Citrus, Woody, Camomile blossom, Kitchenherbs, Lemon cake"
1244da2c-a12b-4125-8c8e-1fe7d9971370,Magnum,Bittering,14,,4.5,5.5,24,25,Germany,Retains 80%-85% alpha acid after 6 months storage at 20ºC (68ºF),Difficult,1.9,2.3,30,35,34,40,8,12,,,,,0%-1%,"Hallertauer Taurus, Columbus, Nugget",Hallertau Magnum,"Clean bitterness, subtle citrus flavors","Magnum is fast becoming a brewing favorite in Europe and towards being one of the most widely grown high alpha varieties in the US. Used predominately as a base bittering hop it features an exceptional growth rate, yield and superlative storage stability and is said to result in squeaky clean bitterness and subtle citrus-like flavors.",
332aea58-6f69-485d-9e00-6256210ceb51,Magnum (US),Bittering,14,,4.5,7,24,30,US,,,1.9,3,,,,,,,,,,,,"Magnum, Horizon, Northdown, Northern Brewer",Yakima Magnum,"Clean bittering, light citrus flavor","Magnum is grown on limited acreage in the US but what is produced has an excellent bittering profile and a nice, hoppy, floral aroma and subtle characters of citrus. Though genetically indistinguishable from the original German Magnum, some subtleties undoubtedly exist through varied growing conditions between the two countries. Both hops however are largely considered to be totally interchangeable.",
36378236-9b5a-4184-a7a9-f1dbc4e6e4a3,Mandarina Bavaria,,7,10,4,7,,,,,1.5 - 2.2,,,,,,,,,,,2.3,2.7,,,,,"Daughter of Cascade (US), Hallertau Blanc and Hüll Melon, Mandarina Bavaria originated in Hüll, Germany and was released to the brewing masses in 2012. It is useful for both flavor and aroma and imparts slightly sweet notes of tangerine and citrus, especially when used for dry hopping.","Pineapple, Lemon, Strawberry, Gooseberry, Cassis"
29147ae4-460a-464a-935e-7d39611e37b7,Marynka,,9,12,10.2,13,,,,,1.8 - 2.2,28,31,,,,,,,,,3.8,4.3,,,,,"Marynka hops are another widely produced Polish hop from the region Lublin. It is moderate in most things: yield, growth, stability, but her flavor profile is way above average. Despite being used primarily for bittering, Marynka features a forward, earthy and herbal flavors and aromas. It is the offspring of Brewer’s Gold and was official registered in 1988.","Hay, Liquorice, Lemon, Grapefruit, Aniseed"
2eb3835d-ff8a-41b2-b81b-ed8400b8161e,Mathon,,,,,,,,,,,,,,,,,,,,,,,,,,,"The pedigree of the Mathon hop is a bit of a mystery. Early writings about hops indicate that both Mathon and Goldings were growing side by side as early as the late 1700’s. Writings today appear to suggest that it may have hailed specifically from Farnham Whitebine or Canterbury Whitebine in much the same way the Goldings varieties did. One this is for sure, it solidly features the pleasant aroma for which most Goldings hops are well known.",
a65a4bc8-7d3b-4200-8cf3-614434d6757c,Melba,,,,,,,,,,,,,,,,,,,,,,,,,,,"Bred by Ellerslie Hop Estate, Melba or “The Dame of Hops” as it is affectionately known, is a dual-use variety with high oil content and similarities to Galaxy. When used as an early addition, it is said to impart a clean and somewhat spicy bitterness. When used as an flavor or aroma addition though, properties of passionfruit, grapefruit and citrus come to the fore.",
d4ac0ca7-821c-4371-8e30-311764b66641,Merkur,,,,,,,,,,,,,,,,,,,,,,,,,,,"Merkur or Hallertau Merkur as it is sometimes known, is a high alpha bittering hop developed at the Hull Hops Research Institute in Germany. It was released in 2000. It’s not all about bittering potential though; Merkur boasts high myrcene and humulene oil content giving it an earthy grounding and citrus zing. It works especially well in the early to mid-stages of brewing. Merkur is a descendant of Magnum.",
e8e6a5b0-c5fb-4e9a-8f67-98b65f70c14e,Millennium,,14.5,16.5,4.3,5.3,,,,,1.8 - 2.2,30,40,,,,,,,,,,,,,,,"Millennium was, unsurprisingly, released in the year 2000. Emanating from the John I. Haas Breeding Program, Millennium hops are directly descended from Nugget and are considered similar in many ways to Columbus. They were born largely out of a desire for greater disease resistance and storage stability. They work well as a bittering agent in American-style ales, Stouts and are considered mild in character with an ability to impart herbaceous notes and elements of resin.","Strawberry, Elderflower, Chocolate, Toffee, Pear"
c94feb3f-ea86-4fa6-9fbf-797c7d5683a7,Monroe,,2.8,2.9,6.5,7.5,,,,," - ",,,,,,,,,,,4.4,4.8,,,,,,"Strawberry, Passion fruit, Cherry, Red currant, Plum"
60dc3318-c67b-4f4a-bd33-9e8473a37a34,Mosaic®,,11.5,13.5,3.2,3.9,,,,,1 - 1.5,47,61,,,,,,,,,,,,,,,"Released in 2012 by the Hop Breeding Company, LLC, Mosaic hops feature complex but clean flavor characteristics and are known for their triple-use profile encompassing bittering, flavor and aroma. They have high alpha acids but low cohumulone which makes them pleasantly hoppy, carrying flavors of mango, pine, citrus and herbs and aromas of tropical and stone fruit. Mosaic is the first daughter of Simcoe and Nugget as has been humorously referred to by some as “Citra on steroids”.","Gooseberry, Pear, Mandarin, Lime, Peach"
2e0d33c8-aac2-49ce-8887-d669b292e8a8,Motueka,"Bittering, Aroma",8.5,,5,5.5,29,,New Zealand,Retains 60%-70% alpha acid after 6 months storage at 20ºC (68ºF),Moderate to difficult,0.8,,47.7,,3.6,,2,,,,,,12.2%,"Saaz, Saaz (US), Sterling","B Saaz, Belgian Saaz",Tropical fruit and citrus,"Formerly known as Belgian Saaz or B Saaz, Motueka is a premier New Zealand hop. Developed by HortResearch, this triploid was bred from Saaz and an unnamed New Zealand breeding strain and lends itself well to Lagers, Pilsners and Belgian Ales.",
