7eeb1026-3508-482f-a1f0-485865517918,Sladek,,5,9,8,11,,,,,0.8 - 1,25,40,,,,,,,0.15,0.3,3.5,5,,,,,"Sladek, meaning ‘brewer’, is a high yielding aroma variety and cross between Saaz and Northern Brewer. Originally registered as VUCH 71 In 1987, it was renamed to Sladek in 1994. Sladek features a classic hoppy aroma atop a fruity flavor profile with essences of peach, passionfruit and grapefruit.","Passion fruit, Strawberry, Cassis, Grapefruit, Peach"
4a457bec-6fba-47b2-bd34-284ca8a018a3,Smaragd,"Bittering, Aroma",4,6,3.5,5.5,13,18,Germany,Retains 60%-70% alpha acid after 6 months storage at 20ºC (68ºF),0.4 - 0.8,0.7,1.7,20,40,30,50,9,14,0.9,1.4,4,6,1%,,"Emerald, German Emerald","Predominantly fruity aroma with bold floral notes, flavors of earth and spice","Smaragd is another interesting hop to come out of the Hop Research Institute in Hüll, Germany. Bred with the purpose of creating a more disease resistant alternative to Hallertau Mittelfrüh, it was released for large-scale production in 2007.","Camomile tea, Tarragon, Butter, Liquorice, Cognac"
82d00e20-c83c-437a-9382-0355537a46e4,Smooth Cone,"Bittering, Aroma",9.5,,3.4,5.2,31,31,New Zealand,Retains 60%-70% alpha acid after 6 months storage at 20ºC (68ºF),,0.38,1.14,55,,21,,6,,,,,,0%-1%,Cluster,SmoothCone,,"Smooth Cone is a New Zealand hop variety. It is no longer grown commercially but can still be found. Developed in the 1960’s, the variety was introduced alongside two other Black Root Rot resistant varieties, First Choice and Calicross after the disease savaged New Zealand’s hops industry during the mid 20th century.",
db73ac38-0c59-497d-aca4-ccc9244c8dc0,Sonnet,,,,,,,,,,,,,,,,,,,,,,,,,,,"Sonnet is a new, Oregon-grown hop said to have Saaz and Styrian Golding characteristics. It has a low alpha acid content and makes a nice aroma hop, exhibiting deeply floral, grassy and earthy notes alongside a balanced, rounded bitterness. Flavor-wise it is said to demonstrate some fruitiness with hints of oak and honey.",
be65ccdb-595e-4d4f-872d-cfed446c9777,Sorachi Ace,"Bittering, Aroma",12,16,6,7.5,23,28,Japan,,1 - 1.5,1.5,3,44,55,20,26,7,11,0.5,0.8,,,2%-5%,,,"Flavors of lemon citrus, orange, dill, cilantro","If you’ve ever enjoyed Sapporo, then you know what Sorachi Ace can do. Originally produced by the Sapporo Brewery in Hokkaido, Japan in the mid-1980s, it was resurrected in the US in 2006. It is a cross between Saaz, Brewer’s Gold and BeiKei No. 2.","Over-ripe orange, Lychee, Lemon grass"
fdbbba69-d8f3-4b10-b204-3d0d31a35e67,Southern Brewer,,,,,,,,,,,,,,,,,,,,,,,,,,,"Parent of Southern Promise, Southern Brewer was developed in the early 1970’s after the primary South African hops variety at the time, Golden Cluster, was devastated by black root rot. It is the result of an open pollinated cross of Fuggle.",
f9dce890-5c8a-4219-8b9a-a9a87d34c4f3,Southern Cross,,,,,,,,,,,,,,,,,,,,,,,,,,,Southern Cross was created by New Zealand’s HortResearch breeding program as a cross between Smooth Cone and the result of a Californian and English Fuggle. It was released in 1994.,
97d04e1b-7a4a-4b62-9076-86221dbf9b8a,Southern Promise,"Bittering, Aroma",11.5,,3.6,5.4,20,22,Slovenia,Retains 60%-70% alpha acid after 6 months storage at 20ºC (68ºF),Difficult,0.7,0.7,22,,26,26,9,,,,,,0%-1%,Southern Brewer,,"Smooth bitterness, woody, earthy","Southern Promise was bred specifically for the South African region. Created from Southern Brewer and a wild Slovenian male, it was developed in an effort to produce a variety that would grow well in areas with limited sunlight.",
ab31e136-e457-49c1-af6a-a9786d3022a3,Southern Star,,,,,,,,,,,,,,,,,,,,,,,,,,,"Released in 2001, Southern Star was developed in South Africa around 10 years after Outeniqua and Southern Promise. Like it’s two predecessors it is also considered a day neutral variety, meaning it can be grown in locations with reduced daylight. It is used primarily for bittering but also features a spicy, tangy flavor and some aroma.",
beb24739-7010-4089-9848-f386613ba821,Sovereign,Bittering,4.5,6.5,2.1,3.1,26,30,UK,,0.5 - 1,0.6,1,25,30,21,26,7.9,8.1,,,,,3.5%-3.7%,,,"Complex aroma, subtle notes of green-tea and vanilla","The granddaughter of Pioneer, Sovereign is an English variety bred at Wye College in the mid-1990s. Released in 2006, Sovereign is gaining respect for its complex and delicate aroma profile.","Quince, Gingerbread, Green pepper, Cherry"
8cf3dd4f-4818-443a-b0ee-96d78a7f7e1f,Spalt Spalter,,2.5,5.5,3,5,,,,,0.5 - 0.9,20,35,,,,,,,0.5,0.8,5,6,,,,,"Surely one of the world oldest hop varieties, Splat hops date back as far as the 8th century and in the 16th century they were the first variety to be granted the German hop seal – a historically significant certification system predating the current, German Hop Provenance Law. Grown primarily in the Spalt region of Germany, it is one of the original landrace hops.","Tea, Barrique, Ripe banana, Tonka beans, Woodruff"
1725e0ff-31f0-4773-aca3-0bd185744b88,Spalter Select,Aroma,3,6.5,2,5,20,28,Germany,Retains 60%-70% alpha acid after 6 months storage at 20ºC (68ºF),Difficult,0.5,1.2,40,50,15,20,6,8,1,1.5,4,5,10%-15%,"Saaz, Tettnanger, Spalt, Hersbrucker, Perle, Hallertau Tradition","Select Spalt, Spalt Select",,"Released in 1993, Spalter Select was bred in Hüll, Germany in an effort to increase yield potential and disease resistant and serve as a commercial replacement for Spalt. These efforts were quite successful.","Citrus, Woody, Black tea, Camomile blossom"
fdf32cbf-8c3b-4dce-b2c5-8c384e23ea36,Star,,,,,,,,,,,,,,,,,,,,,,,,,,,"Not to be confused with Southern Star, Star is an old Belgian land race variety, which is no longer grown commercially. It was largely discontinued due to poor vigor and yield but It is however still obtainable in small quantities for home brewing. It exhibits excellent storage stability and sports a lovely continental-type aroma.",
eee296c8-c2fe-485b-9e0f-910d2758b968,Sterling,"Bittering, Aroma",9,,4,6,21,28,US,Retains 60%-75% alpha acid after 6 months storage at 20ºC (68ºF),Difficult,0.6,1.9,44,48,19,23,5,8,,,,,11%-17%,Saaz,,"Spicy, citrus aroma, herbal notes","Sterling was successfully bred to overcome Saaz’s susceptibility to mildew. Developed over 8 years in Corvallis, Oregon it was released in 1998.",
5decef35-8109-4e9f-90f7-de3e15b96ce1,Sticklebract,"Bittering, Aroma",14.2,,7.5,8.5,40,45,New Zealand,Retains 60%-70% alpha acid after 6 months storage at 20ºC (68ºF),Difficult,0.76,1.72,51,64,8,11,3,6,,,,,4%-4.6%,Northern Brewer (GR),,Aromas of pine and citrus,Sticklebract is a dual-use New Zealand variety and another variety bred to stem the issues from Black Root Rot that were present in the country during the mid 20th century. It was selected as a seedling in the 1970’s from open pollinated First Choice.,
2989516a-2e12-448c-958f-3ab1c0f24918,Strisselspalt,Aroma,1.8,2.5,2.5,6,20,27,France,Retains 60%-70% alpha acid after 6 months storage at 20ºC (68ºF),Moderate,0.6,0.9,35,52,12,32,8,10.3,0.7,0.9,3.5,3.8,< 1%,"Liberty, Hallertau, Mt Hood, Crystal, Hersbrucker","French Strisselspalt, Strisselspalter","Pleasant continental-style aroma, herbal, floral, spicy, citrus, fruit","Strisselspalt hails from the Alsace region of France around Strasbourg and is likely related to German Spalt and/or Hersbrucker hops. Thought to be an old land race, its acreage is dwindling due to its inherent low yield but it survives largely on the back of a strong domestic demand for the variety.","Citrus, Lemon grass, Cassis, Grapefruit, Eukalyptus"
bbb8e99f-8a35-4dd7-b847-fe349d0c6eb8,Styrian Gold,,3.5,6.5,3.5,5.9,,,,,1.3 - 2.3,38,47,,,,,,,1.3,2.3,,,,,,,"Styrian Gold should not be confused with Styrian Golding (aka Savinjski Golding, technically a Fuggle-type hop). Styrian Gold is a Slovenian hop, bred from a Styrian Golding and a Slovenian wild male. It has a noble aroma and a balanced hoppiness, which in part stems from a relatively even alpha to beta acid ratio. Styrian Gold also benefits from good storage stability. It was released in 2009.","Oregano, Honey, Hay, Basil, Nettle"
732bd6f9-138a-4581-b14a-aa1b3beb571a,Styrian Golding,,4.5,6,2.5,3.5,,,,,0.5 - 1,27,33,,,,,,,0.8,1,,,,,,,"Styrian Golding or Savinjski Golding as it is commonly known, goes by a multitude of sometimes confusing aliases. Confusing still is the fact it actually doesn’t come from a Golding at all, but is rather the result of the clonal selection of Fuggle and as such exhibits many Fuggle-like characteristics.","Lemon tea, Peppermint, Lemon grass"
1d742a93-f4b8-4068-be81-47bbaff2ebdd,Styrian Wolf,"Bittering, Aroma",18.5,,5,6,22,23,Slovenia,,,2.2,3.6,60,70,5,9,2,3,,,,,4.5%-6.5%,,Wolf,,"Developed by the Slovenian Institute for Hop Research and Brewing, Styrian Wolf is one of the latest Styrian hops on the market. When brewed, expect intense fruity and floral notes. These include flavors of sweet tropical fruits and complex aromas of mango, elderflower and even a hint of violet.",
6c25deb4-8103-4637-b5cf-1094ba0b3c43,Sybilla,,6.5,8,3,5,,,,,1.2 - 2.1,30,50,,,,,,,0.1,0.3,,,,,,,,"Chocolate, Orange, Gingerbread, Barrique, Tobacco"
c24a3495-6173-43bb-8d98-8153b3293014,Summer,,4,7,4.8,6.1,,,,,0.9 - 1.3,5,13,,,,,,,0.3,0.5,,,,,,,"It’s not difficult to see how the Australian hops variety, Summer, got its name after experiencing its sublime and delicate notes of apricot and melon. Others have even noted elements of grass, peach, passionfruit and citrus.","Vegetable, Fennel, Tarragon, Aniseed, Melissa"
0a302276-66cc-40af-bb0a-abc6bd877160,Summit™,Bittering,16,18,3.3,4.3,26,33,US,Retains 85%-85% alpha acid after 6 months storage at 20ºC (68ºF),Difficult,1.5,3,30,50,15,25,10,16,,,,,0%-1%,"Columbus, Simcoe®, Apollo",,Citrus aromas,"Developed in 1998 by The American Dwarf Hop Association, a joint hop breeding venture between the owners of Roy Farms, Wyckoff Farms and Green Acres Farms, Summit™ was released for brewing trials in 2000. It has the distinction of being the first semi-dwarf variety to be bred in the United States and is currently the only low trellis variety grown in the country. Its pedigree is decidedly complex, hailing from a combination of Nugget, Zeus and Lexus hops.","Wild garlic, Aniseed, Gooseberry, Incense, Pepper"
841c9f99-2030-4323-bb39-e16f36c1a7c4,Sun,Bittering,16,,4.5,7,30,40,US,,,,,55,70,10,15,5,10,,,,,1%,"Magnum, Galena, Zeus",,Pronounced herbaceous aroma and flavor,"Currently considered as in-development at the S. S. Steiner Hop Farms in Washington State, Sun has not yet been registered or acquired USDA accession. Not much is known about its lineage yet but it is thought to be derived from Brewer’s Gold and sister to Zeus. It has also been suggested that it possesses characteristic similarities to Galena.",
88e3790f-c114-4356-9485-c08b03859e7c,Sunbeam,,,,,,,,,,,,,,,,,,,,,,,,,,,"Not originally envisioned for use in brewing, Sunbeam is an ornamental hop that was discovered to be inadvertently useful as an aroma hop. Selected in 1992 in Corvallis, Oregon, it features characteristics similar to that of its parent variety, Saaz.",
0ed88a3f-c856-439d-bb46-f144dc05bf2c,Sunshine,Aroma,8.2,,2.1,3.1,34,,UK,Retains 50% alpha acid after 6 months storage at 20ºC (68ºF),,1.35,,55,,0.9,,,,,,,,,,,,"Mother to Comet, Sunshine was developed via open pollination seedling selection at Wye College in England. It was selected by Professor E. R. Salmon in the early 1930’s and exhibits a very similar oil profile to Comet.",
60c7da5b-c71a-431b-b84d-8220aa43b26f,Super Galena,,13,16,8,10,,,,,1.5 - 2.5,45,60,,,,,,,0.3,0.5,,,,,,,,"Plum, Juniper, Honey, Strawberries"
07b78c9b-1a14-4920-bdcf-c1a0d7f1fef9,Super Pride,Bittering,13,15.5,6.4,6.9,26.8,28,Australia,,1 - 1.4,2.1,2.6,19,34,1,2,5,8,0.3,0.6,,,0%-1%,Pride of Ringwood,,,"Super Pride is the offspring of Pride of Ringwood and a descendant of Yeoman. First bred at the Rostrevor Breeding Garden in Victoria in 1987 by Hop Products Australia, it was released in 1995 and since 2002 has become a mainstay bittering variety used in commercial beer production in Australia.","Spicy, Chocolate, Curry, Gingerbread, Marjoram"
4d87cc9a-d607-45ab-95a0-7eca0d54e041,Sussex,,,,,,,,,,,,,,,,,,,,,,,,,,,"Sussex hops are an award-winning dwarf variety discovered by Peter Cyster in Northiam, East Sussex in 2005. Its brewing use uncovers a powerful aroma alongside delicate tropical flavors and great flavor retention. It is considered to be forwardly fruity and its unique aroma afforded it third place in the hedgerow category of the Institute of Brewing and Distilling’s British Hop Competition in 2012.",
1365e3bb-b7b8-488b-adcc-932311295e11,Sylva,Aroma,7.3,,3,4.6,20,25,Australia,,,1,1.4,26,36,18,27,5,8,,,,,22%-28%,"Hallertau Mittelfrüh, Helga, Saaz","Australian Sylva, AU Sylva, Silva","Flavors of the forest and fresh-cut timber, subtle and hoppy bohemian-style aroma","Bred by Hop Products Australia in Tasmania in 1997, Sylva is an Australian aroma hop with a subtle and complex tasting profile. Progeny of Saaz, it is these roots that suit it well to light lagers and pilsners, imparting a bohemian-style hoppiness reminiscent of its Czech parent.",
bb3b82ec-cd0d-43fc-9e64-4cbe04450343,Symphony,,,,,,,,,,,,,,,,,,,,,,,,,,,Despite Symphony’s very high alpha content and excellent storage stability its extreme susceptibility to powdery mildew has largely deemed the variety untenable for commercial production.,
5ea21a79-7650-49d1-99d7-6cbba3aa9179,Tahoma,,7.2,8.2,8.5,9.5,,,,,1 - 2,67,72,,,,,,,,,,,,,,,"Released in 2013 by the USDA and Washington State University, Tahoma is the daughter of Glacier. With alpha content higher than its parent, Tahoma features very low cohumulone giving it a subtle, yet lovely lemon citrus aroma and flavor with undertones of orange, woodiness and spice.",
c8dacc6e-9a01-45a3-9734-254760c4efd9,Talus™,,8.1,9.5,8.3,10.2,,,,," - ",40,50,,,,,,,,,,,,,,,,"Pink Grapefruit, Pine, Resin, Dried Roses"
9b151299-5f6b-41dc-8493-1ba6b5768507,Talisman,,,,,,,,,,,,,,,,,,,,,,,,,,,"Released in 1965, Talisman is an American Cluster variety descended from Cluster. Peaking at 4.6% of total US hop production in 1973, the popularity of Talisman has steadily declined ever since. Currently, it is no longer grown commercially. It has fairly low alpha acids, although up to 8% AAU was recorded in the Yakima Valley.",
f759658a-3fda-46c8-94a5-7cb9f98fedc2,Tardif de Bourgogne,Aroma,5.5,,3.1,5.5,20,,France,Retains 66% alpha acid after 6 months storage at 20ºC (68ºF),,0.49,0.73,44,,13,,5.7,,,,,,0.2%,Precoce de Bourgogne,,"Mild, European-style aroma","Translated into English, Tardif de Bourgogne means Late Burgundy. Similar to Precoce de Bourgogne (Early Burgundy), it is an aroma hop grown in small quantities in the Alsace region of France.",
8a1f12a6-181f-41a3-a39b-c5dc5d60f581,Target,"Bittering, Aroma",12.5,,5,5.5,29,35,UK,Retains 45%-55% alpha acid after 6 months storage at 20ºC (68ºF),Difficult,1.6,2.6,17,22,8,10,0,1,,,,,0%-1%,"Fuggle, Willamette",Wye Target,,"English dual-use variety Target was released in 1992 and features a lineage including Northern Brewer and Eastwell Golding. Though being somewhat closely related, Target’s cousin, Challenger is considerably different.",
ac636501-0ddf-4021-a1c9-edd8ea10fc22,Teamaker,,,,,,,,,,,,,,,,,,,,,,,,,,,"Developed over several decades by the USDA, Teamaker hops were officially released by the ARS Forage, Seed and Cereal Research Unit in Corvallis, Oregon in the late 2000’s. They are a unique high beta, low alpha breed that have made their mark, not just in the brewing industry, but in the world of medicine and food as well.",
fa2cca84-aefc-4ea0-aaa4-d7338f2181e8,Tettnanger,"Bittering, Aroma",2.5,5.5,2.8,5.3,24,,Germany,Retains 61% alpha acid after 6 months storage at 20ºC (68ºF),0.5 - 0.9,0.36,1.07,40.6,,20.4,,6.2,,0.4,0.9,5,6,11.3%,"Saaz, Spalt, Santiam, Spalter Select, Tettnanger (US)","Tettnang, Tettnang Tettnanger, German Tettnang, Tettnanger (GR), Schwetzinger, Deutscher Frühopfen",Balanced floral and herbal aromas with some spiciness,"Selected from an old German landrace, Tettnanger is grown the world over. Swiss, US and Australian varieties can be found on the market today though some foreign versions labeled “Tettnanger” are actually a hybridized mix with Fuggle and not considered a true Tettnanger hop. Tettnanger is grown around its native village of Tettnang in southwest Germany and in small quantities near lake Konstanz in Switzerland.","Floral, Bergamot, Lily of the Valley, Cognac, Chocolate"
141a3747-533f-4dee-b29c-65ca472d38fd,Tettnanger (Swiss),,,,,,,,,,,,,,,,,,,,,,,,,,,"While it was initially thought to be the same variety as the original German Tettnanger, the Swiss-grown version is now considered to be genetically unique. While the original variety is also known to be cultivated in Switzerland, much of the branded Tettnanger (Swiss) product is actually Fuggle-derived. Despite this, it is higher yielding than its German Tettnanger counterpart and features a similar, noble aroma.",
0d40c7bb-d9c8-42c6-a715-0f031f21e6eb,Tettnanger (US),,,,,,,,,,,,,,,,,,,,,,,,,,,"This variety has created so much industry confusion. In fact, you can still find sites online that describe American Tettnanger as a true Tettnanger. In reality, it is a clone of rhizomes imported as Swiss Tettnanger.",
7788c3cd-2733-4dec-9025-5556a23eb390,Tettnanger A,,,,,,,,,,,,,,,,,,,,,,,,,,,"Tettnanger A was created in the 1970’s at the University of Hohenheim in Germany via clonal selection from the original Tettnanger hop. Sibling to Tettnanger B, Tettnanger A was originally thought to contain higher alpha percentages though testing in the US has brought this into question. It is said to have a pleasant, continental-style aroma and like it’s parent, is thought to be a descendant of Czech variety, Saaz.",
182ddd1e-47dc-49e3-aea1-83734d3835c8,Tettnanger B,,,,,,,,,,,,,,,,,,,,,,,,,,,"Sister to Tettnanger A, Tettnanger B was also thought to be superior to its parent through heightened levels of alpha. Through US testing however, this is now in question. Bred in the 1970’s through clonal selection from the original German Tettnanger hop, it features pleasant, continental-style aroma characteristics. It is also very likely descended from Czech variety, Saaz, a variety to which it is genetically similar.",
7045d0fd-15ac-4680-8a6f-ca05cfb58b9e,Tillicum®,,,,,,,,,,,,,,,,,,,,,,,,,,,"Daughter of Galena and sibling to Chelan®, Tillicum® is a proprietary hop trademarked and grown only by J.I. Haas of Toppenish, Washington in the Yakima valley. Developed in the late 1980’s and released in 1995 it is an excellent yielding hop that keeps well and has high average alpha and beta acid content. It’s said to share the stone fruit and citrus characteristics of its other family members.",
67df7dc4-0d4c-4ecd-97e1-ed0c4c7e375e,Tsingdao Flower,,6,8,3,4.2,,,,,0.4 - 0.8,45,55,,,,,,,,,,,,,,,,"Grapefruit, Cream, Cassis, Tabacco"
967fd27c-7fdc-4c44-8abe-b4e9dbf00e78,Tolhurst,Aroma,,,2.9,,31,,UK,Retains 49% alpha acid after 6 months storage at 20ºC (68ºF),,0.65,,42.5,,19.4,,7.7,,,,,,8.3%,,,Subdued but pleasant continental-style aroma,"Tolhurst hops were cultivated in the 1880’s by James Tolhurst in Horsmonden, England and are thought to have originated from an old land race. They feature a pleasant, but subdued continental-style aroma and are no longer grown commercially due to their low yield and dreadful storage stability.",
e512a5dd-2b77-4c05-a4c2-d836779ad9f7,Topaz™,,15.5,18,6,7,,,,,1.7 - 2.2,25,43,,,,,,,0.3,0.8,,,,,,,"Australian-born multi-purpose variety Topaz features elements of clove-like spice and a light, lychee-esque fruitiness. Samuel Adams uses it in their Tasman Red IPA. When used alongside a citrus-heavy hop (Samuel Adams used Galaxy®), it gives a surprising depth of flavor.","Blackberry, Grapefruit, Blueberry, Passion fruit, Spicy"
d51b4d48-1d69-400a-92c1-3a7ccc44947f,Toyomidori,Bittering,13,,5,6,40,,Japan,Retains 63% alpha acid after 6 months storage at 20ºC (68ºF),,1.06,,59,,9,12,4,5,,,,,Trace Amounts,,,,"Produced in Japan for Kirin Brewery Co in 1981 and released in 1990, Toyomidori has since been largely discontinued due to problems with downy mildew. It was developed alongside Kitamidori and Eastern Gold as a high alpha variety but was the least successful of the three in this respect.",
88b83dfb-ae33-42de-bfd5-4e1a6a9e5ffd,Triple Pearl,,10.3,11.2,3.3,4.2,,,,,1.1 - 1.8,39,55,,,,,,,,,,,,,,,,
69bb5aba-53eb-4daa-b44f-31ad491fb064,Triskel,Aroma,8,9,4,4.7,20,23,France,,1.5 - 2,1.5,2,60,,13.5,,6.1,,,,3.7,5.4,1%,"Strisselspalt, Ahtanum™, Centennial, Chinook, Simcoe®","French Triskel, FR Triskel","Floral aroma, subtly fruity, citrusy","Developed in France in 2006, Triskel is a cultivar of the French hop, Strisselspalt and English varietal, Yeoman. With a more pronounced nose than its French parent, Triskel makes a unique first wort alternative and its notable aroma qualities make it well suited as a late addition or for dry hopping. Highly desired for Belgian-style or lighter ales, it features and elegant combination of both floral and subtle fruity notes with some citrus.","Artichoken, Pepper, Tobacco, Honeydew melon, Nettle"
a1bf4ffd-5249-4ef9-953f-7f76b676620d,Ultra,Aroma,5,,3.6,5,25,35,US,Retains 60%-65% alpha acid after 6 months storage at 20ºC (68ºF),Difficult,0.8,1.2,25,35,30,40,10,15,,,,,0%-1%,"Tettnanger (GR), Saaz, Hallertauer Tradition, Liberty",,Midly spicy aroma and flavor,"Ultra hops have traditionally only been grown only in the United States and even then in somewhat limited qualities. They were developed in Oregon in 1983, released commercially in 1995 and are a triploid variety rich in humulene, giving them a mildly spicy aroma and flavor.",
d7b62ecb-912b-4d86-8f77-88ecaec1e7f2,Universal,"Bittering, Aroma",,,3.7,,23,,Czechia,,,,,,,,,,,,,,,,Hallertau,,Noble aromas and mild bitterness,"Universal was bred in Czechia, but as of 1991 is no longer listed as a commercial variety. It is however still being produced in the US and has since become a darling of the craft brewing industry.",
07cee62c-c1c3-4df4-988b-93be4d6e5384,Vanguard,,,,,,,,,,,,,,,,,,,,,,,,,,,Vanguard hops possess a unique acid profile. They feature a somewhat rare balance of low alpha acid and high beta acid and an oil profile dominated by high levels of humulene and yet very low levels of cohumulone.,
4444523c-e6da-4af9-a824-8da308d2bafe,Vic Secret,"Bittering, Aroma",14,17,6.1,7.8,51,56,Australia,,2.2 - 2.8,2.2,2.8,38,41,12,21,11,15,0.2,0.6,,,0%-1%,Galaxy,"Victoria, Victoria’s Secret, Victoria Secret","Tropical fruit, pine, herbs","Vic Secret had her first commercial harvest in 2013. Developed in 2000 in Victoria, Australia alongside sister variety Topaz, Vic Secret features elements of tropical fruit, herbs and pine with clean notes of pineapple and passionfruit.","Pineapple, Pepper, Ginger, Pear"
57083d1a-0133-487c-93d3-9e511019943c,Viking,Aroma,10,,4,5,21,24,UK,Retains 70% alpha acid after 6 months storage at 20ºC (68ºF),,1.16,,47.3,,10.5,,5.3,,,,,,9.1%,Saxon,Wye Viking,Pleasantly hoppy,"Developed in 1968, Viking hops were first bred at Wye College in England as a cross between Svalof and an unnamed English male. They were released to the public in 1973. Sister to Saxon and grandchild of Bramling Cross and Northdown, this hybrid red-bine variety is considered part of a modern wave of British aroma hops with heightened alpha acids.",
c890489b-5ccd-4687-9e1e-067ef623e0fd,Vital,,12,16,6,10,,,,,1.5 - 2.5,40,60,,,,,,,0.5,0.9,3.5,4.5,,,,,"Vital is a new hop variety out of the Zatec breeding program in Czechia. Both high alpha and beta acid content gives it a spicy hop aroma. To date, Vital has been used successfully in single-hopped pale ales though it was originally bred for pharmaceutical and biomedical purposes with its increased levels of xanthohumol – a potent antioxidant.","Plum, Lavender, Liquorice, Melissa"
a58a02a6-7d7e-437a-a248-e04b330874b7,Vojvodina,"Bittering, Aroma",10.5,,2.3,4.7,30,,Former Yugoslavia,Retains 76% alpha acid after 6 months storage at 20ºC (68ºF),,0.6,1.4,67,,13,,5,,,,,,0.6%,"Northern Brewer, Goldings",,Noble aroma characteristics,"The result of a cross between Northern Brewer and a Golding-derived male variety, Vojvodina is a hop with mild bittering properties, a woody aroma and notes of cedar and tobacco. It has some of the noble aroma characteristics of Northern Brewer, but is more intense and perhaps a little more rounded.",
7cd9508e-b201-44fa-8b68-2edb36b08211,Wai-iti,,,,,,,,,,,,,,,,,,,,,,,,,,,"A truly modern triploid hop, Wai-iti brings forth a fresh splash of lime and stone fruit. It was released to brewers in 2011 alongside Kohatu by New Zealand Plant & Food Research and features higher beta acids than alpha acids, low cohumulone and robust oil content.",
5a67b815-d3cb-4f2e-a019-df09a7ae4e32,Waimea,,,,,,,,,,,,,,,,,,,,,,,,,,,"Waimea is a new New Zealand dual-use variety originally bred for high alpha and bittering qualities. Released in 2012, it’s heritage stems from Californian Late Cluster, Fuggle and Saaz. Despite its incredibly high alphas, brewing characteristics of Waimea include some decidedly favorable flavor and aromas of fresh-crushed citrus and pine.",
7d6637b2-2299-4779-9c93-eb948172534b,Wakatu,"Bittering, Aroma",8.5,,8.5,,28,30,New Zealand,,,1,,36,,17,,8,,,,,,6.7%,,"Hallertau Aroma, New Zealand Wakatu, Hal Aroma","Floral, lime aromas","Wakatu, or Hallertau Aroma as it is sometimes know, is a New Zealand triploid hop with a lot going for it. 2/3 Hallertauer Mittelfrüher and 1/3 New Zealand male, it was released in 1988 from the New Zealand Institute for Plant and Food Research’s hop breeding program.",
