ID,Name,Purpose,Alpha Acid Low,Alpha Acid High,Beta Acid Low,Beta Acid High,Co-Humulone Low,Co-Humulone High,Country,Storability,Total Oil Composition,Myrcene Oil Low (mL/100g),Myrcene Oil High (mL/100g),Humulene Oil Low,Humulene Oil High,Caryophyllene Oil Low,Caryophyllene Oil High,Farnesene Oil Low,Farnesene Oil High,Linalool Oil Low,Linalool Oil High,Polyphenols Oil Low,Polyphenols Oil High,Substitutes,Style Guide,Also Known As,Characteristics,Description,Flavors
7b7f581b-1d58-4629-b626-0184d80f2828,Admiral,Bittering,13,16.2,4.8,6.1,37,45,UK,Retains 85% alpha acid after 6 months storage at 20 degrees C,Easy to moderate,1,1.7,39,48,23,26,6,7,0.8,1,,,1.8%-2.2%,"Chinook, Northdown, Challenger, Centennial, Cascade (US), Amarillo, Target",,Aggressive but smooth bittering with an orange-citrus and herbal resonance,"Admiral is an excellent mid-season hops variety derived from grandparent Challenger and likely parent, Northdown. Its exact lineage is unclear. Hailing from Wye College, England it was released to the brewing world in 1998 as a potential high-alpha replacement or complimentary addition to Target hops.","Tea, Ripe Kiwi, Lemony"
6a8c51d3-787f-4c0d-81f7-f9f3f78e69e0,Agnus,"Bittering, Aroma",9,12,4,6.5,4,6.5,Czechia,Fair to poor,2 - 3,2,3,40,55,15,20,8,10,0.4,0.8,2.3,3.5,1%,,,Strong spicy and herbal notes,"Agnus is the first high-alpha bittering hop to come out of the Czech Republic. It’s name is derived from Czech hop breeder Frantisek Beranek, who’s surname translated into Latin is Agnum – or Lamb in English. Registered in 2000 and released the following year, Agnus is a bittering hop with strong spicy and herbal notes and has been compared by some to Nugget and Magnum.","Lavender, Lovage, Leather, Tobacco"
b9e44b0d-5514-402e-90dd-571aa90160aa,Ahil,,,,,,,,,,,,,,,,,,,,,,,,,,,"Ahil hops are somewhat hard to come by with its cultivation in Slovenia having been severely reduced. There has also been some confusion over its true classification. It was introduced as a Superstyrian hop in 1972 care of hop breeder, Dr Tone Wagner at the Hop Research Institute in Zalec. In actuality though, it is not a Superstyrian, it’s a hybrid, a cross between Brewer’s Gold and a wild male and was only intended to be Superstyrian-like in style.",
c384a237-1825-4e40-806e-0726ac826751,Ahtanum™,,5.7,6.3,5,6.5,,,,,0.8 - 1.2,50,55,,,,,,,,,,,,,,,"Yakima Valley bred Ahtanum™ is sweet and peppery with a piney-citrus aspect. Warmly aromatic and moderately bittering, Ahtanum™ is a hop of distinction. It is often likened to Cascade though without going that far, it makes more sense to say that Cascade may be an acceptable substitute. In comparison, Ahtanum™ is less bitter, its alpha acids are lower and its grapefruit essence is significantly more pronounced. It really is more akin to Willamette, with its notes of lemon and grapefruit. Ahtanum’s distinct citrus character led to it being used as the singular hop in Dogfish Head’s Blood Orange Heffeweisen and Stone Brewing’s Pale Ale.","Apple blossom, Jasmine, Geranium, Tea, Elderflower"
185800bc-07ab-4ccb-baf4-076df3ae0600,Alliance,,,,,,,,,,,,,,,,,,,,,,,,,,,"Alliance is a daughter of Whitbread Golding and was developed at Wye College alongside Progress in the early 1960’s. It is not known to be grown commercially anywhere at this time. It enjoyed a high yield in England but this was much more inconsistent in US plots. Originally bred to replace Fuggle, but after it resulted in only a marginal improvement the variety was deemed a failure.",
5f5f08e6-5359-45e1-a2ce-5ec9d2db10e4,Amallia,,,,,,,,,,,,,,,,,,,,,,,,,,,"Native to New Mexico, Amallia is a neomexicana varietal with a deeply earthy aroma and pronounced flavors of orange citrus. Bold and unique, it is considered well suited to brown or dark ales for both bittering and aroma. This variety was being trialed in Michigan by Michigan State University researchers in 2014.",
aa9f3db3-bd8a-48c5-9371-ac4f422240b8,Amarillo™ VGXP01,,8,11,6,7,,,,,1.5 - 1.9,68,70,,,,,,,,,,,,,,,"Amarillo™ VGXP01 hops are used worldwide where its ultra-high myrcene content creates a delicious orange citrus flavor. A varietal of Virgil Gamache Farms, Inc. Amarillo™ VGXP01 is highly acidic, making it a perfect choice for for ESB’s and Pale Ales.","Black tea with lemon, Melon, Apricot, Grapefruit"
01d1f17e-194e-43c3-a360-2d3c6d21f497,Amethyst,,,,,,,,,,,,,,,,,,,,,,,,,,,"Amethyst is an aroma hop from the Czech Republic and is a derivative of Saaz. It features a notably low alpha acid percentage and notes of earthy, citrus and spice. Amethyst’s aroma profile is suited well to full-bodied lagers and pale ales.",
8a75e8d2-2542-4227-b6fb-703be5180dd1,Apollo,,,,,,,,,,,,,,,,,,,,,,,,,,,"Super-alpha hop Apollo was first bred in 2000 by Hopsteiner and released to the public in 2006. it is descended from Zeus and two other unnamed USDA varieties. It tends to be quite expensive, though quantities used tend to be smaller due to its ultra-high concentration of alpha-acids.",
0c3aa197-68b5-436b-8ec0-bfb05a9c74cb,Apolon,"Bittering, Aroma",12,,4,,2.25,,Slovenia,Retains 57% alpha acid after 6 months storage at 20ºC (68ºF),,1.3,1.6,63,,26,,4,,,,,,11.3%,,,,"Apolon hops are hard to come by with cultivation dwindling since its Super Styrian status was brought into question. Originally introduced as a Super Styrian in the 1970’s, it has since been reclassified as a Slovenian hybrid and is a cross between Brewer’s Gold and a Yugoslavian wild male.",
4bf0cc33-4866-488d-a3a5-f6272ef3a264,Aquila,,,,,,,,,,,,,,,,,,,,,,,,,,,"Aquila was developed in the U.S. and was established in three-acre commercial trials throughout the Northwest in 1988. It was officially released in 1994 but due to its overly high cohumulone content, its use was been considered limited and it is no longer available commercially. North American brewing giant Anheuser Busch lost interest in the variety in 1996, ultimately spelling a death knell for Aquila’s commercial record.",
e250ac5c-56ea-4b72-9dcd-903b2f3f4824,Aramis,Aroma,7.9,8.3,3.8,4.5,42,,France,,1.2 - 1.6,1.2,1.6,40,,21,,7.4,,,,3.6,5.1,2%-4%,"Willamette, Challenger, Ahtanum™, Strisselspalt, Centennial, Chinook, Hallertau, Tettnanger",,"Sweet with notes of spice, citrus and herbs","Aramis is an aroma hop from the Alsace region in France. Crossed in 2002, Aramis is a product of Strisselspalt and Whitbread Golding and was in fact the very first variety to come from the Comptoir Agricole breeding program. It inherited Strisselspalt’s excellent aromas while providing a more plentiful and stable bittering quality.","Mint, Lemon grass, Rose, Raspberry, Caramel"
67d2a73b-6ff7-49d1-a584-ade1c27812f7,Atlas,,,,,,,,,,,,,,,,,,,,,,,,,,,"Released in the 1970’s, Atlas enjoys both good bittering and aroma qualities with intense notes of lime, blossom and pine. Like its siblings Aurora, Ahil and Apolon, Atlas has been cut back in commercial production over industry confusion stemming from its incorrect classification as a Super Styrian. It’s a Slovenian breed but is in actuality a seedling of Brewer’s Gold. Developed by Dr Tone Wagner at the Hop Research Institute in Zalec, Atlas has also accomplished USDA accession.",
e7e25fb0-c742-4b28-8b32-6d57c0d4eb43,Ariana,,10,13,4.5,6,,,,,1.6 - 2.4,47,57.6,,,,,,,0.5,0.6,2.9,3.3,,,,,,"Passion fruit, Pineapple, Quince, Jasmine, Tangerine"
a5b680d9-f07a-49d9-aead-43823d0cd353,Aurora,,7,9,3,5,,,,,0.9 - 1.4,35,53,,,,,,,,,,,,,,,"Diploid hybrid Aurora is the one Super Styrian still enjoying global commercial availability. In fact, it is quite a celebrated hop and one of two distinct varieties prominently produced in Slovenia. Developed as a seedling of Northern Brewer, Aurora’s aroma derives from its lovely balance of essential oils.","Bergamot, Lemon grass, Aniseed, Citrus, Flora"
71bf0507-4e2e-4fd2-b4f5-7906d018fb34,Azacca™,"Bittering, Aroma",14,16,4,5.5,38,45,US,,1.4 - 2,1.6,2.5,46,55,14,18,8,12,,,,,< 1%,,Azaaca,"Aromas of tropical fruits and citrus. Tasting notes of spicy mango, pineapple, tangerine and pine.","Named after the Haitian god of agriculture, Azacca is one of a new brood of dwarf bittering hops. Descended directly from Toyomidori, its greater parentage also includes Summit™ and Northern Brewer. Bred by the American Dwarf Hop Association, a joint hop breeding venture between Roy Farms, Wyckoff Farms and Green Acres Farms, Azacca is considered by many brewers as being well suited to IPAs.","Gooseberry, Celeriac, Grapefruit, Pineapple, Peach"
1734eae2-7961-431b-9e11-077a88c8d133,Backa,,,,,,,,,,,,,,,,,,,,,,,,,,,"Dating back to 1956, Backa is an old, rare variety of aroma hop with an unknown land race pedigree. It has the potential for high yield in its native Backa region of Serbia (formerly Yugoslavia) but doesn’t seem to do all that well elsewhere. It’s highly aromatic and is said to have similar qualities to many European “Noble Hops”. The USDA lists two strains of Backa (56002) and (21080), but there seems to be some disagreement as to whether or not they are identical.",
701c8e55-85df-47a8-a423-b6e82e555c4c,Banner,,,,,,,,,,,,,,,,,,,,,,,,,,,"Banner did not fare well on the commercial market. Bred from a Brewer’s Gold seedling in the early 1970’s through open pollination, its first test plot was abandoned due to severe mildew problems.",
ed00d84b-4607-4216-b0fa-c8b7adb69a8b,Bate’s Brewer,,,,,,,,,,,,,,,,,,,,,,,,,,,"Bate’s Brewer is a very old hop variety that is no longer grown. Used to breed Whitbread Golding, it — much like it’s progeny — is not considered to be a true Golding variety. It was used extensively by Wye College in the early 1900’s to breed new varieties.",
005fcde1-7015-42ac-9359-1f00e597f557,Belma®,"Bittering, Aroma",12.1,,,,,,US,,,,,,,,,,,,,,,,,,"Notes of orange, melon, strawberry, pineapple with a hint of grapefruit","Belma® hops are a recent addition from Hops Direct and Puterbaugh Farms in the Yakima Valley. Belma has been tested as a dual-use hop and found to have an ambrosial mix of orange, melon, strawberry and pineapple with a slight hint of grapefruit. Backing that up, OSU created a Pale Malt with Belma which carried those same aroma and flavor characteristics.",
8b9c74b6-ae1b-4f46-8dea-256090a44e1a,Bianca,,,,,,,,,,,,,,,,,,,,,,,,,,,"Bianca (a.k.a. Bianco and Bianca Gold), with its lemon yellow color and red-brown to pink contrasting stem, is bred strictly as an ornamental hop. It must be grown in semi-shaded areas as its light leaves are subject to leaf burn in the sun. While not bred for commercial use, it is said that the cones can be used for flavoring if a Saazer-style aroma and taste is desired. Sunbeam, Bianca’s half-sister has similar characteristics.",
9a2eaa28-047b-4715-88f9-7f863678cce9,Bitter Gold,Bittering,18.8,,6.1,8,36,41,US,Retains 55.6% alpha acid after 6 months storage at 20ºC (68ºF),,0.81,3.92,68.2,,7.5,,8.4,,,,,,1.2%,"Galena, Nugget",,"Use for bittering only, has no notable aroma","Super-alpha variety Bitter Gold’s heritage comes from varieties Bullion, Brewer’s Gold, Comet and Fuggle. It features an alpha-acid percentage higher than any of its parents and higher even than Galena or Nugget, to which it is often compared.",
b1242e5a-5012-44e2-a790-762b6f38f8b1,Blato,,,,,,,,,,,,,,,,,,,,,,,,,,,"Blato was one of the first hops authorized in Czechia (formerly Czechoslovakia) for commercial production. It is not usually singled out, but is one of the collective known as Saaz Hops, or Bohemian Early Red. It doesn’t yield very well in the U.S., but it is suspected to be much more prolific in its native homeland. Zatec Hop Company in Czechia states that in the analysis of the oils and resins, Blato and its siblings have proven to have the same fine aromatic profile of other Saaz hops one that is genuine and delicate.",
fa0f9a77-dae0-4347-96a5-8478a8f2d863,Blisk,,,,,,,,,,,,,,,,,,,,,,,,,,,"Dating back to the late 1970’s, Blisk was bred in its native Zalec region of Slovenia, along with Bobek and Buket in an attempt to instil both high alpha content and pleasant aroma in one cultivar. It is a cross between Atlas and a male varietal from the former Yugoslavia. Despite its decent yield, Blisk is not being commercially produced.",
3b226a83-ea05-4a75-a0df-d3d1b8c9f7b7,Blue Northern Brewer,,,,,,,,,,,,,,,,,,,,,,,,,,,The Blue Northern Brewer was discovered as a mutant with deep reddish-blue leaves growing in a Belgian hop yard in the early 1970’s. It was released as an ornamental variety in 1992. Its use for brewing is plausible but tentative.,
257f7058-f877-4aa8-9524-21380ac2886c,Boadicea,Aroma,8,9,3,4,26,,UK,,1.3 - 1.5,1.4,2,33,,20,,15,19,0.2,0.4,,,5%,,,Delicate aroma of orchard blossoms and grass. Subtle spicy character.,"Released in 2004, Boadicea is a finishing hop bred by Horticulture Research International. Known as the first aphid-resistant variety in the world, it also exhibits excellent resistance to wilt and downy mildew. As a dwarf/hedgerow variety, it grows to a shorter height than traditional varieties and yields just the same, making it an easier prospect to harvest.","Peppermint, Barrique, Tobacco, Lime, Liquorice"
f370e49a-7aa5-4b22-b8d7-322ed0973f51,Bobek,,3.5,7.8,4,6.1,,,,,0.7 - 4,49,77,,,,,,,0.9,1.3,,,,,,,"Diploid hybrid Bobek features a pleasant floral aroma. Bred in its native Zalec region of Slovenia alongside Blisk and Buket, Bobek was an attempt to create both high alpha and good aroma in one cultivar. Bobek is not being commercially produced at this time. Its parents are Northern Brewer and a Slovenian male.","Artichoke, Hay, Lemon, Sage"
fe264a1a-07dc-4656-b108-231cee535181,BOR,Aroma,3,,3,4,14,20,US,Retains 67% alpha acid after 6 months storage at 20ºC (68ºF),,0.65,,21,,46,,13,,,,,,Trace Amounts,,BOR 704,,"Selected by Dr Bob Romanko, BOR 704 was so named for it’s planting position, row 7, plant 04, in the Prosser “Bone Yard” in the Yakima Valley. It features an aroma profile that is distinctly European. While BOR exhibits a relatively poor yield, it has been used to breed other seedlings in an effort to pass on its low cohumulone rate that is sometimes as low as 14%. However, its low alpha content has hindered it from gaining any successful foothold in commercial hops production.",
7c6d82fc-a934-4c34-8108-f679e2bcd6eb,Bouclier,"Bittering, Aroma",9,,2.4,3.3,20,25,UK / France,,,1.1,1.6,38,,34,,3.4,,,,,,,,,"Aromas of herb, grass and spice alongside a citrus and floral character","Emerging in 2005, Bouclier is a cross between Alsace-grown Strisselspalt and a wild male from Wye, Kent. It is unclear however if this variety was first developed in the UK or across the Channel in France.",
b7047c2c-a0be-4ea8-a739-93431038b9c8,Bramling,,,,,,,,,,,,,,,,,,,,,,,,,,,Bramling was a popular and prolific hop in England around the turn of the 20th century and it is known to have been widely cultivated by 1865 for use in golden and rye ales primarily. But its increasingly low yield has caused it to fall out of favor. It is grown in British Columbia for Canadian breweries desiring aroma hops. Its origin is unknown. Its profile is of very low alpha acids and moderately low cohumulone. It is said to have a pleasant European aroma profile.,
23d470c6-949e-4b0f-8daf-e48eb0a8b9d9,Bramling Cross,,6,7,2.2,2.8,,,,,0.7 - 1,34,38,,,,,,,,,,,,,,,Bramling Cross is a rather rare breed and is mostly available in the UK. First harvested in 1927 at Wye College its lineage is a cross between Golding and a wild Manitoban (Canadian) hop. It is considered well suited to cask conditioned recipes as well as Christmas and fruit beers.,"Chrysanthemum, Bitter grapefruit, Caramel, Gooseberry, Vanilla"
238c5720-7cd3-45d6-8a48-fe7b833bfb91,Bravo,Bittering,17,,3,5,29,34,US,Retains 70% alpha acid after 6 months storage at 20ºC (68ºF),Difficult,1.6,2.4,25,50,18,20,10,12,,,,,0%-1%,"Columbus, Zeus, Apollo, Magnum, Nugget",,"Spicy, earthy, and lightly floral aroma","Bravo’s high alpha content is largely attributable to its parent variety, Zeus. It’s bittering quality is considered smooth and in addition features light floral aromas and subtle flavors of orange and stone fruit making it highly desirable for use in many different ale styles.",
9eff0dea-6b6c-4b46-854b-88772cdc92ad,Brewer’s Gold,,4.5,6.5,2.5,3.5,,,,,0.8 - 1.8,40,50,,,,,,,,,,,,,,,"Brewer’s Gold hops were selected by Ernest Stanley Salmon at Wye College in England in 1919 and were the result of the open pollination of a wild hop sourced from Morden, Manitoba. Despite its initial popularity, the advent of super-alpha hop varieties in the 1980’s rendered Brewer’s Gold largely redundant from a commercial perspective.","Lemon, Redcurrant, Melissa, Spices"
0a6abb37-c825-4df8-b222-4c0fd6fa2124,Brewer’s Gold (US),Bittering,13.1,,3.7,6.8,41,,US,Poor,,1.8,,40,,35,,35,,,,,,Trace,"Bullion, Cascade, Galena, Northern Brewer, Northdown",,,"Sister to Bullion, US-grown Brewer’s Gold is a cultivar of the original English variety, Brewer’s Gold. Despite having been developed in England, its origin is undoubtedly North American having been initially derived from a wild hop sourced from Canada’s Pembina Valley in Manitoba. The American version is naturally similar to the original but contains higher alpha acids on average.",
87dc4eb7-ca0f-4fc4-8bab-bc7975db537c,Buket,,,,,,,,,,,,,,,,,,,,,,,,,,,Buket is a 2nd generation Fuggle and offspring of Northern Brewer. It was first bred in the Zalec region of Slovenia in the mid 1970’s alongside Bobek and Blisk. Inspiration for all three of these hops was down to attempts by researchers to create both high alpha and good aroma in one cultivar. It has not been used to any great extent commercially since its creation.,
ed53c8e8-fdb6-4672-807e-69e15e7564e3,Bullion,,,,,,,,,,,,,,,,,,,,,,,,,,,"Sister selection to Brewer’s Gold, Bullion was first bred in 1919 at Wye College, England and originates from a wild hop cutting sourced from Manitoba, Canada. It was officially released in 1938.",
df09125d-c33a-4799-8e0f-a1352c343ee9,Bullion 10A,,,,,,,,,,,,,,,,,,,,,,,,,,,"Though technically still Bullion, Bullion 10A is a heat-treated and meristem-tip cultured version of the original English variety. Developed by the USDA and released in 1972, it was retired from production in the US in 1985 along with the original Bullion following the introduction of super-alpha varieties.",
99aeb287-15d0-4fd6-8f4d-c7b58c81bb5f,Buzz Bullets,,,,,,,,,,,,,,,,,,,,,,,,,,,Buzz Bullets is a proprietary blend created by Yakima Valley Hops. It is said to have a clean bitterness and impart some floral and citrus notes.,
cd2f2333-0c87-45af-a8fc-6df2c36a6466,Calicross,,,,,,,,,,,,,,,,,,,,,,,,,,,"New Zealand’s Calicross emerged in the 1960’s and by-and-large disappeared by the 1980’s. Born out of a dire need for disease resistant varieties, Calicross was created as a cross between Fuggle and Late Cluster – the later being the crop decimated in the late 1940’s by Black Root Rot.",
f6883209-e219-4a82-a313-bc5dc342da62,Caliente,,,,,,,,,,,,,,,,,,,,,,,,,,,"Caliente means “hot” in Spanish. That is, temperature hot and not spicy hot. It isn’t clear exactly why this particular variety was named that but it appears to be reasonably well received by the craft brew market featuring in quite a few commercial brews to date. There is some difference of opinion on it’s exact tasting notes but it has been said to impart flavors of citrus, peach, pine and even cherry along with distinct aromas of stone fruit and mandarin. Subtle aromas of peach have also been documented.",
bd5b3f71-f864-476b-925d-53a5bc276da7,California Cluster,,,,,,,,,,,,,,,,,,,,,,,,,,,"Generally considered to be indistinguishable from other Cluster varieties, California Cluster is a true dual use hop. Used prolifically by US brewers in the early-to-mid 1900’s, Clusters were widely available and cheap – providing a generic but pleasant bitterness and flavor.",
3d74c590-98b4-4903-ac27-1eed4924995b,Calypso,,,,,,,,,,,,,,,,,,,,,,,,,,,"Calypso is a Yakima Valley bred, dual-purpose diploid hop with Hopsteiner lineage on both sides. Despite its aroma-focused origins, it boasts a high alpha acid percentage. In addition to this, Calypso features crisp, fruity aromas and flavors that exhibit elements of apple, pear and stone fruit brightened with hints of lime citrus. It is marvellously complex with an almost understated earthy, tea-like note.",
fb84c981-921c-4614-96c8-fce9e9a46aef,Canadian Redvine,Aroma,,,5,6,47,,Canada,Retains 80% alpha acid after 6 months storage at 20ºC (68ºF),,11.2,,70,,2,,2,,,,,,4%-7%,"Newport, Magnum, Galena",,"Mild cherry flavor, grapefruit peel aroma","Canadian Redvine, with its dense and profuse rhizomes, high vigor, excellent yield and disease resistance makes it seem like an interesting prospect but with such a high cohumulone content and low alphas, it is not widely used. It is said to impart mild flavors of cherry, berries, pine and even citrus.",
f7427d49-9285-4c18-92cc-f68a6e8466f7,Canterbury Whitebine,,,,,,,,,,,,,,,,,,,,,,,,,,,"Well over 200 years old, Canterbury Whitebine is the cultivar from which the first Goldings were cloned in 1790. Around this time, Whitebine was grown prolifically in Farnham, Canterbury and in Hampshire. Limited information can be found on it except that in its wild state, it gave rise to several different varieties, each suited to be grown in various regions of the UK. Cobb hops are an example and were selected from a field of Canterbury Whitebine in 1881. Mathon hops have also been stated to share Canterbury Whitebine’s “botanical” character. Anecdotally, it is said to impart a delicate and pleasant flavor.",
5ff020a4-ea06-4957-80a2-d44321e55592,Callista,,2,5,5,10,,,,,1.4 - 2.1,54,63.5,,,,,,,,,4.1,6.2,,,,,,"Strawberry, Pear, Caramel, Passion fruit, Orange"
9690bd93-6019-425a-88cf-89d7baef6156,Cascade (Argentina),,,,,,,,,,,,,,,,,,,,,,,,,,,"Unlike the American Cascade, the Argentine Cascade has a mellow character with notes of lemongrass, pepper and spice. It is not considered interchangeable with the American Cascade, which has a very different profile. It is a fine aroma and finishing hop, excellent for wheat beers, blondes and has been suggested as being especially suited to lightly bittering a cream ale. Argentinian Cascade is often compared to Hallertau or Tettnanger.",
baabd348-d3f2-48b4-9b71-aeae516c7f5e,Cascade (Australia),Aroma,7,,5,7,33,40,Australia,,,0.8,1.3,40,60,40,60,3,9,,,,,5%-9%,"Hallertau, East Kent Golding",,Same as Cascade (US) but with notes of grapefruit,"Differing from other Cascades in its oil balance, Australian Cascade is predominantly produced in Tasmania. Descended from Fuggle, Serebrianka and wild Native American hops, when grown in Australia, it features all the characteristic citrusy, spicy, floral notes of American Cascade but with an additional delicate essence of grapefruit.",
1abb994f-949e-4f36-8eba-7e011050e6fe,Cascade (New Zealand),,,,,,,,,,,,,,,,,,,,,,,,,,,"New Zealand Cascade features largely the same pleasant and distinctive ‘Cascade’ characteristics enjoyed by its US twin but are higher in alpha acids. Some dispute this comparison however, noting that while its characteristics are similar, New Zealand grown Cascade is more subdued in both flavor and aroma. Original Cascade was developed from English variety Fuggle and the Russian variety, Serebrianka.",
c92bb64d-b790-4715-a2c2-939e92e14b0f,Cascade (US),,4.5,7,4.8,7,,,,,0.7 - 1.4,45,60,,,,,,,,,4.5,4.9,,,,,"Pioneered in the 1950’s by Jack Horner and his team at Oregon State University, Cascade hops have since gone on to become one of the most popular American hops of all time. Released in 1972, Cascade now represents around 10% of all hops grown in the United States.","Strawberry, Citrus, Blackberry, Lychee, Toffee"
e896e7b0-72c9-4012-8143-c658104bbe11,Cashmere,"Bittering, Aroma",7.7,9.1,3.3,7.1,22,24,US,Retains 75% alpha acid after 6 months storage at 20ºC (68ºF),1.2 - 1.4,1.2,1.4,39,42,26,29,12,13,,,,,1%,,,"Smooth bitterness, herbal aroma, flavors of lemon, lime and melon","Developed by Washington State University and released in 2013, Cashmere is the result of a marriage of Cascade and Northern Brewer. Fortuitously, it features alpha acids higher than that of Cascade.",
a1ceaa0e-6b97-4b74-b9cc-17330ffaa243,Cekin,,,,,,,,,,,,,,,,,,,,,,,,,,,"Like its sibling Cicero, Dr Dragica Kralj at the Hop Research Institute in Zalec, Slovenia originally selected Cekin in the 1980’s. It is a cross between Aurora and a Yugoslav male. It is not currently grown in large quantities commercially due to a lack of interest from breweries. Its vigor and yield are great in Slovenia but to date it has not proven itself in Corvallis test plots in the US. It is said to have a pleasing, distinctive and continental aroma comparable to Styrian Golding.",
5e0ad246-7a13-4484-b09e-f5c2e4ecd72f,Celeia,Aroma,3,6.5,3,4,25,,Slovenia,Retains 56% alpha acid after 6 months storage at 20ºC (68ºF),1.5 - 3.6,26,40,49.5,,17.6,,7.2,,0.6,1.2,,,5.6%,"Saaz, Bobek, Styrian Golding",,Floral and citrus aroma,"Celeia is the triploid offspring of Styrian Golding, Aurora and a Slovenian wild hop. It features an excellently balanced profile all around and very good storage stability. A versatile hop, it has seen widespread use in Lagers, Pilsners, English-style ales and ESBs. It loves deep clay soil and requires a large planting distance.","Lemon tea, Thyme, Peppermint, Lime"
